SightDate,Year,Month,Time,FishArea,Quadrant,Species,Count,Pod,LikelyPod,Comments,Channel,Source,ReportingParty
5/22/20,2020,5,,17C,2,Orca,8,,,ID: T46Bs,Orca Network,Public,Nicole Pidskalney
4/26/17,2017,4,10:30,17C,2,Orca,6,Ts,,,Orca Network,Public,Bruce Rousseau
7/27/17,2017,7,7:00,17C,2,Orca,7,,,,Orca Network,Public,Helena Hickman
8/22/17,2017,8,16:35,17C,2,Orca,8,Ts,,"T41s, T30A and others",Other,WW,Wild Whales Vancouver
6/14/18,2018,6,11:39,17C,4,Orca,8-Jul,Ts,,"T37's, T37A's and T34's",Other,WW,Wild Whales Vancouver
12/31/22,2022,12,14:10,7,176,Humpback,1,,,BCY1218 Kata,Orca Network,Reliable,Monika Wieland Shields
12/31/22,2022,12,13:15,29C,124,Humpback,8,,,,Orca Network,Public,Marina Roy
12/31/22,2022,12,12:32,18C,156,Humpback,1,,,,Orca Network,Public,Kim Thompson
12/31/22,2022,12,13:00,7,176,Humpback,1,,,BCY1218 Kata,Orca Network,Public,Selena Donker
12/31/22,2022,12,11:30,2-Aug,383,Gray,2,,,,Orca Network,Public,Peg Boley
6/15/18,2018,6,12:00,17C,5,Orca,~10,Ts,,T37's and T34's,Other,WW,Wild Whales Vancouver
6/22/17,2017,6,20:00,17C,5,Orca,3,Ts,,T46Bs,Orca Network,Public,Dan McIver
9/2/17,2017,9,15:33,29C,10,Orca,3,Ts,,T19s,Other,WW,Wild Whales Vancouver
7/3/17,2017,7,16:05,29C,10,Orca,11-Aug,Ts,,,Other,WW,Wild Whales Vancouver
12/30/22,2022,12,16:13,7,176,Humpback,1,,,,Orca Network,Public,Peter Van Deventer
12/30/22,2022,12,17:00,2-Aug,386,Gray,2,,,,Orca Network,Public,David Stern
12/30/22,2022,12,15:04,2-Aug,386,Gray,2,,,,Orca Network,Public,Melissa Simmons
10/14/18,2018,10,14:57,29C,11,Orca,9,Ts,,T101's + T2C's,Other,WW,Wild Whales Vancouver
10/14/18,2018,10,14:48,29C,11,Orca,~8,Ts,,Unknown,Other,WW,Wild Whales Vancouver
12/19/22,2022,12,16:12,2-Aug,383,Gray,1,,,,Orca Network,Public,Peg Boley
12/29/22,2022,12,9:26,2-Aug,378,Gray,1,,,CRC2440,Orca Network,Reliable,John C Storbeck
8/17/17,2017,8,15:30,29C,11,Orca,8,Ts,,T65As,Other,WW,Wild Whales Vancouver
6/20/17,2017,6,12:56,29C,11,Orca,3,Ts,,,Other,WW,Wild Whales Vancouver
5/29/22,2022,5,,29C,12,Orca,1,,T,,Orca Network,Public,Molly Borritt
12/28/22,2022,12,15:40,7,188,Humpback,2,,,,Orca Network,Reliable,Monika Wieland Shields
12/28/22,2022,12,14:35,7,192,Humpback,2,,,,Orca Network,Public,Josie Gillett
12/28/22,2022,12,11:48,7,181,Humpback,1,,,,Orca Network,Public,Piper Bishop
12/28/22,2022,12,15:00,1-Aug,375,Gray,1,,,CRC53,Orca Network,Public,Rachel Bernal
12/28/22,2022,12,12:35,2-Aug,381,Gray,1,,,CRC53 Little Patch,Orca Network,Public,Serena Tierra
12/28/22,2022,12,10:52,2-Aug,382,Gray,1,,,,Orca Network,Public,Kim Thomas
9/2/21,2021,9,15:20,29C,12,Orca,12,J,,IDs:J47Beh:Slow moving,BCCSN,Reliable,
12/26/22,2022,12,13:33,2-Aug,381,Gray,2,,,,Orca Network,Reliable,Marilyn Armbruster
12/26/22,2022,12,9:55,2-Aug,381,Gray,2,,,,Orca Network,Public,Michelle Sterett Bernson
12/23/22,2022,12,9:42,7,216,Humpback,2,,,,Orca Network,Reliable,Donna Sanders WSF
12/22/22,2022,12,14:20,2-Aug,383,Gray,1,,,,Orca Network,Public,Peg Boley
12/22/22,2022,12,13:40,2-Aug,383,Gray,1,,,,Orca Network,Public,Peg Boley
12/22/22,2022,12,8:40,2-Aug,382,Gray,1,,,CRC2440,Orca Network,Reliable,John C. Storbeck
12/21/22,2022,12,7:46,7,176,Humpback,2,,,,Orca Network,Public,April Van Deventer
12/21/22,2022,12,13:22,7,186,Humpback,,,,,Orca Network,Public,Peggy Schellen
12/21/22,2022,12,17:00,2-Aug,382,Gray,1,,,CRC2440,Orca Network,Reliable,John C. Storbeck
9/17/18,2018,9,11:20,29C,12,Orca,~19,K,,"K's (Lobo, Spock, Saturna, Cali) + Others",Other,WW,Wild Whales Vancouver
5/27/18,2018,5,11:15,29C,12,Orca,4,Ts,,T101's,Other,WW,Wild Whales Vancouver
12/20/22,2022,12,13:05,7,169,Humpback,2,,,,Orca Network,Public,M Elise Cannon
12/20/22,2022,12,8:57,7,192,Humpback,2,,,,Orca Network,Public,Dan Shelley
12/20/22,2022,12,8:40,2-Aug,382,Gray,1,,,CRC2440,Orca Network,Reliable,John C. Storbeck
5/19/18,2018,5,11:30,29C,12,Orca,4,Ts,,T101's,Other,WW,Wild Whales Vancouver
8/17/17,2017,8,13:38,29C,12,Orca,9,Ts,,T65As,Other,WW,Wild Whales Vancouver
12/19/22,2022,12,10:41,7,176,Humpback,1,,,,Orca Network,Public,M Elise Cannon
8/18/18,2018,8,10:37,29C,13,Orca,5-Apr,Ts,,Unknown,Other,WW,Wild Whales Vancouver
8/3/18,2018,8,12:33,29C,13,Orca,8,Ts,,T137's and T46's,Other,WW,Wild Whales Vancouver
5/6/18,2018,5,11:59,29C,13,Orca,4,Ts,,T101,Other,WW,Wild Whales Vancouver
9/15/17,2017,9,13:40,29C,13,Orca,2,Ts,,T101A and B,Other,WW,Wild Whales Vancouver
9/15/17,2017,9,12:02,29C,13,Orca,3,Ts,,"T101A, B and T102",Other,WW,Wild Whales Vancouver
12/17/22,2022,12,13:05,7,181,Humpback,2,,,,Orca Network,Public,Dori Dace
12/17/22,2022,12,12:25,9,388,Gray,1,,,CRC2440,Orca Network,Reliable,Justine Buckmaster
12/17/22,2022,12,14:35,2-Aug,383,Gray,1,,,CRC53 Little Patch,Orca Network,Public,Ling's Cetacean Photos
12/17/22,2022,12,13:28,2-Aug,383,Gray,1,,,,Orca Network,Public,Mary Eugenio
12/17/22,2022,12,12:34,2-Aug,383,Gray,1,,,CRC53 Little Patch,Orca Network,Reliable,Alisa Lemire Brooks
12/17/22,2022,12,11:48,2-Aug,383,Gray,1,,,CRC53 Little Patch,Orca Network,Reliable,Alisa Lemire Brooks
12/17/22,2022,12,10:45,2-Aug,383,Gray,1,,,,Orca Network,Reliable,Alisa Lemire Brooks
7/18/17,2017,7,11:12,29C,13,Orca,10,Ts,,"T36s, T99s, T37A, T37A1",Other,WW,Wild Whales Vancouver
7/18/17,2017,7,10:52,29C,13,Orca,8,Ts,,"T99s, T36Bs",Other,WW,Wild Whales Vancouver
6/20/17,2017,6,11:44,29C,13,Orca,3,Ts,,,Other,WW,Wild Whales Vancouver
5/28/17,2017,5,12:02,29C,13,Orca,3,Ts,,T123s,Other,WW,Wild Whales Vancouver
5/28/17,2017,5,11:50,29C,13,Orca,3,Ts,,T123s,Other,WW,Wild Whales Vancouver
5/28/17,2017,5,10:15,29C,13,Orca,3,Ts,,T123s,Other,WW,Wild Whales Vancouver
5/23/17,2017,5,11:14,29C,13,Orca,7-May,Ts,,T86As,Other,WW,Wild Whales Vancouver
5/23/17,2017,5,11:00,29C,13,Orca,6-Apr,Ts,,T86As,Other,WW,Wild Whales Vancouver
5/18/17,2017,5,10:56,29C,13,Orca,4,Ts,,"T101, T101A, T101B",Other,WW,Wild Whales Vancouver
12/16/22,2022,12,15:30,7,181,Humpback,1,,,,Orca Network,Public,Michael Noonan
12/16/22,2022,12,9:22,7,169,Humpback,1,,,,Orca Network,Public,Peter Van Deventer
12/16/22,2022,12,7:37,8,384,Gray,1,,,,Orca Network,Public,Grey Bonn
12/16/22,2022,12,11:59,2-Aug,383,Gray,2,,,CRC53 & CRC2440,Orca Network,Reliable,Stephanie Raymond
12/16/22,2022,12,11:03,2-Aug,383,Gray,1,,,CRC53,Orca Network,Reliable,Alisa Lemire Brooks
12/16/22,2022,12,9:40,2-Aug,383,Gray,1,,,CRC2440,Orca Network,Reliable,Sara Montour Lewis
12/27/20,2020,12,12:31,28C,14,Orca,1,,,"Hobbes heard from someone else that there was a stranded orca in the water near ""Vancouver, Canada"". Turned out to not be stranded.",Hotline,Reliable,Hobbes
6/1/19,2019,6,7:20,28C,14,Orca,,Ts,,,Other,Reliable,Jeanne Hyde
5/27/19,2019,5,9:30,28C,14,Orca,,Ts,,T123s and unkwn,Other,Reliable,Jeanne Hyde
12/15/22,2022,12,15:30,2-Aug,384,Gray,1,,,,Orca Network,Reliable,Marilyn Armbruster
12/15/22,2022,12,15:20,2-Aug,386,Gray,1,,,,Orca Network,Public,Melissa Simmons
12/15/22,2022,12,10:29,2-Aug,386,Gray,1,,,,Orca Network,Public,Donna George
5/23/19,2019,5,15:30,28C,14,Orca,,Ts,,,Other,Reliable,Jeanne Hyde
4/23/19,2019,4,10:00,28C,14,Orca,,Ts,,,Email,Reliable,Jeanne Hyde
6/28/18,2018,6,12:20,28C,14,Orca,~6,Ts,,T65's,Other,WW,Wild Whales Vancouver
6/28/18,2018,6,,28C,14,Orca,,Ts,,,Orca Network,Public,Vancouver Aquariums Ocean Wise Research Team
6/7/18,2018,6,,28C,14,Orca,,Ts,,T49As,Orca Network,Public,ChekNews
12/14/22,2022,12,0:30,7,181,Humpback,2,,,,Orca Network,Reliable,Michelline Halliday
12/14/22,2022,12,13:00,2-Aug,383,Gray,2,,,CRC53 & CRC 2440,Orca Network,Reliable,Cindi Crowder Rausch
12/14/22,2022,12,12:29,2-Aug,383,Gray,2,,,CRC53 & CRC2440,Orca Network,Public,Lings Cetacean Photos
12/14/22,2022,12,10:55,2-Aug,383,Gray,1,,,CRC53,Orca Network,Reliable,Cindi Crowder Rausch
12/14/22,2022,12,9:23,2-Aug,383,Gray,2,,,,Orca Network,Public,Luanne Seymour
12/12/22,2022,12,14:11,7,181,Humpback,2,,,,Orca Network,Public,Carol Kinkelaar Skully
12/12/22,2022,12,8:33,7,181,Humpback,2,,,,Orca Network,Public,Carol Kinkelaar Skully
12/12/22,2022,12,10:47,2-Aug,385,Gray,1,,,CRC2440,Orca Network,Reliable,Sara Montour Lewis
12/12/22,2022,12,12:40,2-Aug,383,Gray,1,,,CRC53 'Little Patch',Orca Network,Reliable,Alisa Lemire Brooks
12/12/22,2022,12,10:37,2-Aug,383,Gray,1,,,,Orca Network,Public,Mike Moberly
12/11/22,2022,12,14:52,7,181,Humpback,2,,,,Orca Network,Public,Alex McIntire
12/11/22,2022,12,11:15,7,181,Humpback,1,,,,Orca Network,Public,Chakong Thao
12/11/22,2022,12,0:05,7,181,Humpback,2,,,,Orca Network,Reliable,Michelline Halliday
12/11/22,2022,12,9:00,2-Aug,385,Gray,1,,,,Orca Network,Public,Alicia Higgs
12/10/22,2022,12,9:55,7,176,Humpback,1,,,,Orca Network,Public,Peter Van Deventer
1/11/18,2018,1,17:00,28C,14,Orca,5,,,residents or transients?,Other,TWM,Jeanne Hyde
12/8/22,2022,12,13:30,7,181,Humpback,2,,,,Orca Network,Public,Maren Custer
6/1/17,2017,6,9:15,28C,14,Orca,8,Ts,,T124As,Other,WW,Wild Whales Vancouver
8/24/18,2018,8,10:15,29C,15,Orca,4,Ts,,T100's,Other,WW,Wild Whales Vancouver
8/23/18,2018,8,10:44,29C,15,Orca,~5,Ts,,N/A,Other,WW,Wild Whales Vancouver
8/22/18,2018,8,18:15,29C,15,Orca,~15,Ts,,"T101's, T2C's, T99's",Other,WW,Wild Whales Vancouver
8/18/18,2018,8,10:42,29C,15,Orca,5-Apr,Ts,,Unknown,Other,WW,Wild Whales Vancouver
6/20/18,2018,6,10:10,29C,15,Orca,2,Ts,,T137A and T137B,Other,WW,Wild Whales Vancouver
6/5/18,2018,6,11:19,29C,15,Orca,4,Ts,,T124A's,Other,WW,Wild Whales Vancouver
5/27/18,2018,5,12:50,29C,15,Orca,4,Ts,,T101's,Other,WW,Wild Whales Vancouver
5/19/18,2018,5,12:45,29C,15,Orca,4,Ts,,T101's,Other,WW,Wild Whales Vancouver
12/8/22,2022,12,10:35,7,181,Humpback,1,,,,Orca Network,Reliable,Michelline Halliday
8/17/17,2017,8,12:50,29C,15,Orca,8,Ts,,,Other,WW,Wild Whales Vancouver
5/23/17,2017,5,11:45,29C,15,Orca,7,Ts,,T86As and T124Ds,Other,WW,Wild Whales Vancouver
12/7/22,2022,12,14:00,121C,,Humpback,2,,,,Orca Network,Public,George Holland
8/23/18,2018,8,11:15,29C,16,Orca,~10+,Ts,,T101's +?,Other,WW,Wild Whales Vancouver
6/28/18,2018,6,13:01,29C,16,Orca,6,Ts,,NA,Other,WW,Wild Whales Vancouver
12/6/22,2022,12,13:20,7,186,Humpback,2,,,,hotline,Reliable,Jeanne
12/6/22,2022,12,10:45,7,188,Humpback,2,,,,Orca Network,Reliable,Laura Baker WSF
12/6/22,2022,12,13:00,9,388,Gray,1,,,CRC 2440,Orca Network,Reliable,Jill Hein
12/6/22,2022,12,12:42,9,390,Gray,1,,,,Orca Network,Public,Steve Smith
12/6/22,2022,12,12:05,9,388,Gray,1,,,CRC2440,Orca Network,Reliable,Bonnie Gretz
10/15/17,2017,10,14:27,29C,16,Orca,2,Ts,,T18 and T19B,Other,WW,Wild Whales Vancouver
8/28/17,2017,8,13:57,29C,16,Orca,5,Ts,,T65As,Other,WW,Wild Whales Vancouver
5/28/17,2017,5,10:40,29C,16,Orca,3,Ts,,T123s,Other,WW,Wild Whales Vancouver
8/10/19,2019,8,12:00,28C,17,Orca,1,T,,T65A,Other,TWM,Jeanne Hyde
7/18/19,2019,7,19:00,28C,17,Orca,8,Ts,T77s,T77B id'ed by CWR-Melisa Pinnow,Orca Network,Public,Eric Wells
3/31/19,2019,3,15:20,28C,17,Orca,9,Ts,,"T36A's, T100's (ID by Melissa Pinnow on T36A1, T36A3, T100F, T100E, T100C, T100)",Orca Network,Public,Laurene Trudelle
12/5/22,2022,12,8:45,10,411,Humpback,1,,,CRC19820 Malachite,Orca Network,Reliable,Donna Hansen
12/5/22,2022,12,10:00,6,247,Gray,1,,,,Orca Network,Public,James Irving
6/22/19,2019,6,9:30,28C,17,Orca,12,,,,Other,Reliable,Jeanne Hyde
6/4/19,2019,6,10:00,28C,17,Orca,,Ts,,T101s,Other,Reliable,Jeanne Hyde
9/17/18,2018,9,10:00,28C,17,Orca,40,SRs,,"All day. J pod, K pod and some of L pod in Salish Sea",Other,TWM,Jeanne Hyde
12/4/22,2022,12,10:28,16C,,Humpback,5,,,,Orca Network,Public,Vern Hattle
12/4/22,2022,12,15:05,7,181,Humpback,2,,,,Orca Network,Reliable,Michelline Halliday
12/4/22,2022,12,11:45,7,186,Humpback,2,,,,Orca Network,Public,Sara Abrevaya Stein
12/4/22,2022,12,11:30,7,186,Humpback,2,,,,Orca Network,Reliable,Monika Wieland Shields
12/4/22,2022,12,7:30,11,417,Minke,1,,,,Orca Network,Reliable,Kyle Buffenmyer
8/26/18,2018,8,12:42,28C,17,Orca,5,Ts,,T87+T90's,Other,WW,Wild Whales Vancouver
6/4/18,2018,6,13:45,28C,17,Orca,,Ts,,T101A+,Orca Network,Public,Sydney Gass
10/21/17,2017,10,,28C,17,Orca,,,Ts,small group,Other,TWM,Jeanne Hyde
10/30/17,2017,10,11:45,28C,17,Orca,5,Ts,,"T101s, T046C2",Other,WW,Wild Whales Vancouver
12/3/22,2022,12,15:13,11,418,Gray,1,,,,Orca Network,Public,Sean Nelsen
12/2/22,2022,12,9:05,7,169,Humpback,1,,,,Orca Network,Public,Sara Cannon
12/2/22,2022,12,14:49,11,420,Humpback,1,,,,Orca Network,Public,Johnny Collard
10/15/17,2017,10,15:00,28C,17,Orca,4,Ts,,T18s and T19s,Other,WW,Wild Whales Vancouver
7/26/17,2017,7,15:25,28C,17,Orca,5,Ts,,,Other,WW,Wild Whales Vancouver
12/15/22,2022,12,15:03,28C,18,Orca,,,,,Other,SMRU,
12/14/22,2022,12,4:45,28C,18,Orca,,J,,,Orca Network,SMRU,
11/20/22,2022,11,19:51,28C,18,Orca,,J,,,Other,SMRU,
12/1/22,2022,12,9:33,7,181,Humpback,8,,,,Orca Network,Reliable,Michelline Halliday
12/1/22,2022,12,12:05,7,181,Humpback,4,,,,Orca Network,Reliable,Michelline Halliday
12/1/22,2022,12,14:00,7,181,Humpback,2,,,,Orca Network,Reliable,Michelline Halliday
11/17/22,2022,11,2:10,28C,18,Orca,,JKL,,,Other,SMRU,
10/10/22,2022,10,15:56,28C,18,Orca,,J,,,Other,SMRU,
6/8/19,2019,6,,28C,18,Orca,2,Ts,,,Orca Network,Public,Ralph Herten
4/16/19,2019,4,,28C,18,Orca,4,Ts,,T101s,Email,Reliable,Jeanne Hyde
6/12/19,2019,6,13:14,28C,18,Orca,4,Ts,,T124C and possibly T124As,Email,WW,Vancouver Island WW Co
4/23/19,2019,4,13:50,28C,18,Orca,4,Ts,,T49As,Email,WW,Vancouver Island WW Co
8/26/18,2018,8,9:30,28C,18,Orca,5,Ts,,T87 + 1 Male + T90's,Other,WW,Wild Whales Vancouver
6/28/18,2018,6,15:00,28C,18,Orca,8-Jun,Ts,,maybe 124A's,Other,WW,Wild Whales Vancouver
10/15/17,2017,10,15:30,28C,19,Orca,2,,Ts,,Orca Network,Public,Melissa Hafting
11/30/22,2022,11,11:27,17C,54,Humpback,4,,,,Orca Network,Public,Marcia
11/30/22,2022,11,14:05,7,169,Humpback,2,,,,Orca Network,Public,Sara Cannon
11/30/22,2022,11,12:10,7,176,Humpback,2,,,,Orca Network,Public,Sara Cannon
6/1/17,2017,6,11:27,28C,19,Orca,8,Ts,,T124As,Other,WW,Wild Whales Vancouver
8/28/21,2021,8,13:00,29C,20,Orca,4,L,,,Other,TWM,Jeanne Hyde
9/16/21,2021,9,13:04,29C,20,Orca,12,,L,Beh:Slow moving,BCCSN,Reliable,
11/29/22,2022,11,12:05,7,176,Humpback,2,,,,Orca Network,Public,Sara Cannon
11/29/22,2022,11,10:35,7,176,Humpback,2,,,,Orca Network,Public,Sara Cannon
5/22/19,2019,5,20:00,29C,20,Orca,4,Ts,,maybe T123s,Other,Reliable,Jeanne Hyde
9/5/19,2019,9,15:42,29C,20,Orca,4,Ts,,T123s,Email,WW,Vancouver Island WW Co
8/13/19,2019,8,12:20,29C,20,Orca,1,Ts,,T65S2,Email,WW,Vancouver Island WW Co
9/14/18,2018,9,,29C,20,Orca,60,JKLp,,"J pod, K pod, 18 L pod whales",Other,TWM,Jeanne Hyde
9/10/18,2018,9,,29C,20,Orca,42,JLp,,Js and 18Ls,Other,TWM,Jeanne Hyde
9/1/18,2018,9,18:00,29C,20,Orca,24,J,,,Other,TWM,Jeanne Hyde
11/28/22,2022,11,8:56,13,425,Humpback,1,,,,Orca Network,Public,Bill Sehmel
8/26/18,2018,8,10:45,29C,20,Orca,5,Ts,,T87+T90's,Other,WW,Wild Whales Vancouver
8/23/18,2018,8,12:35,29C,20,Orca,1,Ts,,Unknown (males),Other,WW,Wild Whales Vancouver
6/28/18,2018,6,15:00,29C,20,Orca,3,Ts,,Likely T124A's,Other,WW,Wild Whales Vancouver
5/1/18,2018,5,15:00,29C,20,Orca,7,Ts,,T123's T36A's,Other,WW,Wild Whales Vancouver
5/1/18,2018,5,14:29,29C,20,Orca,7,Ts,,T123's T36A's,Other,WW,Wild Whales Vancouver
6/28/18,2018,6,10:00,29C,20,Orca,,Ts,,T124As,Other,TWM,Jeanne Hyde
9/6/17,2017,9,,29C,20,Orca,,Ts,,,Other,TWM,Jeanne Hyde
10/15/17,2017,10,14:13,29C,20,Orca,4,Ts,,T18/T19,Other,WW,Prince Of Whales
11/27/22,2022,11,16:25,7,181,Humpback,2,,,,Orca Network,Public,Karma Montelobo
11/27/22,2022,11,12:10,7,181,Humpback,2,,,,Orca Network,Public,Petra Schindler-Carter
9/22/17,2017,9,,29C,20,Orca,,L,,No Js seen,Other,TWM,Jeanne Hyde
9/5/17,2017,9,,29C,20,Orca,,JK,,,Other,TWM,Jeanne Hyde
9/5/17,2017,9,12:30,29C,20,Orca,40-76,JKL,,,Other,WW,Wild Whales Vancouver
8/28/17,2017,8,13:00,29C,20,Orca,5,Ts,,T65As,Other,WW,Wild Whales Vancouver
7/18/17,2017,7,9:20,29C,20,Orca,5,Ts,,T99s,Other,WW,Wild Whales Vancouver
11/26/22,2022,11,12:38,13,423,Humpback,1,,,,Orca Network,Public,Jenna Driscoll
7/2/17,2017,7,15:15,29C,20,Orca,12,Ts,,,Other,WW,Wild Whales Vancouver
11/24/22,2022,11,15:00,6,336,Humpback,6,,,,Orca Network,Public,Shannon Dell
11/24/22,2022,11,16:00,13,423,Humpback,1,,,,Orca Network,Public,David Estroff
11/24/22,2022,11,11:30,11,422,Humpback,1,,,,Orca Network,Public,Lawrence Ingrassia
11/24/22,2022,11,7:15,2-Aug,385,Harbor Porpoise,7,,,,Orca Network,Public,Tom Nowak
11/23/22,2022,11,8:16,28C,,Humpback,3,,,,Orca Network,Public,Stewart Rawlings
11/22/22,2022,11,16:30,13,424,Humpback,1,,,,Orca Network,Public,Randy Witter
11/22/22,2022,11,9:07,8,384,Gray,1,,,,Orca Network,Public,Sara Sadid
11/21/22,2022,11,10:48,7,188,Humpback,3,,,,Orca Network,Reliable,Donna Sanders WSF
11/21/22,2022,11,10:00,9,394,Harbor Porpoise,8,,,,Orca Network,Reliable,Howard Garrett
11/20/22,2022,11,11:09,9,388,Humpback,1,,,,Orca Network,Public,Sam Lange
11/20/22,2022,11,12:16,13,424,Humpback,1,,,,Orca Network,Reliable,Jason Cook
11/20/22,2022,11,11:50,13,424,Humpback,1,,,,Orca Network,Public,Cathryn Rice
11/20/22,2022,11,13:15,1-Aug,375,Harbor Porpoise,150,,,,Orca Network,Reliable,Alisa Lemire Brooks
9/16/21,2021,9,15:05,29C,21,Orca,30,,L,"Beh:Slow moving,Feeding",BCCSN,Reliable,
9/16/21,2021,9,14:01,29C,21,Orca,30,,L,Beh:Breaching,BCCSN,Reliable,
8/3/18,2018,8,13:14,29C,21,Orca,8,Ts,,T137's and T46's,Other,WW,Wild Whales Vancouver
6/5/18,2018,6,12:36,29C,21,Orca,6,Ts,,T124A2's,Other,WW,Wild Whales Vancouver
5/27/18,2018,5,11:40,29C,21,Orca,4,Ts,,T101's,Other,WW,Wild Whales Vancouver
5/20/17,2017,5,13:40,29C,21,Orca,11,Ts,,"T100/T101, T100Bs as well",Other,WW,Prince Of Whales
10/9/17,2017,10,14:20,29C,21,Orca,5,Ts,,"T101s, T046C2",Other,WW,Wild Whales Vancouver
11/19/22,2022,11,7:15,7,181,Humpback,1,,,,Orca Network,Reliable,Michelline Halliday
11/19/22,2022,11,8:15,7,188,Humpback,3,,,,Orca Network,Reliable,Laura Baker WSF
1/19/22,2022,1,11:15,6,247,Gray,1,,,,Orca Network,Public,Sue Englert
11/18/22,2022,11,16:30,13,424,Humpback,1,,,Malachite,Orca Network,Public,Heather Benjamin
11/18/22,2022,11,10:43,13,424,Humpback,1,,,Malachite,Orca Network,Public,Jennifer Swenson
11/17/22,2022,11,13:16,13,424,Humpback,1,,,Malachite,Orca Network,Public,T.L. Stokes
11/17/22,2022,11,11:54,13,424,Humpback,1,,,,Orca Network,Public,David Bennett
11/17/22,2022,11,10:11,13,424,Humpback,1,,,Malachite,Orca Network,Public,Jennifer Swenson
11/17/22,2022,11,13:15,7,220,Gray,1,,,,Orca Network,Public,Cynthia Nielsen
11/16/22,2022,11,16:31,19C,236,Humpback,2,,,,Orca Network,Public,Cotton Rockwood
11/16/22,2022,11,9:16,19C,236,Humpback,6,,,,Orca Network,Public,Cotton Rockwood
11/16/22,2022,11,7:54,7,181,Humpback,1,,,,Orca Network,Reliable,Monika Wieland Shields
11/16/22,2022,11,16:45,13,424,Humpback,1,,,Malachite,Orca Network,Public,Heather Benjamin
11/16/22,2022,11,15:25,13,424,Humpback,1,,,,Orca Network,Public,Alexis WAA
11/16/22,2022,11,9:23,13,424,Humpback,1,,,,Orca Network,Public,Jennifer Swenson
11/16/22,2022,11,7:45,7,181,Minke,1,,,,Orca Network,Reliable,Monika Wieland Shields
9/30/17,2017,9,11:51,29C,21,Orca,25,J,,,Other,WW,Wild Whales Vancouver
11/15/22,2022,11,9:53,13,424,Humpback,1,,,Malachite,Orca Network,Public,Jennifer Swenson
11/15/22,2022,11,13:43,7,97,Gray,1,,,,Orca Network,Public,Sharri Tyas
11/14/22,2022,11,13:47,13,424,Humpback,1,,,,Orca Network,Public,Jennifer Burton Stolz
11/14/22,2022,11,10:30,13,424,Humpback,1,,,Malachite,Orca Network,Public,Jessie Keating
11/14/22,2022,11,9:00,13,424,Humpback,1,,,,Orca Network,Public,Molly McCutcheon
11/13/22,2022,11,10:12,9,400,Humpback,1,,,,Orca Network,Reliable,Sara Montour Lewis
11/13/22,2022,11,12:05,13,425,Humpback,1,,,,Orca Network,Public,Ricki Selva
11/13/22,2022,11,12:59,13,425,Humpback,1,,,,Orca Network,Public,Megan Pratt
11/12/22,2022,11,16:05,10,402,Humpback,1,,,,Orca Network,Reliable,Maija Holston WSF
11/12/22,2022,11,16:15,13,425,Humpback,1,,,Malachite,Orca Network,Public,Sara Richey Guenther
11/12/22,2022,11,8:42,13,424,Humpback,1,,,,Orca Network,Reliable,Jason Cook
11/11/22,2022,11,14:30,13,424,Humpback,1,,,,Orca Network,Public,Randy Witter
11/11/22,2022,11,1:09,13,424,Humpback,1,,,,Orca Network,Public,Jennifer Burton Stolz
11/11/22,2022,11,9:30,13,424,Humpback,1,,,,Orca Network,Public,Molly McCutcheon
11/11/22,2022,11,8:30,13,424,Humpback,1,,,Malachite,Orca Network,Public,Randy Witter
11/9/22,2022,11,13:00,7,169,Humpback,3,,,,Orca Network,Reliable,John Boyd
11/9/22,2022,11,14:35,9,392,Humpback,1,,,,Orca Network,Public,Ana Sing Deo
9/15/17,2017,9,14:17,29C,21,Orca,2,Ts,,T102 and T101B,Other,WW,Wild Whales Vancouver
11/8/22,2022,11,17:30,1-Aug,374,Humpback,1,,,,Orca Network,Public,Bethany
11/8/22,2022,11,9:38,18C,157,Humpback,1,,,,Orca Network,Public,Denis Barnard
9/6/17,2017,9,11:30,29C,21,Orca,4,Ts,,"T18, T19, T19B, T19C",Other,WW,Wild Whales Vancouver
9/5/17,2017,9,12:30,29C,21,Orca,30-40,JpL,,,Other,WW,Wild Whales Vancouver
11/6/22,2022,11,14:44,7,188,Humpback,2,,,,Orca Network,Public,Lauren McManus
11/6/22,2022,11,15:45,9,387,Humpback,1,,,,Orca Network,Public,Kate Pagan
11/5/22,2022,11,,9,389,Humpback,1,,,,Orca Network,Public,Lisa Tweter
11/5/22,2022,11,16:15,9,401,Humpback,1,,,,Orca Network,Reliable,Bart Rulon
11/5/22,2022,11,10:00,13,424,Humpback,1,,,CRC-19820 Malachite,Orca Network,Public,Ingrid Shumway
9/5/17,2017,9,11:22,29C,21,Orca,30-40,JpL,,,Other,WW,Wild Whales Vancouver
11/3/22,2022,11,13:12,7,187,Humpback,2,,,,Orca Network,Public,Julie Gralow
11/4/22,2022,11,10:12,7,188,Humpback,2,,,,Orca Network,Reliable,Donna Sanders WSF
9/5/17,2017,9,9:40,29C,21,Orca,60-76,Lp,,"L87, L77, L72, L92, L94, L41, L22, L89",Other,WW,Wild Whales Vancouver
9/5/22,2022,9,19:40,29C,22,Orca,,J,,,BCCSN,Reliable,
8/31/18,2018,8,13:35,29C,22,Orca,7,Ts,,T37's,Other,WW,Wild Whales Vancouver
11/3/22,2022,11,13:00,13,424,Humpback,1,,,Malachite,Orca Network,Public,Ingrid Shumway
11/3/22,2022,11,8:52,8,384,Gray,1,,,,Orca Network,Public,Kim Vest Gleason
11/2/22,2022,11,11:15,13,425,Humpback,1,,,,Orca Network,Public,Sarah Richey Guenther
5/19/18,2018,5,11:30,29C,22,Orca,4,Ts,,T101's,Other,WW,Wild Whales Vancouver
8/3/17,2017,8,13:22,29C,22,Orca,,Ts,,T117s and others,Other,WW,San Juan Clipper
9/13/21,2021,9,17:17,29C,23,Orca,2,,J,Beh:Slow moving,BCCSN,Reliable,
8/31/18,2018,8,12:00,29C,23,Orca,4,Ts,,T37A's,Other,WW,Wild Whales Vancouver
8/31/18,2018,8,12:10,29C,23,Orca,5,Ts,,T37A's including T37A1,Other,WW,Wild Whales Vancouver
8/31/18,2018,8,11:50,29C,23,Orca,4,Ts,,T37' Volker,Other,WW,Wild Whales Vancouver
11/1/22,2022,11,15:10,9,390,Humpback,1,,,,Orca Network,Public,Bill Setter
11/1/22,2022,11,9:36,7,188,Gray,1,,,,Orca Network,Reliable,Laura Baker WSF
9/22/17,2017,9,14:32,29C,23,Orca,20-30,L,,,Other,WW,Wild Whales Vancouver
8/28/21,2021,8,15:25,29C,24,Orca,5,L,,"IDs:L88Beh:Slow moving,Feeding,Breaching",BCCSN,Reliable,
9/5/22,2022,9,17:26,29C,25,Orca,,J,,,BCCSN,Reliable,
10/28/17,2017,10,16:00,17C,27,Orca,0,J,,,Other,WW,Wild Whales Vancouver
9/22/18,2018,9,13:15,17C,28,Orca,~6,SRs,,,Other,WW,Wild Whales Vancouver
8/28/18,2018,8,14:06,17C,29,Orca,4,Ts,,T99's,Other,WW,Wild Whales Vancouver
6/15/18,2018,6,11:23,17C,30,Orca,~10,Ts,,T37's and T34's,Other,WW,Wild Whales Vancouver
8/22/17,2017,8,13:45,17C,30,Orca,9,Ts,,"T41s, T30s",Other,WW,Wild Whales Vancouver
9/22/18,2018,9,12:15,17C,31,Orca,5,Ts,,Unknown,Other,WW,Wild Whales Vancouver
9/22/18,2018,9,12:05,17C,31,Orca,4,Ts,,Unknown,Other,WW,Wild Whales Vancouver
5/18/22,2022,5,5:13,17C,32,Orca,,J,,,BCCSN,Reliable,
5/18/22,2022,5,5:13,17C,32,Orca,,J,,,BCCSN,Reliable,
12/4/20,2020,12,,17C,32,Orca,,Js,,,Orca Network,Public,Mel Vincent
7/6/19,2019,7,14:45,17C,32,Orca,8,T,,T46Bs,Other,TWM,Jeanne Hyde
8/5/19,2019,8,15:00,17C,32,Orca,4,T,,T137s,Other,TWM,Jeanne Hyde
6/21/20,2020,6,11:00,17C,32,Orca,3,T,,T046B1s,Other,TWM,Jeanne Hyde
10/29/22,2022,10,16:00,18C,164,Humpback,3,,,,Orca Network,Public,Yves Tiberghien
10/29/22,2022,10,15:45,2-Aug,386,Humpback,1,,,,Orca Network,Reliable,"Maija Holston, WSF"
5/7/20,2020,5,15:00,17C,32,Orca,3,T,,"T049A, T049A3, A5",Other,TWM,Jeanne Hyde
5/3/20,2020,5,9:45,17C,32,Orca,2,,,,Other,TWM,Jeanne Hyde
12/4/20,2020,12,15:30,17C,32,Orca,24,J,,,Other,TWM,Jeanne Hyde
3/20/20,2020,3,15:00,17C,32,Orca,22,J,,,Other,TWM,Jeanne Hyde
10/28/22,2022,10,16:40,2-Aug,386,Gray,1,,,,Orca Network,Public,Gianpaolo Boccato
10/4/19,2019,10,13:06,17C,32,Orca,,Ts,,T37As and T18s,Email,WW,Vancouver Island WW Co
10/4/19,2019,10,13:01,17C,32,Orca,,Ts,,T37As and T18s,Email,WW,Vancouver Island WW Co
8/9/19,2019,8,17:32,17C,32,Orca,2,Ts,,T19 and T19B,Email,WW,Vancouver Island WW Co
8/9/19,2019,8,17:16,17C,32,Orca,2,Ts,,T19C and T18,Email,WW,Vancouver Island WW Co
3/14/18,2018,3,10:00,17C,32,Orca,6,,,Unidentified,Orca Network,Public,Howard Goshulak
10/24/22,2022,10,14:00,11,422,Humpback,1,,,Malachite,Orca Network,Public,Ted Hayes
10/23/22,2022,10,11:04,20C,262,Humpback,1,,,,Orca Network,Public,Lily WAA
10/23/22,2022,10,14:00,11,422,Humpback,1,,,Malachite,Orca Network,Reliable,Cherie StOurs
10/23/22,2022,10,13:45,11,422,Humpback,1,,,Malachite,Orca Network,Public,Thomas Frenock
10/23/22,2022,10,12:02,11,422,Humpback,1,,,,Orca Network,Public,Zeno Martin
10/23/22,2022,10,10:00,11,422,Humpback,1,,,Malachite,Orca Network,Reliable,Jason Cook
10/23/22,2022,10,9:00,8,384,Gray,1,,,,Orca Network,Public,John Storbeck
7/27/17,2017,7,8:30,17C,32,Orca,8-Jun,,Ts,assumed Ts,Other,TWM,Jeanne Hyde
7/17/20,2020,7,,17C,33,Orca,8,Ts,,"Behavior: Attempting to feed on a humpback calves, but failed when humpback adults rammed the orcas and eventually the orcas went elsewhere. ID: Tl'uk",Orca Network,Public,Kenneth O'Brien
10/22/22,2022,10,14:21,11,422,Humpback,1,,,Malachite,Orca Network,Public,Zeno Martin
10/22/22,2022,10,13:08,11,422,Humpback,1,,,Malachite,Orca Network,Reliable,Jason Cook
10/22/22,2022,10,11:32,11,418,Humpback,1,,,Malachite,Orca Network,Reliable,Jason Cook
10/22/22,2022,10,13:00,7,186,Dall's Porpoise,3,,,,Orca Network,Reliable,Cindi Crowder Rausch
5/17/20,2020,5,20:30,17C,33,Orca,5,,,,Other,TWM,Jeanne Hyde
4/5/20,2020,4,11:00,17C,33,Orca,22,J,,,Other,TWM,Jeanne Hyde
2/9/19,2019,2,16:30,17C,33,Orca,3,,,Sigthing 16:30-18:00,Orca Network,Public,Juli Wild
8/18/19,2019,8,11:33,17C,33,Orca,,Ts,,T46Bs and T46s,Email,WW,Vancouver Island WW Co
10/21/22,2022,10,17:03,11,422,Humpback,1,,,Malachite,Orca Network,Reliable,Jason Cook
10/21/22,2022,10,12:45,11,422,Humpback,1,,,Malachite,Orca Network,Public,Stace Gordon
10/21/22,2022,10,16:23,10,405,Gray,1,,,,Orca Network,Reliable,Alisa Lemire Brooks
8/18/19,2019,8,11:01,17C,33,Orca,,Ts,,"T46Bs, T46s",Email,WW,Vancouver Island WW Co
8/4/19,2019,8,10:45,17C,33,Orca,5,Ts,,T65As minus T65A2,Email,WW,Vancouver Island WW Co
7/26/19,2019,7,12:26,17C,33,Orca,4,T,,T101s,Email,WW,Vancouver Island WW Co
10/20/22,2022,10,17:00,11,420,Humpback,1,,,Malachite,Orca Network,Reliable,Cherie St. Ours
10/20/22,2022,10,17:00,11,420,Humpback,1,,,Malachite,Orca Network,Public,Jennifer Swenson
10/20/22,2022,10,16:30,11,420,Humpback,1,,,,Orca Network,Public,
10/20/22,2022,10,14:30,10,412,Gray,1,,,,Orca Network,Public,Ignacio Cabezudo
10/20/22,2022,10,9:36,10,412,Gray,1,,,,Orca Network,Public,Jennifer White
7/12/19,2019,7,10:49,17C,33,Orca,5,Ts,,T2Cs,Email,WW,Vancouver Island WW Co
10/16/18,2018,10,12:26,17C,33,Orca,3,Ts,,"T65A2, T49A2 + Unknown",Other,WW,Wild Whales Vancouver
10/16/18,2018,10,12:03,17C,33,Orca,3,Ts,,"T65A2, T49A2 + Unknown",Other,WW,Wild Whales Vancouver
8/22/17,2017,8,17:37,17C,33,Orca,6,Ts,,"T137A, T37s",Other,WW,Wild Whales Vancouver
7/15/17,2017,7,16:03,17C,33,Orca,0,Ts,,T99s,Other,WW,Wild Whales Vancouver
4/11/17,2017,4,11:46,17C,33,Orca,16-20,Ts,,"T018, T019s, T087",Other,WW,Wild Whales Vancouver
3/30/19,2019,3,19:50,17C,34,Orca,5,,,"5-7 individuals, calf/juvenile present near lighthouse. Small boat in close proximity seen harassing whales.",Orca Network,Public,Alex Noel
7/12/19,2019,7,10:50,17C,34,Orca,4,Ts,,T2Cs,Email,WW,Vancouver Island WW Co
6/14/19,2019,6,12:18,17C,34,Orca,4,Ts,,T124C and possibly T124As,Email,WW,Vancouver Island WW Co
10/1/19,2019,10,15:30,17C,34,Orca,,T,,T77A,Email,Reliable,Jeanne Hyde
1/9/18,2018,1,14:00,17C,34,Orca,10,Ts,,,Orca Network,Public,Rodney Grounds
8/21/17,2017,8,15:49,17C,34,Orca,9,Ts,,"T137s, T46s",Other,WW,Wild Whales Vancouver
7/19/17,2017,7,14:51,17C,34,Orca,4,Ts,,T37As,Other,WW,Wild Whales Vancouver
10/18/22,2022,10,17:24,11,422,Humpback,1,,,Malachite,Orca Network,Reliable,Jason Cook
10/18/22,2022,10,17:00,8,384,Gray,2,,,,Orca Network,Reliable,Lori Christopher
10/18/22,2022,10,14:10,11,417,Minke,1,,,,Orca Network,Public,Amanda Herberger
6/17/17,2017,6,12:27,17C,34,Orca,6,Ts,,"T49C, maybe T124As",Other,WW,Wild Whales Vancouver
10/17/22,2022,10,15:00,9,389,Harbor Porpoise,3,,,,,Reliable,Sandy Pollard
5/11/17,2017,5,12:30,17C,34,Orca,10-Sep,Ts,,"T018,19s, T123s, T77A",Other,WW,Wild Whales Vancouver
5/17/21,2021,5,5:41,17C,35,Orca,5,,T,Beh:Slow moving,BCCSN,Reliable,
6/11/18,2018,6,11:38,17C,35,Orca,4-Mar,Ts,,unknown,Other,WW,Wild Whales Vancouver
8/4/18,2018,8,16:53,17C,36,Orca,4,Ts,,"T18's, T19's",Other,WW,Wild Whales Vancouver
6/29/18,2018,6,13:30,17C,36,Orca,5,Ts,,T37As,Other,WW,Wild Whales Vancouver
8/24/17,2017,8,15:00,17C,36,Orca,4,Ts,,T137s,Other,WW,Wild Whales Vancouver
6/17/17,2017,6,13:47,17C,36,Orca,2,Ts,,T63 and T65,Other,WW,Wild Whales Vancouver
7/3/18,2018,7,15:47,29C,37,Orca,15,Ts,,"T65As, T36As, T124As",Other,WW,Wild Whales Vancouver
9/13/21,2021,9,16:04,29C,38,Orca,15,,J,Beh:Slow moving,BCCSN,Public,
7/30/17,2017,7,15:33,29C,38,Orca,20,Ts,,,Other,WW,Wild Whales Vancouver
7/30/17,2017,7,15:57,29C,38,Orca,20,Ts,,"T46s, T37",Other,WW,Wild Whales Vancouver
8/28/21,2021,8,13:35,29C,40,Orca,5,,T,,BCCSN,Reliable,
8/31/18,2018,8,15:09,29C,41,Orca,5,Ts,,T37A's + Unknown,Other,WW,Wild Whales Vancouver
10/17/22,2022,10,13:48,7,186,Humpback,1,,,,Orca Network,Public,Chuck Johnson
10/17/22,2022,10,17:07,11,422,Humpback,1,,,Malachite,Orca Network,Reliable,John Miller WSF
10/17/22,2022,10,14:15,11,420,Humpback,1,,,,Orca Network,Public,Mary Jane Rumley
10/17/22,2022,10,18:00,2-Aug,386,Gray,2,,,,Orca Network,Public,Cathy VonWald
10/16/22,2022,10,8:53,6,359,Minke,1,,,,Orca Network,Public,Brad Chrisman
9/30/22,2022,9,9:14,29C,42,Orca,,J,,,BCCSN,Reliable,
7/26/22,2022,7,17:20,29C,42,Orca,,J,,,BCCSN,Reliable,
10/15/22,2022,10,17:30,18C,123,Humpback,1,,,,Orca Network,Reliable,Karoline Cullen
10/15/22,2022,10,15:00,2-Aug,378,Humpback,1,,,,Orca Network,Public,Mark Christenson
10/15/22,2022,10,19:00,10,412,Humpback,2,,,,Orca Network,Public,Allison Reak
10/15/22,2022,10,15:50,11,420,Humpback,1,,,Malachite,Orca Network,Reliable,Jason Cook
10/15/22,2022,10,12:47,11,422,Humpback,1,,,Malachite,Orca Network,Reliable,Jason Cook
10/15/22,2022,10,10:13,11,420,Humpback,1,,,Malachite,Orca Network,Reliable,Jason Cook
10/15/22,2022,10,18:28,10,412,Gray,1,,,,Orca Network,Public,Kate Hall
10/15/22,2022,10,8:05,10,411,Gray,1,,,,Orca Network,Public,
10/15/22,2022,10,15:47,9,365,Minke,1,,,,Orca Network,Reliable,Laura Baker WSF
10/15/22,2022,10,15:45,9,388,Minke,1,,,,Orca Network,Public,Tony Collins
9/13/21,2021,9,9:05,29C,42,Orca,30,J,,"Beh:Slow moving,Spy-hopping,Feeding",BCCSN,Reliable,
9/14/18,2018,9,12:43,29C,42,Orca,10,JK,,,Other,WW,Wild Whales Vancouver
9/30/17,2017,9,15:00,29C,42,Orca,20,J,,,Other,WW,Wild Whales Vancouver
9/30/17,2017,9,10:40,29C,42,Orca,20,J,,,Other,WW,Wild Whales Vancouver
10/14/22,2022,10,13:00,20C,262,Humpback,20,,,,Orca Network,Reliable,Paul Pudwell
10/14/22,2022,10,17:55,11,420,Humpback,1,,,Malachite,Orca Network,Public,Kristen Weander
10/14/22,2022,10,15:46,11,420,Humpback,1,,,,Orca Network,Public,Ashley Whitman
10/14/22,2022,10,15:08,11,420,Humpback,1,,,Malachite,Orca Network,Public,Kiana Weinschenk
10/14/22,2022,10,12:36,11,420,Humpback,1,,,Malachite,Orca Network,Reliable,Cherie StOUrs
10/14/22,2022,10,12:25,11,420,Humpback,1,,,,Orca Network,Public,Kourtnee Marr Lindgren
10/14/22,2022,10,10:00,7,186,Minke,1,,,,Orca Network,Reliable,Bonnie Gretz
9/30/17,2017,9,11:15,29C,42,Orca,23,J,,,Other,WW,Wild Whales Vancouver
10/13/22,2022,10,17:55,11,422,Humpback,1,,,Malachite,Orca Network,Public,Jack Sasser
10/13/22,2022,10,14:43,11,422,Humpback,1,,,,Orca Network,Reliable,Jason Cook
10/13/22,2022,10,9:43,11,420,Humpback,1,,,Malachite,Orca Network,Reliable,Jason Cook
10/13/22,2022,10,9:12,10,412,Gray,1,,,,Orca Network,Reliable,Laura Baker WSF
9/30/17,2017,9,11:30,29C,42,Orca,30,J,,,Other,WW,Wild Whales Vancouver
9/5/17,2017,9,9:29,29C,42,Orca,76,Lp,,"L22, L89, L41, L77, L92, L72, L83, L87, K21, L25",Other,WW,Wild Whales Vancouver
10/12/22,2022,10,9:35,7,181,Humpback,1,,,BCZ0492 Meqe,Orca Network,Reliable,Michelline Halliday
10/12/22,2022,10,8:52,7,181,Humpback,2,,,,Orca Network,Public,T.L. Stokes
10/12/22,2022,10,8:10,7,176,Humpback,1,,,,Orca Network,Public,Peter Van Deventer
10/12/22,2022,10,18:15,11,422,Humpback,1,,,Malachite,Orca Network,Public,Ed Rickert
10/12/22,2022,10,13:19,11,422,Humpback,1,,,Malachite,Orca Network,Reliable,Melissa Bird
10/11/22,2022,10,9:00,7,184,Humpback,1,,,,Orca Network,Reliable,Orca Behavior Institute
10/11/22,2022,10,17:59,11,422,Humpback,1,,,Malachite,Orca Network,Public,Steph Grush
10/11/22,2022,10,0:00,11,422,Humpback,1,,,,Orca Network,Public,Heather Roskelley
10/11/22,2022,10,16:00,11,422,Humpback,1,,,,Orca Network,Public,Heidi Armstrong
10/11/22,2022,10,12:10,11,422,Humpback,1,,,,Orca Network,Public,Kathy Weaver
10/11/22,2022,10,7:48,11,422,Humpback,1,,,,Orca Network,Public,Shannon Joosten Schlecht
10/11/22,2022,10,18:00,13,430,Gray,1,,,,Orca Network,Public,Tim Smith
10/11/22,2022,10,16:35,13,432,Gray,1,,,,Orca Network,Public,MaryLou Green
10/11/22,2022,10,9:30,6,358,Minke,1,,,Ruth BG,Orca Network,Public,Brad Chisman
10/10/22,2022,10,15:13,11,420,Humpback,1,,,Malachite,Orca Network,Reliable,WSF
10/10/22,2022,10,16:00,11,420,Humpback,1,,,,Orca Network,Public,Reid Christopher Newlin
10/10/22,2022,10,12:25,11,422,Humpback,1,,,Malachite,Orca Network,Public,Grace McRae
10/10/22,2022,10,15:40,2-Aug,385,Gray,1,,,CRC2440,Orca Network,Reliable,Bart Rulon
9/10/21,2021,9,9:05,29C,43,Orca,25,J,,"IDs:J27Beh:Slow moving,Feeding,Breaching",BCCSN,Reliable,
10/9/22,2022,10,12:26,28C,14,Humpback,5,,,"Hecate, YingYang, Hydra, BCY0161, MMZ0061",Orca Network,Reliable,Tyson Reed
10/9/22,2022,10,14:59,11,414,Humpback,1,,,Malachite,Orca Network,Public,Hope Cornetta
10/9/22,2022,10,12:57,11,422,Humpback,1,,,Malachite,Orca Network,Public,Tricia DeOme
10/9/22,2022,10,10:53,11,422,Humpback,1,,,,Orca Network,Reliable,Jason Cook
10/8/22,2022,10,10:14,11,420,Humpback,1,,,,Orca Network,Public,Todd Ritchie
10/9/22,2022,10,8:37,11,412,Humpback,1,,,,Orca Network,Public,Ryan Dicks
10/8/22,2022,10,15:30,9,401,Gray,1,,,,Orca Network,Public,Julie Harris
10/8/22,2022,10,14:45,9,401,Gray,1,,,,Orca Network,Reliable,Alisa Lemire Brooks
9/20/17,2017,9,11:40,29C,43,Orca,9,Ts,,T65As and T99s,Other,WW,Wild Whales Vancouver
9/20/17,2017,9,10:50,29C,43,Orca,9,Ts,,T65As and T99s,Other,WW,Wild Whales Vancouver
8/28/17,2017,8,13:00,29C,43,Orca,5,Ts,,T65As,Other,WW,Wild Whales Vancouver
8/17/17,2017,8,9:40,29C,43,Orca,4,Ts,,T99s,Other,WW,Wild Whales Vancouver
8/16/17,2017,8,15:24,29C,43,Orca,7,Ts,,T46As,Other,WW,Wild Whales Vancouver
6/24/17,2017,6,11:38,29C,43,Orca,3,Ts,,T123s,Other,WW,Wild Whales Vancouver
8/23/18,2018,8,13:09,29C,44,Orca,4,Ts,,T101's,Other,WW,Wild Whales Vancouver
9/5/17,2017,9,9:01,29C,44,Orca,40,JKL,,Very spread out in small groups (1-3 animals),Other,WW,Prince Of Whales
10/9/17,2017,10,,29C,44,Orca,,Ts,,T101s,Other,TWM,Jeanne Hyde
10/1/17,2017,10,,29C,44,Orca,,J,,,Other,TWM,Jeanne Hyde
9/30/17,2017,9,,29C,44,Orca,,J,,all day,Other,TWM,Jeanne Hyde
9/26/17,2017,9,,29C,44,Orca,,JL,,,Other,TWM,Jeanne Hyde
9/25/17,2017,9,17:15,29C,44,Orca,,JL,,,Other,TWM,Jeanne Hyde
10/8/22,2022,10,14:30,7,187,Humpback,1,,,BCX1358 Frankenstein,Orca Network,Public,Ellie Sawyer
10/8/22,2022,10,13:00,7,188,Humpback,1,,,BCX1358 Frankenstein,Orca Network,Public,Ellie Sawyer
10/8/22,2022,10,16:15,11,422,Humpback,1,,,,Orca Network,Public,Heather Maher
10/7/22,2022,10,16:20,11,422,Humpback,1,,,,Orca Network,Public,Crystal Thompson
10/7/22,2022,10,16:05,11,422,Humpback,1,,,,Orca Network,Public,Maria Cammarota
10/7/22,2022,10,15:00,11,422,Humpback,1,,,,Orca Network,Public,Betty Foster
10/7/22,2022,10,13:22,11,422,Humpback,1,,,,Orca Network,Public,Jennifer Hubbard
10/7/22,2022,10,8:31,11,422,Humpback,2,,,,Orca Network,Public,Shannon Joosten Schlecht
10/6/22,2022,10,13:23,11,422,Humpback,1,,,,Orca Network,Public,Heidi Armstrong
10/6/22,2022,10,11:22,11,422,Humpback,1,,,CRC-19820 (Malachite),Orca Network,Public,Ashley Whitman
9/11/17,2017,9,19:00,29C,44,Orca,,Lp,,L4s,Other,TWM,Jeanne Hyde
8/17/17,2017,8,9:30,29C,44,Orca,,Ts,,T99s,Other,TWM,Jeanne Hyde
10/5/22,2022,10,16:05,9,398,Humpback,1,,,,Orca Network,Reliable,Alisa Lemire Brooks
10/5/22,2022,10,18:11,11,422,Humpback,1,,,,Orca Network,Public,Ryan Dicks
10/5/22,2022,10,16:58,11,422,Humpback,1,,,,Orca Network,Reliable,Jason Cook
10/5/22,2022,10,13:43,11,422,Humpback,1,,,,Orca Network,Public,Jack Sasser
10/5/22,2022,10,9:19,11,422,Humpback,1,,,,Orca Network,Public,Dave Cope
7/26/19,2019,7,17:35,29C,45,Orca,2,Ts,,"T77C, T77D",Email,WW,Vancouver Island WW Co
10/4/22,2022,10,12:48,9,390,Humpback,1,,,MMX0132 Uluka,Orca Network,Public,Brian McGinn
10/4/22,2022,10,12:34,9,390,Humpback,1,,,,Orca Network,Public,Christina Wheat
10/4/22,2022,10,18:05,11,422,Humpback,1,,,,Orca Network,Public,Charles Wright
10/4/22,2022,10,16:34,11,420,Humpback,1,,,,Orca Network,Public,Jason Cook
10/4/22,2022,10,15:00,11,422,Humpback,1,,,,Orca Network,Public,Tim Ferris
10/4/22,2022,10,12:06,11,422,Humpback,1,,,,Orca Network,Public,Jack Sasser
10/3/22,2022,10,14:16,7,184,Humpback,2,,,,Orca Network,Reliable,Gerald Graham
10/3/22,2022,10,11:45,9,398,Humpback,1,,,,Orca Network,Reliable,Bart Rulon
10/3/22,2022,10,11:50,10,401,Humpback,1,,,,Orca Network,Public,Donna Green Van Renselaar
10/3/22,2022,10,17:39,11,419,Humpback,1,,,,Orca Network,Public,Robyn Riley
10/3/22,2022,10,16:26,11,412,Humpback,1,,,,Orca Network,Reliable,Cherie St.Ours
10/3/22,2022,10,16:06,11,420,Humpback,1,,,,Orca Network,Reliable,WSF
10/3/22,2022,10,14:35,11,420,Humpback,1,,,,Orca Network,Public,Ron Philippsborn
10/3/22,2022,10,14:03,11,422,Humpback,1,,,,Orca Network,Public,Candace Gavin
10/3/22,2022,10,12:29,11,420,Humpback,1,,,Malachite,Orca Network,Public,Ethan Allen
6/22/19,2019,6,11:38,29C,45,Orca,10,Ts,,"T65As, T36As",Email,WW,Vancouver Island WW Co
6/22/19,2019,6,11:30,29C,45,Orca,10,Ts,,T65As,Email,WW,Vancouver Island WW Co
6/15/19,2019,6,13:40,29C,45,Orca,4,Ts,,T101s,Email,WW,Vancouver Island WW Co
8/1/18,2018,8,5:30,29C,45,Orca,,Ts,,Probably Bigg's,Orca Network,Public,Scott McLeod
9/16/21,2021,9,15:57,29C,46,Orca,50,,L,"Beh:Spy-hopping,Fast moving,Breaching",BCCSN,Reliable,
9/16/21,2021,9,11:54,29C,46,Orca,20,,L,Beh:Slow moving,BCCSN,Reliable,
9/22/18,2018,9,,29C,46,Orca,22,J,,all day,Other,TWM,Jeanne Hyde
9/17/18,2018,9,13:30,29C,46,Orca,10,SRs,,L87 + Unknowns,Other,WW,Wild Whales Vancouver
9/5/18,2018,9,10:48,29C,46,Orca,~7,Ts,,T90's + T101's,Other,WW,Wild Whales Vancouver
8/18/18,2018,8,13:20,29C,46,Orca,5-Mar,Ts,,Unknown,Other,WW,Wild Whales Vancouver
7/22/18,2018,7,9:49,29C,46,Orca,8-May,Ts,,Unknown,Other,WW,Wild Whales Vancouver
10/2/22,2022,10,12:44,7,176,Humpback,1,,,,Orca Network,Public,Devin Neiwert
10/2/22,2022,10,12:32,7,181,Humpback,2,,,,Orca Network,Public,Paul Rudd
10/2/22,2022,10,10:41,11,422,Humpback,1,,,,Orca Network,Reliable,Jason Cook
10/2/22,2022,10,8:24,8,384,Gray,1,,,,Orca Network,Public,Michelle Sayed
10/2/22,2022,10,7:45,8,384,Gray,1,,,,Orca Network,Public,Kelly Brown Dukes
10/2/22,2022,10,13:22,6,305,Minke,1,,,,Orca Network,Public,Kara Belair
10/2/22,2022,10,11:05,9,388,Minke,1,,,,Orca Network,Public,Rebecca Hadley
6/5/18,2018,6,14:30,29C,46,Orca,,Ts,,T86As and T124A2s,Other,TWM,Jeanne Hyde
9/4/17,2017,9,9:20,29C,46,Orca,,Ts,,T65As,Other,TWM,Jeanne Hyde
9/4/17,2017,9,9:18,29C,46,Orca,5,Ts,,T65A,Other,WW,Prince Of Whales
9/20/17,2017,9,11:50,29C,46,Orca,9,Ts,,T65As and T99s,Other,WW,Wild Whales Vancouver
8/28/17,2017,8,12:00,29C,46,Orca,5,Ts,,T65As,Other,WW,Wild Whales Vancouver
8/28/17,2017,8,11:45,29C,46,Orca,4,Ts,,T65As,Other,WW,Wild Whales Vancouver
8/18/17,2017,8,12:00,29C,46,Orca,6,Ts,,T137s,Other,WW,Wild Whales Vancouver
8/17/17,2017,8,14:20,29C,46,Orca,4,Ts,,T99s,Other,WW,Wild Whales Vancouver
6/24/17,2017,6,10:46,29C,46,Orca,3,Ts,,T123s,Other,WW,Wild Whales Vancouver
5/29/17,2017,5,14:00,29C,46,Orca,3,Ts,,T123s,Other,WW,Wild Whales Vancouver
5/29/17,2017,5,14:10,29C,46,Orca,3,Ts,,T123s,Other,WW,Wild Whales Vancouver
5/29/17,2017,5,13:40,29C,46,Orca,3,Ts,,T123s,Other,WW,Wild Whales Vancouver
7/26/22,2022,7,14:05,29C,47,Orca,,J,,,BCCSN,Reliable,
7/26/22,2022,7,14:58,29C,47,Orca,,J,,,Other,Soundwatch,
10/1/22,2022,10,14:39,11,422,Humpback,1,,,,Orca Network,Public,Allyson Corbo
10/1/22,2022,10,14:00,9,401,Gray,2,,,CRC2441,Orca Network,Reliable,Trevor Tillman
10/1/22,2022,10,13:35,9,398,Gray,1,,,CRC2441,Orca Network,Reliable,Bart Rulon
10/1/22,2022,10,17:45,9,388,Minke,1,,,,Orca Network,Public,Tabitha Jacobs-Mangiafico
10/1/22,2022,10,7:43,2-Aug,376,Gray,1,,,,Orca Network,Public,Rich Hampton
9/1/22,2022,9,12:21,2-Aug,382,Gray,1,,,CRC2440,Orca Network,Public,Kyla Bivens
9/1/22,2022,9,9:31,1-Aug,375,Humpback,1,,,Malachite,Orca Network,Public,Erik Anderson
9/1/22,2022,9,13:30,1-Aug,375,Humpback,1,,,Malachite,Orca Network,Reliable,Jill Hein
9/1/22,2022,9,13:44,1-Aug,374,Humpback,1,,,Malachite,Orca Network,Reliable,Stephanie Raymond
7/24/22,2022,7,18:30,29C,47,Orca,,J,,,BCCSN,Reliable,
9/6/18,2018,9,12:45,29C,47,Orca,~10,SRs,JLp,,Other,WW,Wild Whales Vancouver
9/7/17,2017,9,18:10,29C,47,Orca,4,Ts,,T100,Other,WW,Prince Of Whales
9/6/22,2022,9,11:15,20C,,Humpback,18,,,,Orca Network,Public,Janett Wingett
9/7/22,2022,9,13:30,2-Aug,384,Gray,3,,,,Orca Network,Public,Thomas Frenock
9/22/17,2017,9,11:57,29C,47,Orca,0,L,,L Pod - L92,Other,WW,Wild Whales Vancouver
8/18/17,2017,8,15:50,29C,47,Orca,5,Ts,,T137s,Other,WW,Wild Whales Vancouver
4/8/17,2017,4,11:08,29C,47,Orca,5-Apr,Ts,,"T087, T124A2, T124A2B, T124A2A",Other,WW,Wild Whales Vancouver
9/15/22,2022,9,13:35,8,384,Gray,1,,,CRC2441,Orca Network,Reliable,Bart Rulon
9/15/22,2022,9,13:35,8,384,Gray,1,,,CRC2440,Orca Network,Reliable,Bart Rulon
4/8/17,2017,4,11:00,29C,47,Orca,4,Ts,,"T087, T124A2, T124A2B, T124A2A",Other,WW,Wild Whales Vancouver
9/16/22,2022,9,9:50,2-Aug,385,Humpback,1,,,,Orca Network,Public,Teena Robinett
9/16/22,2022,9,16:45,11,422,Gray,1,,,,Orca Network,Public,Karen Leland WAA
9/3/21,2021,9,9:10,29C,48,Orca,20,,L,"Beh:Slow moving,Fast moving,Breaching",BCCSN,Reliable,
8/17/18,2018,8,16:15,29C,48,Orca,8,Ts,,T46's + T137's,Other,WW,Wild Whales Vancouver
8/17/18,2018,8,16:32,29C,48,Orca,8,Ts,,T46's + T137's,Other,WW,Wild Whales Vancouver
7/18/18,2018,7,11:00,29C,48,Orca,5,Ts,,T46's + T122,Other,WW,Wild Whales Vancouver
7/18/18,2018,7,11:09,29C,48,Orca,~4,Ts,,T46's,Other,WW,Wild Whales Vancouver
4/29/18,2018,4,12:00,29C,48,Orca,10,Ts,,"T100's, T101's",Other,WW,Wild Whales Vancouver
9/8/18,2018,9,9:54,29C,49,Orca,9-Jul,J,,,Other,WW,Wild Whales Vancouver
9/1/18,2018,9,12:28,29C,49,Orca,4,Ts,,T100's,Other,WW,Wild Whales Vancouver
9/6/17,2017,9,13:23,29C,49,Orca,2,Ts,,T18 and T18C,Other,WW,Wild Whales Vancouver
9/30/22,2022,9,18:18,7,186,Humpback,4,,,,Orca Network,Public,Erin Corra
9/30/22,2022,9,18:00,7,187,Humpback,3,,,,Orca Network,Public,Jeanne Sept
9/30/22,2022,9,15:48,7,188,Humpback,3,,,,Orca Network,Public,Anon
9/30/22,2022,9,10:30,18C,123,Humpback,4,,,,Orca Network,Public,Anon
9/30/22,2022,9,14:09,11,418,Humpback,1,,,,Orca Network,Reliable,Amy Carey
9/30/22,2022,9,13:01,11,422,Humpback,1,,,,Orca Network,Public,Susan White
9/30/22,2022,9,11:49,13,423,Humpback,1,,,Malachite,Orca Network,Public,Karen Caldwell
9/30/22,2022,9,8:30,11,422,Humpback,1,,,Malachite,Orca Network,Public,Erica Nelson
9/29/22,2022,9,9:00,18C,123,Humpback,4,,,,Orca Network,Public,Anon
9/29/22,2022,9,12:30,11,422,Humpback,1,,,,Orca Network,Public,Thomas Frenock
9/29/22,2022,9,10:43,11,422,Humpback,1,,,,Orca Network,Public,Susan White
9/29/22,2022,9,10:18,11,422,Humpback,1,,,,Orca Network,Public,Karen Caldwell
9/29/22,2022,9,8:30,13,423,Humpback,1,,,,Orca Network,Public,Karen Caldwell
9/6/17,2017,9,12:56,29C,49,Orca,3,Ts,,T19s,Other,WW,Wild Whales Vancouver
7/9/17,2017,7,18:14,29C,49,Orca,4,Ts,,T46D,Other,WW,Wild Whales Vancouver
7/9/17,2017,7,17:55,29C,49,Orca,6,Ts,,T46E,Other,WW,Wild Whales Vancouver
9/28/22,2022,9,18:20,11,422,Humpback,1,,,Malachite,Orca Network,Public,Jack Sasser
9/28/22,2022,9,15:42,11,422,Humpback,1,,,,Orca Network,Public,Michael Kaldawi
9/28/22,2022,9,11:25,11,418,Humpback,1,,,,Orca Network,Public,Jordan Allen
9/28/22,2022,9,10:42,11,422,Humpback,1,,,Malachite,Orca Network,Public,Cherie StOurs
9/28/22,2022,9,9:41,11,422,Humpback,1,,,,Orca Network,Public,Tessa OGrady
9/28/22,2022,9,8:16,11,422,Humpback,1,,,,Orca Network,Public,Jack Sasser
9/27/22,2022,9,14:38,11,420,Humpback,1,,,,Orca Network,Public,Geoff Wotton
9/27/22,2022,9,13:31,11,418,Humpback,1,,,,Orca Network,Reliable,Amy Carey
9/27/22,2022,9,12:30,11,418,Humpback,1,,,,Orca Network,Public,Stevee Duber
9/27/22,2022,9,10:55,11,420,Humpback,1,,,,Orca Network,Public,Keith Danziger
9/27/22,2022,9,9:00,11,420,Humpback,1,,,,Orca Network,Public,Aura Mae
9/27/22,2022,9,11:00,2-Aug,386,Gray,1,,,,Orca Network,Public,Therese Robin
9/27/22,2022,9,7:44,7,188,Minke,1,,,,Orca Network,Reliable,Laura Baker
9/26/22,2022,9,15:20,7,185,Humpback,1,,,Two Spot,Orca Network,Reliable,Monika Shields
9/26/22,2022,9,14:45,7,186,Humpback,1,,,Two Spot,Orca Network,Reliable,Monika Shields
9/26/22,2022,9,13:38,11,418,Humpback,1,,,Malachite,Orca Network,Reliable,Melissa Bird
9/25/22,2022,9,17:15,7,186,Humpback,1,,,,Orca Network,Public,EJ Evans
9/25/22,2022,9,12:15,7,184,Humpback,1,,,,Orca Network,Reliable,Monika Shields
9/25/22,2022,9,15:50,11,422,Humpback,1,,,Malachite,Orca Network,Public,Candace Gavin
9/25/22,2022,9,14:12,11,422,Humpback,1,,,,Orca Network,Public,Anon
9/25/22,2022,9,14:43,2-Aug,385,Gray,1,,,,Orca Network,Reliable,Stephanie Raymond
9/25/22,2022,9,10:15,8,384,Gray,2,,,,Orca Network,Reliable,Lori Christopher
9/25/22,2022,9,9:49,2-Aug,385,Gray,1,,,CRC2440,Orca Network,Public,Diane Liebel
9/24/22,2022,9,7:00,10,402,Humpback,1,,,,Orca Network,Public,LooLoo Lib
9/27/22,2022,9,17:50,11,422,Humpback,1,,,,Orca Network,Public,Cherie StOurs
9/24/22,2022,9,17:30,13,423,Humpback,1,,,,Orca Network,Public,Wendy Smith
9/24/22,2022,9,16:11,13,423,Humpback,1,,,,Orca Network,Reliable,Jason Cook
9/24/22,2022,9,13:18,11,420,Humpback,1,,,,Orca Network,Reliable,Jason Cook
9/24/22,2022,9,12:00,11,420,Humpback,1,,,,Orca Network,Reliable,Amy Carey
9/23/22,2022,9,11:50,7,97,Humpback,2,,,BCZ0502 & BCY1092,Orca Network,Reliable,Alisa Brooks
9/23/22,2022,9,14:26,11,418,Humpback,1,,,,Orca Network,Reliable,Amy Carey
9/23/22,2022,9,13:15,2-Aug,384,Gray,1,,,,Orca Network,Public,Kimberly Paulsen
9/22/22,2022,9,8:12,2-Aug,378,Gray,1,,,,Orca Network,Public,John Storbeck
8/24/17,2017,8,15:10,29C,50,Orca,4,Ts,,T137s,Other,WW,Wild Whales Vancouver
8/20/17,2017,8,15:58,29C,50,Orca,15-20,Ts,,T46 and others,Other,WW,Wild Whales Vancouver
8/20/17,2017,8,15:24,29C,50,Orca,0,Ts,,,Other,WW,Wild Whales Vancouver
5/20/17,2017,5,13:20,29C,50,Orca,2,Ts,,,Other,WW,Wild Whales Vancouver
9/21/22,2022,9,10:45,9,391,Humpback,1,,,Two Spot,Orca Network,Public,Brian McGinn
9/21/22,2022,9,18:30,11,420,Humpback,1,,,,Orca Network,Public,Cherie StOurs
9/21/22,2022,9,17:55,11,420,Humpback,1,,,,Orca Network,Reliable,Jason Cook
9/21/22,2022,9,13:15,11,420,Humpback,1,,,,Orca Network,Public,Candace Gavin
9/21/22,2022,9,6:45,8,384,Gray,1,,,,Orca Network,Public,Alice Moyal
6/16/21,2021,6,19:11,29C,51,Orca,2,,T,"Beh:Slow moving,Fluking",BCCSN,Public,
10/9/17,2017,10,12:00,29C,51,Orca,20,J,,"J Pod - J26, J16s and more",Other,WW,Wild Whales Vancouver
9/1/17,2017,9,14:04,29C,51,Orca,4,Ts,,T18s and T19s,Other,WW,Wild Whales Vancouver
8/21/17,2017,8,12:01,29C,51,Orca,20,Ts,,"T137s, T37s, T46",Other,WW,Wild Whales Vancouver
4/2/21,2021,4,13:08,17C,52,Orca,8,J,,"Beh:Slow moving,Feeding,Breaching",BCCSN,Reliable,
9/19/18,2018,9,13:32,17C,52,Orca,4,Ts,,T18's and T19's,Other,WW,Wild Whales Vancouver
7/3/18,2018,7,16:01,17C,52,Orca,13,Ts,,"T65As, T36s, T124s",Other,WW,Wild Whales Vancouver
9/20/22,2022,9,11:54,9,394,Humpback,1,,,Two Spot,Orca Network,Reliable,Justine Buckmaster
9/20/22,2022,9,10:17,9,394,Humpback,1,,,Two Spot,Orca Network,Reliable,Justine Buckmaster
9/20/22,2022,9,8:41,2-Aug,378,Gray,2,,,,Orca Network,Public,John Storbeck
9/20/22,2022,9,6:36,2-Aug,378,Gray,1,,,CRC2441,Orca Network,Public,John Storbeck
9/14/22,2022,9,11:50,7,188,Humpback,1,,,,Orca Network,Reliable,Monika Shields
7/3/18,2018,7,13:50,17C,52,Orca,13,Ts,,"T65As, T36s, T124s",Other,WW,Wild Whales Vancouver
8/24/17,2017,8,13:40,17C,52,Orca,4,Ts,,T137s,Other,WW,Wild Whales Vancouver
8/22/17,2017,8,11:11,17C,52,Orca,8,Ts,,"T30s, T41A",Other,WW,Wild Whales Vancouver
8/21/17,2017,8,13:14,17C,52,Orca,15-20,Ts,,"T137s, T46s",Other,WW,Wild Whales Vancouver
6/18/17,2017,6,13:45,17C,52,Orca,8,Ts,,"T137s, T124s?",Other,WW,Wild Whales Vancouver
4/6/22,2022,4,17:50,17C,53,Orca,4,T,,IDs: T18s,Orca Network,Reliable,Monika Wieland Shields
6/15/19,2019,6,15:00,17C,53,Orca,4,T,,T101s,Other,TWM,Jeanne Hyde
8/30/20,2020,8,15:00,17C,53,Orca,,T,,,Other,TWM,Jeanne Hyde
2/14/20,2020,2,18:00,17C,53,Orca,,T,,,Other,TWM,Jeanne Hyde
1/8/20,2020,1,12:00,17C,53,Orca,23,"Jp, Lp",,L87 with Jp,Other,TWM,Jeanne Hyde
6/1/19,2019,6,19:00,17C,53,Orca,3,,,"NO ID False Narrows (a narrow channel between Gabriola and Mudge Island). Last night … I saw at least three orcas, possibly four, heading west through False Narrows towards Nanaimo.",Orca Network,Public,Margaret Davison
9/29/19,2019,9,12:21,17C,53,Orca,,Ts,,T37As,Email,WW,Vancouver Island WW Co
7/5/19,2019,7,17:38,17C,53,Orca,4,Ts,,"T124C, T124As",Email,WW,Vancouver Island WW Co
7/5/19,2019,7,17:15,17C,53,Orca,4,Ts,,"T124C, T124A3, T124A3A",Email,WW,Vancouver Island WW Co
6/14/18,2018,6,,17C,53,Orca,6,Ts,,T34s and T37s,Other,TWM,Jeanne Hyde
6/8/18,2018,6,11:00,17C,53,Orca,,Ts,,"T34s, T37, T37Bs, T100s, T101s, T86As",Other,TWM,Jeanne Hyde
1/25/18,2018,1,11:00,17C,53,Orca,3,Ts,,,Other,TWM,Jeanne Hyde
8/24/17,2017,8,11:00,17C,53,Orca,,Ts,,T137s,Other,TWM,Jeanne Hyde
7/30/17,2017,7,15:30,17C,53,Orca,,Ts,,"T37As, T002Cs, T46s, T124Ds maybe",Other,TWM,Jeanne Hyde
9/18/22,2022,9,13:25,10,402,Humpback,1,,,Two Spot,Orca Network,Reliable,Bart Rulon
6/18/17,2017,6,,17C,53,Orca,,Ts,,T137s and T123s,Other,TWM,Jeanne Hyde
8/19/17,2017,8,,17C,53,Orca,,Ts,,Orca interaction with paddle boarders and kayaker.  Whales were spyhopping near kayaker.,Orca Network,Public,Kurt Wipp
7/15/17,2017,7,13:44,17C,53,Orca,4,Ts,,T99s,Other,WW,Wild Whales Vancouver
7/12/17,2017,7,11:47,17C,53,Orca,9,Ts,,"T37s, T37As, T77s",Other,WW,Wild Whales Vancouver
5/19/17,2017,5,11:04,17C,53,Orca,20,Ts,,,Other,WW,Wild Whales Vancouver
5/26/17,2017,5,20:00,17C,53,Orca,3,Ts,,,Orca Network,Public,John Richard Frizzell
8/15/22,2022,8,18:21,17C,54,Orca,,JKL,,,BCCSN,Reliable,
8/15/22,2022,8,18:21,17C,54,Orca,,JKL,,,BCCSN,Reliable,
8/15/22,2022,8,18:21,17C,54,Orca,,JKL,,,BCCSN,Reliable,
8/15/22,2022,8,18:21,17C,54,Orca,,JKL,,,BCCSN,Reliable,
8/15/22,2022,8,18:21,17C,54,Orca,,JKL,,,BCCSN,Reliable,
8/15/22,2022,8,18:21,17C,54,Orca,,JKL,,,BCCSN,Reliable,
9/17/22,2022,9,9:10,9,389,Humpback,1,,,,Orca Network,Public,Margaret Marrowstone
9/17/22,2022,9,10:00,2-Aug,385,Gray,1,,,,Orca Network,Reliable,Bart Rulon
9/17/22,2022,9,9:21,11,420,Gray,1,,,CRC2460,Orca Network,Reliable,Jason Cook
8/15/22,2022,8,18:21,17C,54,Orca,,JKL,,,BCCSN,Reliable,
11/16/22,2022,11,13:00,17C,54,Orca,,JKL,,,Orca Network,Reliable,Monika Wieland Shields
3/20/22,2022,3,18:48,17C,54,Orca,2,,T,,Orca Network,Public,Amanda Stewart
9/15/22,2022,9,11:42,17C,53,Humpback,2,,,,Orca Network,Public,Spencer Forsythe
9/16/22,2022,9,10:40,11,422,Humpback,1,,,,Orca Network,Public,Herry Smith
9/16/22,2022,9,9:29,11,420,Humpback,1,,,,Orca Network,Public,Polly Brown
9/16/22,2022,9,12:17,2-Aug,385,Gray,1,,,CRC2440,Orca Network,Reliable,Stephanie Raymond
9/16/22,2022,9,11:58,2-Aug,385,Gray,2,,,,Orca Network,Reliable,Bart Rulon
9/16/22,2022,9,12:36,11,420,Minke,1,,,,Orca Network,Public,Bill Earle
3/6/22,2022,3,13:30,17C,54,Orca,6,T,,IDs: T49As,Orca Network,Public,Frank Baja
10/31/21,2021,10,13:00,17C,54,Orca,4,J,,,Other,TWM,Jeanne Hyde
1/10/20,2020,1,13:11,17C,54,Orca,,J,,,Orca Network,Reliable,Monika Weiland Shields
9/16/20,2020,9,12:00,17C,54,Orca,,,,,Other,TWM,Jeanne Hyde
6/29/20,2020,6,12:30,17C,54,Orca,4,T,,T046Bs,Other,TWM,Jeanne Hyde
6/7/20,2020,6,14:30,17C,54,Orca,2,,,,Other,TWM,Jeanne Hyde
5/29/20,2020,5,12:30,17C,54,Orca,6,T,,"T124C, T124As",Other,TWM,Jeanne Hyde
9/13/22,2022,9,14:55,7,181,Humpback,1,,,,Orca Network,Reliable,Michelline Halliday
9/15/22,2022,9,13:00,7,185,Humpback,1,,,,Orca Network,Reliable,Kwasi Addae
5/10/20,2020,5,13:45,17C,54,Orca,8,T,,,Other,TWM,Jeanne Hyde
3/6/20,2020,3,8:30,17C,54,Orca,5,T,,Making kill,Other,TWM,Jeanne Hyde
2/25/20,2020,2,8:00,17C,54,Orca,,,,,Other,TWM,Jeanne Hyde
7/21/19,2019,7,18:30,17C,54,Orca,2,Ts,,,Orca Network,Public,Christine Stokes
6/2/19,2019,6,,17C,54,Orca,1,T,,IDs: T46B1B -  from photo taken N of Nanaimo,Orca Network,Public,Sara Hysong-Shimazu
7/16/19,2019,7,20:00,17C,54,Orca,3,Ts,,,Orca Network,Public,Tim Horkoff
9/14/22,2022,9,12:44,7,186,Humpback,1,,,,Orca Network,Reliable,Ariel Yseth
9/14/22,2022,9,11:15,7,188,Humpback,1,,,,Orca Network,Reliable,Monika Shields
5/28/19,2019,5,,17C,54,Orca,,,,a white orca was among them,Orca Network,Reliable,Vancouver Island WW
7/13/19,2019,7,11:00,17C,54,Orca,6,T,,T077s,Other,Reliable,Jeanne Hyde
7/6/19,2019,7,10:30,17C,54,Orca,,Ts,,,Other,Reliable,Jeanne Hyde
6/21/19,2019,6,13:30,17C,54,Orca,3,,,,Other,Reliable,Jeanne Hyde
6/21/19,2019,6,17:30,17C,54,Orca,,,,,Other,Reliable,Jeanne Hyde
3/20/19,2019,3,18:00,17C,54,Orca,7,Ts,,"Bigg's. Six adults and one juvenile, feeding on a sea lion.  Less than 1 km from shore, circling and breaching.  Moved towards Departure Bay.",Orca Network,Public,David Boem
6/21/19,2019,6,17:30,17C,54,Orca,,,,No exact count; two pods of of killer whales,Other,Reliable,Jeanne Hyde
6/3/19,2019,6,9:00,17C,54,Orca,10,Ts,,"T46Bs, T101s",Other,Reliable,Jeanne Hyde
5/29/19,2019,5,17:00,17C,54,Orca,10,Ts,,T123s & T124A2s,Other,Reliable,Jeanne Hyde
5/18/19,2019,5,11:00,17C,54,Orca,4,Ts,,T86As,Other,Reliable,Jeanne Hyde
9/13/22,2022,9,19:26,7,181,Humpback,1,,,,Orca Network,Public,Matt Leamann
9/13/22,2022,9,9:39,1-Aug,372,Humpback,1,,,,Orca Network,Public,Aaron Gill
9/13/22,2022,9,13:04,2-Aug,385,Gray,1,,,CRC2441,Orca Network,Public,Trevor Tillman
5/13/19,2019,5,12:00,17C,54,Orca,6,Ts,,T65As,Other,Reliable,Jeanne Hyde
4/25/19,2019,4,,17C,54,Orca,,Ts,,,Email,Reliable,Jeanne Hyde
3/28/19,2019,3,9:00,17C,54,Orca,,,,,Email,Reliable,Jeanne Hyde
1/25/19,2019,1,13:00,17C,54,Orca,10,Ts,,,Email,Reliable,Jeanne Hyde
9/12/22,2022,9,15:55,7,181,Humpback,1,,,Fallen Knight,Orca Network,Reliable,Monika Shields
9/12/22,2022,9,11:45,1-Aug,379,Humpback,1,,,Malachite,Orca Network,Public,Aaron Gill
9/12/22,2022,9,10:50,1-Aug,379,Humpback,1,,,Malachite,Orca Network,Public,Aaron Gill
9/12/22,2022,9,8:31,1-Aug,379,Humpback,1,,,Malachite,Orca Network,Public,Aaron Gill
9/12/22,2022,9,10:51,2-Aug,385,Gray,1,,,2440,Orca Network,Reliable,Lori Christopher
9/12/22,2022,9,17:37,7,186,Minke,1,,,,Orca Network,Public,Peggy Schellen
9/12/22,2022,9,8:24,7,188,Minke,1,,,,Orca Network,Reliable,Laura Baker WSF
9/20/19,2019,9,12:19,17C,54,Orca,1,Ts,,,Email,WW,Vancouver Island WW Co
7/24/19,2019,7,18:17,17C,54,Orca,5,Ts,,"T124A1, T124A2s, T124C",Email,WW,Vancouver Island WW Co
7/24/19,2019,7,16:04,17C,54,Orca,5,Ts,,"T124A1, T124A2s, T124C",Email,WW,Vancouver Island WW Co
9/11/22,2022,9,15:00,1-Aug,375,Humpback,1,,,Malachite,Orca Network,Public,Kristina Trowbridge
9/11/22,2022,9,13:17,1-Aug,375,Humpback,1,,,,Orca Network,Public,Marie Heil
9/11/22,2022,9,11:54,1-Aug,375,Humpback,1,,,Malachite,Orca Network,Reliable,Bart Rulon
9/11/22,2022,9,15:20,11,422,Minke,1,,,,Orca Network,Public,Lindsay Muma
7/24/19,2019,7,15:42,17C,54,Orca,5,Ts,,"T124A1, T124A2s, T124C",Email,WW,Vancouver Island WW Co
7/24/19,2019,7,13:15,17C,54,Orca,5,Ts,,"T124C, T124A2s, T124A1",Email,WW,Vancouver Island WW Co
7/24/19,2019,7,12:58,17C,54,Orca,4,Ts,,"T124C, T124A2s, T124A1",Email,WW,Vancouver Island WW Co
7/21/19,2019,7,19:00,17C,54,Orca,4,Ts,,T65Bs and T65A2,Email,WW,Vancouver Island WW Co
7/13/19,2019,7,11:10,17C,54,Orca,5,Ts,,T77s,Email,WW,Vancouver Island WW Co
7/13/19,2019,7,11:44,17C,54,Orca,5,Ts,,T77s,Email,WW,Vancouver Island WW Co
7/6/19,2019,7,10:39,17C,54,Orca,4,Ts,,"T124C, T124A2s",Email,WW,Vancouver Island WW Co
7/6/19,2019,7,11:13,17C,54,Orca,4,Ts,,"T124C, T124A2s",Email,WW,Vancouver Island WW Co
6/2/19,2019,6,12:00,17C,54,Orca,8,Ts,,T46Bs w/ white calf,Email,WW,Vancouver Island WW Co
9/10/22,2022,9,10:00,9,388,Minke,1,,,,Orca Network,Public,Francisco DePape
5/24/19,2019,5,15:30,17C,54,Orca,5,Ts,,T86As and others,Email,WW,Vancouver Island WW Co
5/13/19,2019,5,12:15,17C,54,Orca,6,Ts,,"T75Bs, T75Cs, T65Bs",Email,WW,Vancouver Island WW Co
9/9/22,2022,9,14:35,1-Aug,379,Humpback,2,,,,Orca Network,Public,Heather Anson
5/13/19,2019,5,12:00,17C,54,Orca,8,Ts,,"T75Bs, T75Cs, T65Bs",Email,WW,Vancouver Island WW Co
9/12/18,2018,9,11:00,17C,54,Orca,,Ts,,,Orca Network,Public,Cheryl Smith
7/28/18,2018,7,17:24,17C,54,Orca,,Ts,,,Orca Network,Public,Emily Green
8/28/18,2018,8,11:00,17C,54,Orca,4,Ts,,T99's,Other,WW,Wild Whales Vancouver
8/28/18,2018,8,12:25,17C,54,Orca,4,Ts,,T99's,Other,WW,Wild Whales Vancouver
8/28/18,2018,8,12:01,17C,54,Orca,4,Ts,,T99'S,Other,WW,Wild Whales Vancouver
6/11/18,2018,6,11:10,17C,54,Orca,4,Ts,,T77's,Other,WW,Wild Whales Vancouver
9/8/22,2022,9,8:45,8,385,Gray,2,,,2440 & 2441,Orca Network,Reliable,Lori Christopher
9/8/22,2022,9,7:45,8,385,Gray,2,,,2440 & 2441,Orca Network,Reliable,Lori Christopher
5/28/18,2018,5,14:05,17C,54,Orca,7,Ts,,T86A's & T124A2's,Other,WW,Wild Whales Vancouver
5/28/18,2018,5,13:31,17C,54,Orca,5,Ts,,T86A's & T124A2's,Other,WW,Wild Whales Vancouver
6/30/18,2018,6,,17C,54,Orca,4,Ts,,,Other,TWM,Jeanne Hyde
9/7/22,2022,9,12:00,1-Aug,379,Humpback,1,,,,Orca Network,Public,Aaron Gill
9/7/22,2022,9,13:30,2-Aug,385,Gray,3,,,,Orca Network,Public,Thomas Frenock
6/19/18,2018,6,14:00,17C,54,Orca,,Ts,,T37As,Other,TWM,Jeanne Hyde
6/15/18,2018,6,15:00,17C,54,Orca,3,Ts,,,Other,TWM,Jeanne Hyde
9/6/22,2022,9,16:12,1-Aug,379,Humpback,1,,,Malachite,Orca Network,Public,Aaron Gill
9/6/22,2022,9,11:31,1-Aug,374,Humpback,1,,,,Orca Network,Public,Lucienne Miodonski
9/6/22,2022,9,8:50,1-Aug,375,Humpback,1,,,Malachite,Orca Network,Public,Kristina Trowbridge
9/6/22,2022,9,12:34,2-Aug,385,Gray,1,,,,Orca Network,Reliable,Stephanie Raymond
9/6/22,2022,9,10:50,2-Aug,386,Gray,1,,,CRC2440,Orca Network,Public,Kara Langus
9/6/22,2022,9,14:00,7,214,Minke,1,,,Antonio Banderas,Orca Network,Public,Cindi Rausch
9/6/22,2022,9,9:10,7,224,Minke,1,,,,Orca Network,Reliable,Tom Reeve
6/11/18,2018,6,12:00,17C,54,Orca,,Ts,,,Other,TWM,Jeanne Hyde
5/28/18,2018,5,16:00,17C,54,Orca,,Ts,,T101s,Other,TWM,Jeanne Hyde
5/28/18,2018,5,11:00,17C,54,Orca,4,Ts,,T86As (not A1) and T124A2s,Other,TWM,Jeanne Hyde
5/20/18,2018,5,,17C,54,Orca,5-Apr,Ts,,,Other,TWM,Jeanne Hyde
5/17/18,2018,5,,17C,54,Orca,,Ts,,"T36As, T65, T63, T100s, T123s, T23, T23Cs, T124As",Other,TWM,Jeanne Hyde
5/9/18,2018,5,8:00,17C,54,Orca,4,Ts,,T63 and 3 females,Other,TWM,Jeanne Hyde
9/5/22,2022,9,11:15,1-Aug,375,Humpback,1,,,,Orca Network,Reliable,Nedra Wilson CWW
9/5/22,2022,9,9:40,1-Aug,375,Humpback,1,,,,Orca Network,Public,Erik Anderson
9/5/22,2022,9,6:45,8,375,Humpback,1,,,,Orca Network,Reliable,Whitney Dock CWW
9/5/22,2022,9,10:49,2-Aug,378,Gray,1,,,,Orca Network,Public,Mary Douglas
9/5/22,2022,9,9:45,8,385,Gray,1,,,,Orca Network,Public,John Storbeck
5/2/18,2018,5,,17C,54,Orca,,Ts,,T36As,Other,TWM,Jeanne Hyde
5/17/18,2018,5,,17C,54,Orca,,Ts,,,Hotline,Reliable,RKA
9/4/22,2022,9,7:25,1-Aug,374,Humpback,1,,,,Orca Network,Public,Peter Deventer
9/4/22,2022,9,8:00,8,375,Humpback,1,,,Malachite,Orca Network,Public,Kristina Trowbridge
9/4/22,2022,9,7:20,2-Aug,378,Gray,1,,,CRC2440,Orca Network,Public,John Storbeck
9/3/22,2022,9,11:10,9,388,Humpback,1,,,,Orca Network,Public,Terry Wegner
9/3/22,2022,9,10:44,9,389,Humpback,1,,,CRC16017,Orca Network,Reliable,Bart Rulon
9/3/22,2022,9,17:09,2-Aug,382,Gray,1,,,,Orca Network,Public,Chasen Davis
2/14/18,2018,2,,17C,54,Orca,,Ts,,"T100s, T124As, possibly T124Ds",Orca Network,Public,Jim MacQuarrie
1/2/18,2018,1,,17C,54,Orca,,Jp,,J19,Other,TWM,Jeanne Hyde
9/2/22,2022,9,15:57,2-Aug,386,Humpback,1,,,CRC16017,Orca Network,Reliable,Washington State Ferries
9/2/22,2022,9,11:35,2-Aug,383,Humpback,1,,,CRC16017,Orca Network,Reliable,Bart Rulon
9/2/22,2022,9,6:49,2-Aug,386,Humpback,1,,,,Orca Network,Reliable,Washington State Ferries
9/2/22,2022,9,15:26,8,385,Gray,1,,,CRC2440,Orca Network,Reliable,Marilyn Armbruster
9/2/22,2022,9,15:00,2-Aug,382,Gray,1,,,CRC2440,Orca Network,Reliable,Marilyn Armbruster
9/2/22,2022,9,14:02,2-Aug,382,Gray,1,,,CRC2440,Orca Network,Reliable,Stephanie Raymond
9/2/22,2022,9,10:46,2-Aug,382,Gray,1,,,CRC2440,Orca Network,Reliable,Bart Rulon
9/2/22,2022,9,9:10,2-Aug,382,Gray,1,,,CRC2440,Orca Network,Public,Joe Eichinger
8/26/22,2022,8,14:11,1-Aug,374,Humpback,1,,,Malachite,Orca Network,Reliable,Stephanie Raymond
1/9/18,2018,1,15:15,17C,54,Orca,6,Ts,,,Orca Network,Public,Deidre Steward
8/24/22,2022,8,7:30,10,405,Humpback,1,,,,Orca Network,Public,Larissa Wright
8/21/22,2022,8,12:04,2-Aug,386,Gray,1,,,,Orca Network,Public,Tamara Kelley
9/4/17,2017,9,9:00,17C,54,Orca,4,Ts,,,Other,TWM,Jeanne Hyde
6/17/17,2017,6,,17C,54,Orca,,Ts,,,Other,TWM,Jeanne Hyde
10/28/17,2017,10,14:26,17C,54,Orca,6,Ts,,T46B,Other,WW,Prince Of Whales
5/12/17,2017,5,13:21,17C,54,Orca,20,J,,Wide spread,Other,WW,Prince Of Whales
10/28/17,2017,10,14:30,17C,54,Orca,,J,,,Other,TWM,Jeanne Hyde
10/2/17,2017,10,,17C,54,Orca,,J,,,Other,TWM,Jeanne Hyde
8/31/22,2022,8,12:40,2-Aug,386,Humpback,1,,,Two Spot,Orca Network,Reliable,Justine Buckmaster
10/28/17,2017,10,16:00,17C,54,Orca,,J,,Foraging,Orca Network,Public,Peter Hamilton
7/19/17,2017,7,,17C,54,Orca,,Ts,,,Other,TWM,Jeanne Hyde
8/30/22,2022,8,16:17,8,375,Humpback,1,,,,Orca Network,Public,Camille Hartley
8/30/22,2022,8,8:45,1-Aug,375,Humpback,1,,,,Orca Network,Reliable,Steve Boskovich CWW
8/30/22,2022,8,10:00,9,399,Humpback,1,,,Two Spot CRC16017,Orca Network,Reliable,Janine Harles
7/18/17,2017,7,,17C,54,Orca,,Ts,,,Other,TWM,Jeanne Hyde
7/12/17,2017,7,,17C,54,Orca,,Ts,,"T34s, T37s, T36s, T99s, T46s",Other,TWM,Jeanne Hyde
7/9/17,2017,7,17:00,17C,54,Orca,3,Ts,,Two females one male.,Orca Network,Public,Wanda Blok
7/8/17,2017,7,21:00,17C,54,Orca,3,Ts,,,Orca Network,Public,Wanda Blok
8/29/22,2022,8,17:45,7,192,Humpback,1,,,,Orca Network,Public,Alex Shapiro
8/29/22,2022,8,18:20,9,401,Harbor Porpoise,12,,,,Orca Network,Reliable,Alisa LB
8/29/22,2022,8,8:12,9,392,Humpback,2,,,,Orca Network,Public,Rob Harris
8/29/22,2022,8,15:03,7,188,Gray,1,,,,Orca Network,Public,Julie Woodruff
8/29/22,2022,8,17:44,2-Aug,376,Gray,2,,,CRC2440 & CRC2441,Orca Network,Public,John Storbeck
8/29/22,2022,8,16:30,2-Aug,377,Gray,2,,,,Orca Network,Public,John Storbeck
8/29/22,2022,8,15:42,2-Aug,378,Gray,2,,,CRC2440 & CRC2441,Orca Network,Public,John Storbeck
8/29/22,2022,8,14:50,2-Aug,382,Gray,1,,,CRC2440,Orca Network,Public,Joe Eichinger
5/11/17,2017,5,10:30,17C,54,Orca,,,,unknown who,Other,TWM,Jeanne Hyde
10/28/17,2017,10,14:32,17C,54,Orca,6,Ts,,T46Bs,Other,WW,Wild Whales Vancouver
10/28/17,2017,10,14:15,17C,54,Orca,6,Ts,,T46Bs,Other,WW,Wild Whales Vancouver
8/28/22,2022,8,12:33,7,176,Humpback,1,,,,Orca Network,Public,James Richardson
8/28/22,2022,8,11:31,7,181,Humpback,1,,,,Orca Network,Public,Nhoj Klop
8/28/22,2022,8,15:46,2-Aug,378,Gray,1,,,CRC2440,Orca Network,Public,Chasen Davis
8/28/22,2022,8,11:55,2-Aug,378,Gray,1,,,CRC2440,Orca Network,Public,John Storbeck
8/28/22,2022,8,7:40,2-Aug,378,Gray,1,,,CRC2440,Orca Network,Public,John Storbeck
8/28/22,2022,8,9:12,13,423,Gray,2,,,,Orca Network,Public,Anon
8/22/17,2017,8,12:10,17C,54,Orca,6,Ts,,T40s,Other,WW,Wild Whales Vancouver
7/28/17,2017,7,14:14,17C,54,Orca,4,Ts,,T37As,Other,WW,Wild Whales Vancouver
7/19/17,2017,7,14:00,17C,54,Orca,4,Ts,,T37As,Other,WW,Wild Whales Vancouver
7/15/17,2017,7,16:56,17C,54,Orca,5,Ts,,,Other,WW,Wild Whales Vancouver
7/12/17,2017,7,10:21,17C,54,Orca,9-Aug,Ts,,"T77s, T37As",Other,WW,Wild Whales Vancouver
8/27/22,2022,8,11:50,1-Aug,375,Humpback,1,,,Malachite,Orca Network,Reliable,Jill Hein
8/27/22,2022,8,10:54,1-Aug,375,Humpback,1,,,Malachite,Orca Network,Reliable,Bart Rulon
8/27/22,2022,8,20:15,2-Aug,378,Gray,1,,,CRC 2440,Orca Network,Public,John Storbeck
8/27/22,2022,8,19:30,9,365,Minke,1,,,,Orca Network,Reliable,Rachel Haight
7/12/17,2017,7,10:15,17C,54,Orca,9-Jun,Ts,,"T77s, T37As",Other,WW,Wild Whales Vancouver
6/18/17,2017,6,4:30,17C,54,Orca,7,Ts,,"T123s, T137s",Other,WW,Wild Whales Vancouver
8/26/22,2022,8,15:30,1-Aug,373,Humpback,1,,,Malachite,Orca Network,Public,Rachel Haight
8/26/22,2022,8,13:41,1-Aug,374,Humpback,1,,,Malachite,Orca Network,Reliable,Stephanie Raymond
8/26/22,2022,8,13:05,1-Aug,374,Humpback,1,,,Malachite,Orca Network,Reliable,Jill Hein
8/26/22,2022,8,7:45,1-Aug,375,Humpback,1,,,,Orca Network,Reliable,Tom Lange CWW
8/26/22,2022,8,19:08,9,401,Humpback,1,,,,Orca Network,Reliable,Maija Holston WSF
8/26/22,2022,8,8:15,9,396,Humpback,1,,,,Orca Network,Public,Jeff Blake
5/12/17,2017,5,13:14,17C,54,Orca,20,J,,,Other,WW,Wild Whales Vancouver
5/11/17,2017,5,11:30,17C,54,Orca,10-Sep,Ts,,"T018,19s, T123s, T77A",Other,WW,Wild Whales Vancouver
4/26/17,2017,4,12:55,17C,54,Orca,8,Ts,,T11s and T46Bs and T46C2,Other,WW,Wild Whales Vancouver
8/6/19,2019,8,10:00,17C,55,Orca,8,T,,T18s,Other,TWM,Jeanne Hyde
8/25/22,2022,8,14:40,2-Aug,382,Gray,1,,,CRC2440,Orca Network,Public,Joe Eichinger
8/25/22,2022,8,9:16,8,384,Gray,1,,,,Orca Network,Public,Michele Sayed
3/19/20,2020,3,12:00,17C,55,Orca,1,,,,Other,TWM,Jeanne Hyde
5/17/19,2019,5,11:30,17C,55,Orca,5,Ts,,T49As,Other,Reliable,Jeanne Hyde
5/14/19,2019,5,16:00,17C,55,Orca,12,Ts,,"T101s, T036As, T124As",Other,Reliable,Jeanne Hyde
5/14/19,2019,5,13:00,17C,55,Orca,5,Ts,,"T123s, T86As",Other,Reliable,Jeanne Hyde
4/13/19,2019,4,11:00,17C,55,Orca,5,,,,Email,Reliable,Jeanne Hyde
4/7/19,2019,4,11:00,17C,55,Orca,,,,,Email,Reliable,Jeanne Hyde
9/30/19,2019,9,15:01,17C,55,Orca,5,Ts,,T37As,Email,WW,Vancouver Island WW Co
8/10/19,2019,8,11:35,17C,55,Orca,1,Ts,,T65A2,Email,WW,Vancouver Island WW Co
8/24/22,2022,8,13:10,1-Aug,375,Humpback,1,,,Malachite,Orca Network,Public,Aaron Gill
8/24/22,2022,8,9:05,1-Aug,375,Humpback,1,,,Malachite,Orca Network,Reliable,Jill Hein
8/24/22,2022,8,8:12,1-Aug,375,Humpback,1,,,,Orca Network,Public,Jim Sheehan
8/24/22,2022,8,13:29,2-Aug,382,Gray,1,,,CRC2440,Orca Network,Public,John C Storbeck
8/9/19,2019,8,11:30,17C,55,Orca,4,Ts,,T18s,Email,WW,Vancouver Island WW Co
8/9/19,2019,8,11:25,17C,55,Orca,4,Ts,,T18s,Email,WW,Vancouver Island WW Co
7/25/19,2019,7,16:50,17C,55,Orca,6,Ts,,T124As,Email,WW,Vancouver Island WW Co
7/6/19,2019,7,15:49,17C,55,Orca,4,Ts,,"T124C, T124A2s",Email,WW,Vancouver Island WW Co
7/5/19,2019,7,16:36,17C,55,Orca,,Ts,,T337As,Email,WW,Vancouver Island WW Co
5/30/19,2019,5,15:10,17C,55,Orca,,Ts,,"T87, T124s, T86As, T124C, T75Bs, T75Cs, T65Bs",Email,WW,Vancouver Island WW Co
5/18/19,2019,5,12:54,17C,55,Orca,3,Ts,,T86As,Email,WW,Vancouver Island WW Co
5/17/19,2019,5,12:30,17C,55,Orca,4,Ts,,T49As,Email,WW,Vancouver Island WW Co
5/17/19,2019,5,13:00,17C,55,Orca,4,Ts,,T49As,Email,WW,Vancouver Island WW Co
5/15/19,2019,5,14:30,17C,55,Orca,15,Ts,,"T123s, T86As, T124C, T123s, T86As, T124C,",Email,WW,Vancouver Island WW Co
8/23/22,2022,8,17:09,1-Aug,374,Humpback,1,,,Malachite,Orca Network,Public,Lucienne Miodonski
8/23/22,2022,8,13:38,1-Aug,379,Humpback,1,,,,Orca Network,Public,Patricia Philips
8/23/22,2022,8,9:19,1-Aug,375,Humpback,1,,,,Orca Network,Reliable,Steve Buckley CWW
8/23/22,2022,8,8:00,8,384,Gray,1,,,,Orca Network,Public,Alice Moyal
5/15/19,2019,5,14:15,17C,55,Orca,16,Ts,,"T123s, T86As, T124C, T101s, T36As, T124As",Email,WW,Vancouver Island WW Co
5/10/19,2019,5,14:15,17C,55,Orca,4,Ts,,T123s,Email,WW,Vancouver Island WW Co
5/3/19,2019,5,14:30,17C,55,Orca,7,Ts,,"T124As (not T124A2s), T124Ds",Email,WW,Vancouver Island WW Co
9/19/18,2018,9,13:02,17C,55,Orca,4,Ts,,T18's,Other,WW,Wild Whales Vancouver
8/21/18,2018,8,16:11,17C,55,Orca,5,Ts,,T18's/T19's,Other,WW,Wild Whales Vancouver
7/28/18,2018,7,16:58,17C,55,Orca,4,Ts,,T99's,Other,WW,Wild Whales Vancouver
7/28/18,2018,7,16:54,17C,55,Orca,4,Ts,,T99's,Other,WW,Wild Whales Vancouver
7/3/18,2018,7,11:50,17C,55,Orca,15,Ts,,"T65As, T36As, T124As",Other,WW,Wild Whales Vancouver
7/3/18,2018,7,12:00,17C,55,Orca,15-20,Ts,,"T65As, T36s, T124s",Other,WW,Wild Whales Vancouver
6/29/18,2018,6,11:19,17C,55,Orca,6,Ts,,T37As,Other,WW,Wild Whales Vancouver
5/28/18,2018,5,12:34,17C,55,Orca,7,Ts,,T86A's & T124A2's,Other,WW,Wild Whales Vancouver
8/22/22,2022,8,8:45,1-Aug,375,Humpback,1,,,Malachite,Orca Network,Public,Kristina Trowbridge
8/22/22,2022,8,13:55,1-Aug,375,Humpback,1,,,,Orca Network,Public,Greg Smallidge
8/22/22,2022,8,7:34,2-Aug,386,Gray,1,,,,Orca Network,Public,Mike Harbaugh
8/22/22,2022,8,13:50,2-Aug,386,Gray,1,,,,Orca Network,Public,Lauren McManus
8/22/22,2022,8,12:39,2-Aug,386,Gray,1,,,CRC2440,Orca Network,Public,Matt Leaman
8/22/22,2022,8,11:45,2-Aug,386,Gray,1,,,,Orca Network,Public,J J Newman
8/22/22,2022,8,,2-Aug,386,Gray,1,,,,Orca Network,Reliable,Melissa Simmons
6/27/18,2018,6,18:00,17C,55,Orca,,Ts,,T65As,Other,TWM,Jeanne Hyde
6/22/18,2018,6,,17C,55,Orca,,Ts,,T137s,Other,TWM,Jeanne Hyde
6/11/18,2018,6,13:00,17C,55,Orca,,Ts,,"T100, T101s",Other,TWM,Jeanne Hyde
5/2/18,2018,5,,17C,55,Orca,,Ts,,T36As,Other,TWM,Jeanne Hyde
3/11/18,2018,3,,17C,55,Orca,,J,,,Other,TWM,Jeanne Hyde
9/4/17,2017,9,,17C,55,Orca,10,Ts,,,Other,TWM,Jeanne Hyde
7/9/17,2017,7,15:50,17C,55,Orca,4,Ts,,T49A,Other,WW,Prince Of Whales
10/9/17,2017,10,12:00,17C,55,Orca,,J,,,Other,TWM,Jeanne Hyde
8/21/22,2022,8,8:30,1-Aug,375,Humpback,1,,,Malachite,Orca Network,Reliable,Jill Hein
8/21/22,2022,8,17:50,2-Aug,385,Gray,1,,,CRC2440,Orca Network,Reliable,Bart Rulon
8/21/22,2022,8,11:44,2-Aug,386,Gray,1,,,,Orca Network,Public,Lauren McManus
8/21/22,2022,8,10:46,2-Aug,386,Gray,1,,,CRC2440,Orca Network,Reliable,Bart Rulon
8/21/22,2022,8,10:20,2-Aug,386,Gray,1,,,CRC2440,Orca Network,Reliable,Bart Rulon
10/9/17,2017,10,,17C,55,Orca,,J,,,Other,TWM,Jeanne Hyde
6/20/17,2017,6,,17C,55,Orca,,Ts,,,Other,TWM,Jeanne Hyde
5/12/17,2017,5,,17C,55,Orca,,J,,J Pod (report -Gary-EcoVentrs),Other,TWM,Jeanne Hyde
8/22/17,2017,8,10:05,17C,55,Orca,8-May,Ts,,T41 and others,Other,WW,Wild Whales Vancouver
7/19/17,2017,7,3:21,17C,55,Orca,4,Ts,,T37As,Other,WW,Wild Whales Vancouver
7/15/17,2017,7,12:14,17C,55,Orca,4,Ts,,T99s,Other,WW,Wild Whales Vancouver
8/19/22,2022,8,17:10,2-Aug,383,Gray,1,,,CRC2440,Orca Network,Reliable,Bart Rulon
7/15/17,2017,7,11:20,17C,55,Orca,4,Ts,,T99,Other,WW,Wild Whales Vancouver
7/12/17,2017,7,12:10,17C,55,Orca,9-Aug,Ts,,"T77s, T37As",Other,WW,Wild Whales Vancouver
7/9/17,2017,7,16:48,17C,55,Orca,4,Ts,,T49As,Other,WW,Wild Whales Vancouver
6/18/17,2017,6,12:26,17C,55,Orca,8,Ts,,maybe T137s,Other,WW,Wild Whales Vancouver
6/17/17,2017,6,,17C,55,Orca,10-Aug,Ts,,,Other,WW,Wild Whales Vancouver
6/17/17,2017,6,10:55,17C,55,Orca,13,Ts,,"T49C, maybe T124As",Other,WW,Wild Whales Vancouver
5/20/17,2017,5,12:00,17C,55,Orca,2,Ts,,,Other,WW,Wild Whales Vancouver
4/26/17,2017,4,12:00,17C,55,Orca,8-Jul,Ts,,T11s and T46Bs,Other,WW,Wild Whales Vancouver
4/24/18,2018,4,13:00,29C,56,Orca,4,Ts,,T36A's,Other,WW,Wild Whales Vancouver
8/21/17,2017,8,9:34,29C,56,Orca,20,Ts,,T34/T36A/T37B/T46/T137,Other,WW,Prince Of Whales
8/21/17,2017,8,11:32,29C,56,Orca,15-20,Ts,,"T46s, T37s, T147s",Other,WW,Wild Whales Vancouver
6/4/17,2017,6,14:33,29C,56,Orca,5,Ts,,,Other,WW,Wild Whales Vancouver
5/19/17,2017,5,12:15,29C,56,Orca,14,Ts,,"T137s, T101s, T100s",Other,WW,Wild Whales Vancouver
8/29/18,2018,8,12:01,29C,57,Orca,4,Ts,,T36 + T36B,Other,WW,Wild Whales Vancouver
6/11/18,2018,6,14:00,29C,57,Orca,,Ts,,T77s,Other,TWM,Jeanne Hyde
8/20/22,2022,8,11:20,7,176,Humpback,2,,,,Orca Network,Reliable,Monika Wieland
8/20/22,2022,8,10:16,7,181,Humpback,2,,,,Orca Network,Public,Michelline Halliday
8/20/22,2022,8,10:40,1-Aug,375,Humpback,1,,,Malachite,Orca Network,Public,Matt Henning
8/20/22,2022,8,10:03,1-Aug,375,Humpback,1,,,,Orca Network,Public,Serena Tierra
8/20/22,2022,8,8:40,1-Aug,374,Humpback,1,,,,Orca Network,Reliable,Janet Wright
8/20/22,2022,8,19:06,9,398,Humpback,1,,,Two Spot,Orca Network,Public,Kim Paulsen
8/20/22,2022,8,17:45,2-Aug,386,Humpback,1,,,CRC16017,Orca Network,Reliable,Bart Rulon
8/20/22,2022,8,19:10,2-Aug,383,Gray,1,,,CRC2440,Orca Network,Reliable,Mark Acarregui
8/20/22,2022,8,13:45,2-Aug,381,Gray,1,,,,Orca Network,Public,Roger
8/20/22,2022,8,8:35,1-Aug,379,Gray,1,,,CR-2440,Orca Network,Public,Kristi Etzell
8/20/22,2022,8,7:35,1-Aug,380,Gray,1,,,,Orca Network,Public,Kristi Etzell
8/20/22,2022,8,7:40,1-Aug,379,Gray,1,,,,Orca Network,Public,Martha Sinclair
9/5/17,2017,9,18:00,29C,57,Orca,40,JKL,,JKL,Other,WW,Prince Of Whales
8/21/17,2017,8,10:16,29C,57,Orca,20,Ts,,"T46s, T123s, T37s, T18s, T46s",Other,WW,Wild Whales Vancouver
8/21/17,2017,8,10:10,29C,57,Orca,20,Ts,,"T18, T37, T46s, T46Cs, T123s",Other,WW,Wild Whales Vancouver
6/4/17,2017,6,14:00,29C,57,Orca,5,Ts,,T65As,Other,WW,Wild Whales Vancouver
6/4/17,2017,6,13:58,29C,57,Orca,9-May,Ts,,T65As,Other,WW,Wild Whales Vancouver
5/20/17,2017,5,12:43,29C,57,Orca,4,Ts,,,Other,WW,Wild Whales Vancouver
8/29/18,2018,8,11:00,29C,58,Orca,4,Ts,,"T036B's, T36",Other,WW,Wild Whales Vancouver
6/22/18,2018,6,12:00,29C,58,Orca,~10,Ts,,T137's and unknowns,Other,WW,Wild Whales Vancouver
9/6/17,2017,9,13:30,29C,58,Orca,4,Ts,,"T18, T19, T19B, T19C",Other,WW,Wild Whales Vancouver
9/10/21,2021,9,13:59,29C,59,Orca,23,,J,Beh:Fast moving,BCCSN,Reliable,
9/6/18,2018,9,10:25,29C,59,Orca,~10,SRs,JLp,,Other,WW,Wild Whales Vancouver
8/29/18,2018,8,10:34,29C,59,Orca,4,Ts,,"T036B's, T36",Other,WW,Wild Whales Vancouver
4/29/18,2018,4,11:07,29C,59,Orca,10,Ts,,"T101's, T100's, T100B's",Other,WW,Wild Whales Vancouver
9/6/18,2018,9,,29C,59,Orca,,SRs,JLp,"Js and maybe 18 Ls, large spread",Other,Reliable,J50 Core Team
8/22/17,2017,8,18:05,29C,59,Orca,5,Ts,,T46,Other,WW,Prince Of Whales
9/26/17,2017,9,11:11,29C,59,Orca,30-50,JL,,,Other,WW,Wild Whales Vancouver
8/19/22,2022,8,17:08,8,372,Humpback,1,,,,Orca Network,Public,Shelby Stevens
8/19/22,2022,8,8:25,1-Aug,375,Humpback,1,,,,Orca Network,Public,Matt Henning
8/19/22,2022,8,11:45,9,397,Humpback,1,,,,Orca Network,Public,David Bovay
8/19/22,2022,8,8:18,9,401,Humpback,1,,,,Orca Network,Reliable,Janine Harles
8/19/22,2022,8,19:11,2-Aug,386,Gray,1,,,,Orca Network,Reliable,John Miller
8/19/22,2022,8,13:15,2-Aug,383,Gray,1,,,CRC2440,Orca Network,Reliable,Bart Rulon
8/19/22,2022,8,11:12,2-Aug,383,Gray,1,,,,Orca Network,Reliable,Fred Lundahl
8/19/22,2022,8,8:30,1-Aug,379,Gray,1,,,,Orca Network,Public,Caleb Spyksma
9/25/17,2017,9,13:15,29C,59,Orca,0,JL,,"J and L Pod - J27, L87, L92, L91",Other,WW,Wild Whales Vancouver
8/25/17,2017,8,10:28,29C,59,Orca,2,Ts,,T137s,Other,WW,Wild Whales Vancouver
7/2/17,2017,7,12:01,29C,59,Orca,8,Ts,,,Other,WW,Wild Whales Vancouver
7/2/17,2017,7,11:15,29C,59,Orca,8,Ts,,,Other,WW,Wild Whales Vancouver
8/18/22,2022,8,14:59,1-Aug,374,Humpback,1,,,Malachite,Orca Network,Public,Sam Wallace
8/18/22,2022,8,13:37,1-Aug,374,Humpback,1,,,,Orca Network,Reliable,Stephanie Raymond
8/18/22,2022,8,9:39,1-Aug,374,Humpback,1,,,,Orca Network,Reliable,Jerry Cochran
8/18/22,2022,8,17:45,9,401,Humpback,1,,,,Orca Network,Reliable,John Miller
8/18/22,2022,8,18:47,2-Aug,386,Gray,1,,,,,Reliable,John Miller
8/18/22,2022,8,17:15,2-Aug,386,Gray,1,,,,Orca Network,Public,Evan Minichiello
8/18/22,2022,8,13:30,2-Aug,386,Gray,1,,,,Orca Network,Public,Patricia Duff
5/20/17,2017,5,12:00,29C,59,Orca,2,Ts,,T100 and T101,Other,WW,Wild Whales Vancouver
7/26/22,2022,7,14:25,29C,60,Orca,,J,,,BCCSN,Reliable,
7/26/22,2022,7,14:26,29C,60,Orca,,J,,,Other,Soundwatch,
7/26/22,2022,7,14:16,29C,60,Orca,,J,,,Other,Soundwatch,
9/10/21,2021,9,14:24,29C,60,Orca,23,,J,Beh:Fast moving,BCCSN,Reliable,
8/17/22,2022,8,10:40,9,399,Humpback,1,,,,Orca Network,Public,Christina Lee
8/17/22,2022,8,18:40,9,401,Humpback,1,,,,Orca Network,Reliable,John Miller WSF
8/17/22,2022,8,11:58,1-Aug,375,Humpback,1,,,,Orca Network,Reliable,Krista Paulino
8/17/22,2022,8,5:50,1-Aug,374,Humpback,1,,,,Orca Network,Public,Steve Demerit
8/17/22,2022,8,19:04,2-Aug,383,Gray,1,,,,Orca Network,Public,Luanne Seymour
8/17/22,2022,8,14:10,2-Aug,383,Gray,1,,,,Orca Network,Public,Susan Matthews
8/17/22,2022,8,10:45,2-Aug,383,Gray,1,,,,Orca Network,Public,Donna George
8/17/22,2022,8,9:14,2-Aug,383,Gray,1,,,,Orca Network,Public,Luanne Seymore
8/17/22,2022,8,7:48,2-Aug,383,Gray,1,,,,Orca Network,Public,Arial Brewer
10/5/18,2018,10,12:57,29C,60,Orca,4,Ts,,T100's,Other,WW,Wild Whales Vancouver
10/5/18,2018,10,12:30,29C,60,Orca,4,Ts,,Unknown,Other,WW,Wild Whales Vancouver
9/14/18,2018,9,11:16,29C,60,Orca,10,J,,J's + Unknows,Other,WW,Wild Whales Vancouver
9/14/18,2018,9,10:58,29C,60,Orca,10,J,,,Other,WW,Wild Whales Vancouver
9/8/18,2018,9,11:35,29C,60,Orca,20,JL,,,Other,WW,Wild Whales Vancouver
9/2/18,2018,9,17:43,29C,60,Orca,~8,Ts,,T99's + Unknown,Other,WW,Wild Whales Vancouver
6/22/18,2018,6,13:10,29C,60,Orca,4,Ts,,unknown,Other,WW,Wild Whales Vancouver
4/22/18,2018,4,13:44,29C,60,Orca,7,Ts,,"T123's, T100's",Other,WW,Wild Whales Vancouver
10/9/17,2017,10,13:20,29C,60,Orca,5,Ts,,T46C2/T101,Other,WW,Prince Of Whales
10/9/17,2017,10,13:00,29C,60,Orca,5,Ts,,"T101s, T046C2",Other,WW,Wild Whales Vancouver
9/26/17,2017,9,11:19,29C,60,Orca,30-40,JL,,,Other,WW,Wild Whales Vancouver
9/25/17,2017,9,13:12,29C,60,Orca,0,JL,,,Other,WW,Wild Whales Vancouver
9/21/17,2017,9,12:15,29C,60,Orca,0,L,,"L Pod- Solstice, Cruiser",Other,WW,Wild Whales Vancouver
8/16/22,2022,8,20:10,9,401,Humpback,1,,,,Orca Network,Reliable,Our Wild Puget Sound
8/16/22,2022,8,18:25,9,401,Humpback,1,,,,Orca Network,Reliable,Our Wild Puget Sound
8/16/22,2022,8,14:00,9,394,Humpback,1,,,,Orca Network,Public,Kim Paulsen
8/16/22,2022,8,12:04,9,399,Humpback,1,,,,Orca Network,Public,Barbara Grove
8/16/22,2022,8,14:42,11,420,Humpback,1,,,,Orca Network,Public,Alyssa Niedzwiedz
8/16/22,2022,8,18:06,2-Aug,383,Gray,1,,,,Orca Network,Public,Luanne Seymour
8/16/17,2017,8,14:12,29C,60,Orca,8,Ts,,T65As,Other,WW,Wild Whales Vancouver
8/16/17,2017,8,12:56,29C,60,Orca,9,Ts,,T65As,Other,WW,Wild Whales Vancouver
5/29/17,2017,5,16:00,29C,60,Orca,3,Ts,,T123s,Other,WW,Wild Whales Vancouver
9/22/17,2017,9,10:55,29C,61,Orca,20-Oct,L,,"L Pod - L47s, L92, and others",Other,WW,Wild Whales Vancouver
9/22/17,2017,9,10:50,29C,61,Orca,15-Oct,L,,,Other,WW,Wild Whales Vancouver
8/16/17,2017,8,14:34,29C,61,Orca,8,Ts,,T65As,Other,WW,Wild Whales Vancouver
6/24/17,2017,6,9:50,29C,61,Orca,3,Ts,,T123s,Other,WW,Wild Whales Vancouver
10/15/17,2017,10,17:00,29C,62,Orca,,,Ts,,Orca Network,Public,Melissa Hafting
9/16/21,2021,9,11:36,29C,64,Orca,15,L,,"Beh:Slow moving,Feeding",BCCSN,Reliable,
6/29/19,2019,6,21:34,29C,64,Orca,,,,,Other,TWM,Jeanne Hyde
8/15/22,2022,8,14:00,7,224,Humpback,2,,,,Orca Network,Public,Tom Reeve
8/15/22,2022,8,9:10,18C,151,Humpback,1,,,,Orca Network,Public,Adam Errett
8/15/22,2022,8,13:41,7,244,Humpback,1,,,,Orca Network,Public,Alyssa White
8/15/22,2022,8,19:22,9,401,Humpback,1,,,,Orca Network,Public,Matt Leaman
8/15/22,2022,8,18:05,9,401,Humpback,1,,,,Orca Network,Reliable,Justine Buckmaster
8/15/22,2022,8,15:31,1-Aug,380,Gray,1,,,,Orca Network,Public,Hugh Gerrard
8/15/22,2022,8,14:30,1-Aug,379,Gray,1,,,,Orca Network,Public,John Ficalora
8/15/22,2022,8,13:30,7,186,Minke,1,,,,Orca Network,Reliable,Tim Ferris
9/20/20,2020,9,12:00,29C,64,Orca,,,,,Other,TWM,Jeanne Hyde
7/16/19,2019,7,16:30,29C,64,Orca,2,T,,"T036, T036Bs, and maybe T036s",Other,Reliable,Jeanne Hyde
7/12/19,2019,7,14:30,29C,64,Orca,3,T,,T65Bs,Other,Reliable,Jeanne Hyde
6/25/19,2019,6,10:00,29C,64,Orca,4,Ts,,T124A2s and T124C,Other,Reliable,Jeanne Hyde
6/22/19,2019,6,11:00,29C,64,Orca,3,Ts,,,Other,Reliable,Jeanne Hyde
6/22/19,2019,6,11:00,29C,64,Orca,3,Ts,,,Other,Reliable,Jeanne Hyde
8/14/22,2022,8,20:36,6,342,Humpback,1,,,,Orca Network,Public,Ryan
8/14/22,2022,8,18:52,9,398,Humpback,1,,,,Orca Network,Public,Jill Lipoti
8/14/22,2022,8,18:16,9,398,Humpback,1,,,,Orca Network,Reliable,Trevor Tillman
8/13/22,2022,8,17:45,6,248,Humpback,1,,,,Orca Network,Public,Sarah Geist
8/13/22,2022,8,13:03,6,360,Humpback,1,,,,Orca Network,Public,Michi Sander
8/13/22,2022,8,17:30,2-Aug,386,Gray,1,,,,Orca Network,Reliable,Marilyn Armbruster
8/13/22,2022,8,15:50,2-Aug,386,Gray,1,,,,Orca Network,Reliable,Fred Lundahl
8/13/22,2022,8,14:10,2-Aug,383,Gray,1,,,,Orca Network,Public,Stacey Estlick Wright
3/14/19,2019,3,12:39,29C,64,Orca,5,,,T46's/T137's. Sea lions and harbor seals in area. Traveling towards jetty.,Orca Network,Public,Scott MacLeod
8/12/22,2022,8,14:10,7,186,Gray,1,,,,Orca Network,Reliable,Stephanie Raymond
8/12/22,2022,8,12:00,1-Aug,380,Gray,1,,,,Orca Network,Public,Catherine Drews
8/12/22,2022,8,11:00,7,186,Minke,1,,,,Orca Network,Public,Stephanie Celt
5/10/19,2019,5,11:00,29C,64,Orca,4,Ts,,T123s,Other,Reliable,Jeanne Hyde
8/11/22,2022,8,18:15,1-Aug,380,Gray,1,,,,Orca Network,Reliable,Sandy Pollard
8/11/22,2022,8,16:45,1-Aug,380,Gray,1,,,,Orca Network,Public,Niki Duits Wright
8/11/22,2022,8,13:20,1-Aug,379,Gray,1,,,,Orca Network,Public,Martha Poppy Sinclair
8/11/22,2022,8,11:56,1-Aug,379,Gray,1,,,CRC2440,Orca Network,Public,Judy Moore
8/11/22,2022,8,,1-Aug,380,Gray,1,,,CRC2440,Orca Network,Public,Catherine Drews
4/29/19,2019,4,11:30,29C,64,Orca,,J,,,Email,Reliable,Jeanne Hyde
3/14/19,2019,3,10:00,29C,64,Orca,,,,,Email,Reliable,Jeanne Hyde
8/10/22,2022,8,20:06,1-Aug,379,Gray,1,,,,Orca Network,Public,Nancy Culp Zaretke
8/10/22,2022,8,7:45,2-Aug,383,Gray,1,,,,Orca Network,Public,Laura Persaud
1/29/19,2019,1,15:00,29C,64,Orca,2,,,,Email,Reliable,Jeanne Hyde
1/29/19,2019,1,14:15,29C,64,Orca,1,,,,Email,Reliable,Jeanne Hyde
7/22/19,2019,7,16:51,29C,64,Orca,,Ts,,"T77s, T87A1, and others",Email,WW,Vancouver Island WW Co
7/22/19,2019,7,11:26,29C,64,Orca,,Ts,,"T77s, T65As (minus T65A2)",Email,WW,Vancouver Island WW Co
7/16/19,2019,7,11:30,29C,64,Orca,5,Ts,,T46s,Email,WW,Vancouver Island WW Co
6/23/19,2019,6,16:28,29C,64,Orca,15,Ts,,"T124C, T99s, T36s",Email,WW,Vancouver Island WW Co
9/4/18,2018,9,,29C,64,Orca,45,JL,,,Other,TWM,Jeanne Hyde
7/20/18,2018,7,,29C,64,Orca,5,Jp,,all day,Other,TWM,Jeanne Hyde
7/15/18,2018,7,,29C,64,Orca,10,Jp,,end of day,Other,TWM,Jeanne Hyde
7/30/18,2018,7,,29C,64,Orca,24,J,,early morning sighting,Other,TWM,Jeanne Hyde
9/5/18,2018,9,11:49,29C,64,Orca,~7,Ts,,Unknown,Other,WW,Wild Whales Vancouver
7/18/18,2018,7,12:08,29C,64,Orca,5,Ts,,T46's,Other,WW,Wild Whales Vancouver
8/9/22,2022,8,7:54,2-Aug,384,Harbor Porpoise,3,,,,Orca Network,Reliable,Lori Christopher
6/22/18,2018,6,11:57,29C,64,Orca,3,Ts,,Not sure. Could be T86's,Other,WW,Wild Whales Vancouver
8/9/22,2022,8,10:45,2-Aug,385,Gray,1,,,CRC2441,Orca Network,Reliable,Justine Buckmaster
8/9/22,2022,8,13:40,2-Aug,386,Gray,1,,,CRC2440,Orca Network,Public,Janelle Lynn
8/9/22,2022,8,10:53,2-Aug,386,Gray,1,,,,Orca Network,Public,Lisa Villanueva
8/9/22,2022,8,6:40,2-Aug,385,Gray,1,,,Feeding on shoreline,Orca Network,Public,Greg Heiss
5/1/18,2018,5,,29C,64,Orca,,Ts,,T123s and T36As,Other,TWM,Jeanne Hyde
9/11/18,2018,9,9:00,29C,64,Orca,15-20,JLp,,"SW sees J16 alone early on and J26. Durban sees J26, J42, all other Js BUT J36, J16 and J50. Also sees all 18Ls.",Other,Reliable,J50 Core Team
8/13/22,2022,8,7:30,1-Aug,379,Gray,1,,,IDs: CRC2440,Orca Network,Public,Shannon Moore Kavanaugh
9/8/17,2017,9,8:00,29C,64,Orca,,,Ts?,,Other,TWM,Jeanne Hyde
6/30/17,2017,6,,29C,64,Orca,,JKp,,"Js, L87, K14s - Sandheads/East Point/Coal Docks all day",Other,TWM,Jeanne Hyde
9/22/17,2017,9,9:09,29C,64,Orca,20,L,,Spread out,Other,WW,Prince Of Whales
8/29/17,2017,8,9:20,29C,64,Orca,14,Ts,,T36A/T37A/T137; T37A1 present,Other,WW,Prince Of Whales
6/24/17,2017,6,9:26,29C,64,Orca,3,Ts,,T123,Other,WW,Prince Of Whales
9/25/17,2017,9,11:00,29C,64,Orca,,JL,,,Other,TWM,Jeanne Hyde
9/21/17,2017,9,11:00,29C,64,Orca,,JL,,assuming Js and Ls,Other,TWM,Jeanne Hyde
9/5/17,2017,9,8:00,29C,64,Orca,,L,,,Other,TWM,Jeanne Hyde
8/29/17,2017,8,8:30,29C,64,Orca,,Ts,,T137s,Other,TWM,Jeanne Hyde
8/28/17,2017,8,12:00,29C,64,Orca,,Ts,,,Other,TWM,Jeanne Hyde
8/22/17,2017,8,18:30,29C,64,Orca,,Ts,,T46s,Other,TWM,Jeanne Hyde
7/3/17,2017,7,,29C,64,Orca,,Ts,,"all T36s,T99s,37As,51,101s",Other,TWM,Jeanne Hyde
7/2/17,2017,7,,29C,64,Orca,,Ts,,"T36s, T99s, T37As, T51, T101s",Other,TWM,Jeanne Hyde
7/26/22,2022,7,13:32,29C,65,Orca,,J,,,BCCSN,Reliable,
10/13/21,2021,10,13:33,29C,65,Orca,15,K,,"Beh:Slow moving,Feeding",BCCSN,Reliable,
10/5/18,2018,10,13:42,29C,65,Orca,4,Ts,,T100's,Other,WW,Wild Whales Vancouver
9/17/18,2018,9,16:28,29C,65,Orca,~4,SRs,,,Other,WW,Wild Whales Vancouver
9/6/18,2018,9,11:09,29C,65,Orca,4,J,,"J26, J16 + Unknows",Other,WW,Wild Whales Vancouver
8/3/18,2018,8,16:41,29C,65,Orca,8,Ts,,T137's and T46's,Other,WW,Wild Whales Vancouver
7/30/18,2018,7,10:15,29C,65,Orca,13,Jp,,"J16's, J17's, J27, + L87",Other,WW,Wild Whales Vancouver
7/22/18,2018,7,11:00,29C,65,Orca,13,Ts,,"T46s (T122), T137s, T99",Other,WW,Wild Whales Vancouver
6/22/18,2018,6,14:31,29C,65,Orca,~12,Ts,,T137's,Other,WW,Wild Whales Vancouver
4/21/18,2018,4,12:36,29C,65,Orca,4,Ts,,T100's,Other,WW,Wild Whales Vancouver
4/21/18,2018,4,12:22,29C,65,Orca,4,Ts,,T100's,Other,WW,Wild Whales Vancouver
9/26/17,2017,9,12:00,29C,65,Orca,20-30,JL,,,Other,WW,Wild Whales Vancouver
9/10/17,2017,9,15:30,29C,65,Orca,8,Ts,,"T18, T19s, T36bs, T37a",Other,WW,Wild Whales Vancouver
9/2/17,2017,9,11:54,29C,65,Orca,4,Ts,,"T18, T19, T19B, T19C",Other,WW,Wild Whales Vancouver
8/18/17,2017,8,16:45,29C,65,Orca,7,Ts,,"T37As, T37Bs",Other,WW,Wild Whales Vancouver
7/16/17,2017,7,13:15,29C,65,Orca,18-20,Ts,,"T101s, T36Bs, T36s, T46s",Other,WW,Wild Whales Vancouver
7/16/17,2017,7,11:55,29C,65,Orca,4,Ts,,T46s,Other,WW,Wild Whales Vancouver
7/2/17,2017,7,10:24,29C,65,Orca,0,Ts,,"T37A, T99s, T51",Other,WW,Wild Whales Vancouver
3/3/21,2021,3,16:04,29C,66,Orca,10,,J,"Beh:Slow moving,Fast moving",BCCSN,Reliable,
9/10/21,2021,9,16:35,29C,66,Orca,25,,J,"Beh:Slow moving,Fast moving,Breaching",BCCSN,Reliable,
9/1/18,2018,9,13:45,29C,66,Orca,4,Ts,,T100's,Other,WW,Wild Whales Vancouver
9/1/18,2018,9,10:39,29C,66,Orca,5-Apr,Ts,,T100's,Other,WW,Wild Whales Vancouver
6/22/18,2018,6,12:57,29C,66,Orca,5-Apr,Ts,,T137's +1,Other,WW,Wild Whales Vancouver
4/22/18,2018,4,14:00,29C,66,Orca,2,Ts,,,Other,TWM,Jeanne Hyde
9/2/17,2017,9,11:11,29C,66,Orca,4,Ts,,"T18, T19, T19B, T19C",Other,WW,Wild Whales Vancouver
9/2/17,2017,9,11:17,29C,66,Orca,4,Ts,,"T18, T19, T19B, T19C",Other,WW,Wild Whales Vancouver
8/25/17,2017,8,11:12,29C,66,Orca,4,Ts,,T137s,Other,WW,Wild Whales Vancouver
5/26/18,2018,5,18:30,29C,67,Orca,,Ts,,T101s,Other,TWM,Jeanne Hyde
5/19/17,2017,5,12:15,29C,67,Orca,14-20,Ts,,"T124A1, T137s, T100s, T101s",Other,WW,Wild Whales Vancouver
6/27/18,2018,6,15:50,29C,68,Orca,6,Ts,,T65A's,Other,WW,Wild Whales Vancouver
6/27/18,2018,6,15:26,29C,68,Orca,6,Ts,,T65A's,Other,WW,Wild Whales Vancouver
6/8/18,2018,6,11:23,29C,68,Orca,15-20,Ts,,"T101's, T100's, T18's, T19, T37, T37A's",Other,WW,Wild Whales Vancouver
6/8/18,2018,6,11:27,29C,68,Orca,15,Ts,,"T100's, T19'a, unknowns",Other,WW,Wild Whales Vancouver
9/1/17,2017,9,12:36,29C,68,Orca,4,Ts,,T18s and T19s,Other,WW,Wild Whales Vancouver
9/19/18,2018,9,12:08,29C,69,Orca,4,Ts,,T18's,Other,WW,Wild Whales Vancouver
9/5/18,2018,9,13:45,29C,69,Orca,~7,Ts,,T101's + Unknowns,Other,WW,Wild Whales Vancouver
6/23/18,2018,6,16:04,29C,69,Orca,6,Ts,,T37's and T37A's,Other,WW,Wild Whales Vancouver
6/22/18,2018,6,10:23,29C,69,Orca,4,Ts,,T137's,Other,WW,Wild Whales Vancouver
8/26/17,2017,8,15:30,29C,69,Orca,5,Ts,,T2B and T90s,Other,WW,Wild Whales Vancouver
7/12/17,2017,7,13:20,29C,69,Orca,9,Ts,,"T77s, T37As",Other,WW,Wild Whales Vancouver
6/4/17,2017,6,14:43,29C,69,Orca,5,Ts,,,Other,WW,Wild Whales Vancouver
5/26/17,2017,5,14:45,29C,69,Orca,9-Jun,Ts,,,Other,WW,Wild Whales Vancouver
5/26/17,2017,5,15:08,29C,69,Orca,9-Jun,Ts,,T86As and T123s,Other,WW,Wild Whales Vancouver
4/23/17,2017,4,12:20,29C,69,Orca,8,Ts,,,Other,WW,Wild Whales Vancouver
4/23/17,2017,4,12:00,29C,69,Orca,8,Ts,,"T124As?, T124A2s, T124Ds",Other,WW,Wild Whales Vancouver
6/11/18,2018,6,10:18,17C,70,Orca,5-Apr,Ts,,T77's,Other,WW,Wild Whales Vancouver
6/11/18,2018,6,10:26,17C,70,Orca,3,Ts,,T77's,Other,WW,Wild Whales Vancouver
5/26/18,2018,5,14:05,17C,70,Orca,4,Ts,,T101's,Other,WW,Wild Whales Vancouver
9/23/17,2017,9,13:45,17C,70,Orca,4,Ts,,T36Bs and T37A1,Other,WW,Wild Whales Vancouver
9/23/17,2017,9,14:00,17C,70,Orca,4,Ts,,T36Bs and T37A1,Other,WW,Wild Whales Vancouver
7/28/17,2017,7,12:23,17C,70,Orca,5-Apr,Ts,,T37As,Other,WW,Wild Whales Vancouver
5/22/21,2021,5,12:05,17C,71,Orca,4,,T,Beh:Slow moving,BCCSN,Reliable,
10/1/19,2019,10,13:00,17C,71,Orca,,,,,Email,Reliable,Jeanne Hyde
6/30/18,2018,6,11:45,17C,71,Orca,5,Ts,,T65As,Other,WW,Wild Whales Vancouver
6/30/18,2018,6,10:44,17C,71,Orca,5-Apr,Ts,,T65As,Other,WW,Wild Whales Vancouver
5/26/18,2018,5,13:19,17C,71,Orca,4,Ts,,T101's & T102,Other,WW,Wild Whales Vancouver
6/7/18,2018,6,13:00,17C,71,Orca,,Ts,,,Other,TWM,Jeanne Hyde
1/2/18,2018,1,,17C,71,Orca,2,,,unsure if residents or transients,Other,TWM,Jeanne Hyde
8/25/17,2017,8,10:00,17C,71,Orca,,Ts,,,Other,TWM,Jeanne Hyde
9/23/17,2017,9,14:19,17C,71,Orca,4,Ts,,T37A1 and others,Other,WW,Wild Whales Vancouver
9/23/17,2017,9,14:20,17C,71,Orca,4,Ts,,T36Bs and T37A1,Other,WW,Wild Whales Vancouver
7/28/17,2017,7,11:57,17C,71,Orca,4,Ts,,T37As,Other,WW,Wild Whales Vancouver
6/18/17,2017,6,13:30,17C,71,Orca,8,Ts,,"T137s, T124s?",Other,WW,Wild Whales Vancouver
3/13/22,2022,3,15:48,29C,72,Orca,,J,,,BCCSN,Reliable,
3/13/22,2022,3,15:48,29C,72,Orca,,J,,,BCCSN,Reliable,
3/13/22,2022,3,15:48,29C,72,Orca,,J,,,BCCSN,Reliable,
7/29/20,2020,7,10:45,29C,72,Orca,5,,,,Other,TWM,jeanne Hyde
6/9/19,2019,6,10:45,29C,72,Orca,1,Ts,,T124C,Other,Reliable,Jeanne Hyde
9/30/19,2019,9,15:00,29C,72,Orca,5,Ts,,T37As,Email,WW,Vancouver Island WW Co
8/10/19,2019,8,12:15,29C,72,Orca,1,Ts,,T65A2,Email,WW,Vancouver Island WW Co
7/25/19,2019,7,17:45,29C,72,Orca,6,Ts,,T124As,Email,WW,Vancouver Island WW Co
7/22/19,2019,7,11:24,29C,72,Orca,,Ts,,"T65As (T65A2), T77s",Email,WW,Vancouver Island WW Co
7/16/19,2019,7,16:15,29C,72,Orca,4,Ts,,T101s,Email,WW,Vancouver Island WW Co
6/29/18,2018,6,10:45,29C,72,Orca,5,Ts,,T37As,Other,WW,Wild Whales Vancouver
6/29/18,2018,6,10:31,29C,72,Orca,6-May,Ts,,"T37As, T37",Other,WW,Wild Whales Vancouver
8/29/17,2017,8,15:00,29C,72,Orca,,Ts,,T90s and T2B,Other,TWM,Jeanne Hyde
8/26/17,2017,8,19:30,29C,72,Orca,,Ts,,"T36s, T34s, all 37s, 18s, 100s, 30s",Other,TWM,Jeanne Hyde
9/6/17,2017,9,12:00,29C,72,Orca,4,Ts,,T37As,Other,WW,Wild Whales Vancouver
8/29/17,2017,8,14:45,29C,72,Orca,5,Ts,,T2B and T90s,Other,WW,Wild Whales Vancouver
8/23/17,2017,8,10:40,29C,72,Orca,2,Ts,,T137s,Other,WW,Wild Whales Vancouver
7/15/17,2017,7,10:33,29C,72,Orca,4,Ts,,T99,Other,WW,Wild Whales Vancouver
7/1/17,2017,7,15:34,29C,72,Orca,7,Ts,,T65As and 75Bs,Other,WW,Wild Whales Vancouver
8/17/18,2018,8,13:56,29C,73,Orca,8,Ts,,T46's + T137's,Other,WW,Wild Whales Vancouver
6/8/18,2018,6,,29C,73,Orca,8,Ts,,T101'aa,Other,WW,Wild Whales Vancouver
6/3/18,2018,6,10:40,29C,73,Orca,11,Ts,,"T049A's, T065A's",Other,WW,Wild Whales Vancouver
6/2/18,2018,6,9:59,29C,73,Orca,8,Ts,,"T65A's, T102, T123's",Other,WW,Wild Whales Vancouver
10/9/17,2017,10,14:05,29C,73,Orca,23,J,,Very spread out,Other,WW,Prince Of Whales
8/17/18,2018,8,11:40,29C,74,Orca,8,Ts,,T46's + T137's,Other,WW,Wild Whales Vancouver
8/17/18,2018,8,11:49,29C,74,Orca,8,Ts,,T46's + T137's,Other,WW,Wild Whales Vancouver
6/27/18,2018,6,14:02,29C,74,Orca,6-May,Ts,,T65A's,Other,WW,Wild Whales Vancouver
6/3/18,2018,6,11:07,29C,74,Orca,11,Ts,,"T49A's, T65A's",Other,WW,Wild Whales Vancouver
9/1/17,2017,9,11:30,29C,74,Orca,4,Ts,,T18s and T19s,Other,WW,Wild Whales Vancouver
8/25/17,2017,8,11:10,29C,74,Orca,2,Ts,,T137A and T137B,Other,WW,Wild Whales Vancouver
4/29/17,2017,4,11:00,29C,74,Orca,12,Ts,,"T011s, T124A2s, T124s",Other,WW,Wild Whales Vancouver
6/27/18,2018,6,13:36,29C,75,Orca,5-Apr,Ts,,T65A's,Other,WW,Wild Whales Vancouver
6/1/18,2018,6,18:15,29C,75,Orca,,Ts,,"T101s, T86As (not A1), T124A2",Other,TWM,Jeanne Hyde
4/29/18,2018,4,,29C,75,Orca,,Ts,,"T100s, T101s",Other,TWM,Jeanne Hyde
9/8/17,2017,9,14:00,29C,75,Orca,4,Ts,,T100s,Other,WW,Wild Whales Vancouver
9/8/17,2017,9,14:01,29C,75,Orca,4,Ts,,T100s,Other,WW,Wild Whales Vancouver
9/2/17,2017,9,10:18,29C,75,Orca,4,Ts,,"T18, T19, T19B, T19C",Other,WW,Wild Whales Vancouver
8/29/17,2017,8,14:15,29C,75,Orca,5,Ts,,T2B and T90s,Other,WW,Wild Whales Vancouver
8/9/22,2022,8,9:48,29C,76,Orca,,J,,,BCCSN,Reliable,
9/1/18,2018,9,11:08,29C,76,Orca,5,Ts,,T100's,Other,WW,Wild Whales Vancouver
8/30/18,2018,8,9:55,29C,76,Orca,,Ts,,T99's + T101's + T124's,Other,WW,Wild Whales Vancouver
6/22/18,2018,6,15:36,29C,76,Orca,12-Oct,Ts,,T137's + T124A's +?,Other,WW,Wild Whales Vancouver
10/3/17,2017,10,12:17,29C,76,Orca,10,Ts,,T100s and T101s,Other,WW,Wild Whales Vancouver
9/25/17,2017,9,11:22,29C,76,Orca,0,JL,,,Other,WW,Wild Whales Vancouver
9/21/17,2017,9,12:50,29C,76,Orca,0,L,,Lpod - Cruiser,Other,WW,Wild Whales Vancouver
5/20/17,2017,5,11:11,29C,76,Orca,3,Ts,,T101s and T102s,Other,WW,Wild Whales Vancouver
4/29/17,2017,4,12:10,29C,76,Orca,10,Ts,,"T11s, T123s?, and others",Other,WW,Wild Whales Vancouver
7/12/22,2022,7,14:06,29C,77,Orca,,JKL,,,BCCSN,Reliable,
7/12/22,2022,7,14:06,29C,77,Orca,,JKL,,,BCCSN,Reliable,
7/12/22,2022,7,13:09,29C,77,Orca,,JKL,,,BCCSN,Reliable,
7/12/22,2022,7,13:09,29C,77,Orca,,JKL,,,BCCSN,Reliable,
7/12/22,2022,7,14:31,29C,77,Orca,,JK,,,Other,Soundwatch,
7/12/22,2022,7,14:31,29C,77,Orca,,JK,,,Other,Soundwatch,
7/12/22,2022,7,14:00,29C,77,Orca,,JK,,,Other,Soundwatch,
7/12/22,2022,7,14:00,29C,77,Orca,,JK,,,Other,Soundwatch,
7/12/22,2022,7,13:31,29C,77,Orca,,JK,,,Other,Soundwatch,
7/12/22,2022,7,13:31,29C,77,Orca,,JK,,,Other,Soundwatch,
7/10/22,2022,7,12:56,29C,77,Orca,,JKL,,,BCCSN,Reliable,
7/10/22,2022,7,12:56,29C,77,Orca,,JKL,,,BCCSN,Reliable,
9/4/21,2021,9,11:36,29C,77,Orca,20,,J,"Beh:Slow moving,Spy-hopping,Breaching",BCCSN,Reliable,
9/2/21,2021,9,11:07,29C,77,Orca,20,J,,"Beh:Slow moving,Feeding",BCCSN,Reliable,
1/30/19,2019,1,15:00,29C,77,Orca,4,,,,Email,Reliable,Jeanne Hyde
4/16/19,2019,4,14:00,29C,77,Orca,4,Ts,,T36As,Email,WW,Vancouver Island WW Co
9/15/18,2018,9,,29C,77,Orca,60,JKLp,,"J pod, K pod, 18 L pod whales",Other,TWM,Jeanne Hyde
9/10/18,2018,9,,29C,77,Orca,42,JLp,,Js and 18Ls,Other,TWM,Jeanne Hyde
9/6/18,2018,9,12:12,29C,77,Orca,10-Jun,SRs,JLp,,Other,WW,Wild Whales Vancouver
8/21/18,2018,8,13:30,29C,77,Orca,~6,Ts,,T65A's,Other,WW,Wild Whales Vancouver
8/10/18,2018,8,13:28,29C,77,Orca,3,SRs,J,Mike,Other,WW,Wild Whales Vancouver
7/22/18,2018,7,11:40,29C,77,Orca,8-Jul,Ts,,Unknown,Other,WW,Wild Whales Vancouver
7/11/18,2018,7,11:20,29C,77,Orca,~4,Ts,,T36As,Other,WW,Wild Whales Vancouver
6/28/18,2018,6,11:16,29C,77,Orca,15-20,J,,,Other,WW,Wild Whales Vancouver
6/28/18,2018,6,11:45,29C,77,Orca,15-20,J,,,Other,WW,Wild Whales Vancouver
9/11/18,2018,9,,29C,77,Orca,,JLp,,last vessel on scene left them,Other,Reliable,J50 Core Team
7/16/17,2017,7,,29C,77,Orca,,Ts,,,Other,TWM,Jeanne Hyde
9/21/17,2017,9,13:07,29C,77,Orca,0,L,,"Lpod- cruiser, magic and muncher",Other,WW,Wild Whales Vancouver
9/10/17,2017,9,15:15,29C,77,Orca,2,Ts,,T101A and B,Other,WW,Wild Whales Vancouver
9/8/17,2017,9,14:05,29C,77,Orca,4,Ts,,T100s,Other,WW,Wild Whales Vancouver
7/16/17,2017,7,12:16,29C,77,Orca,20,Ts,,"T101s, T36Bs, T36s, T46s",Other,WW,Wild Whales Vancouver
7/2/17,2017,7,10:05,29C,77,Orca,6,Ts,,T65As and T51,Other,WW,Wild Whales Vancouver
6/30/17,2017,6,12:01,29C,77,Orca,15-Dec,JKp,,J Pod and K14s,Other,WW,Wild Whales Vancouver
6/28/17,2017,6,12:00,29C,77,Orca,20-25,JKp,,J Pod and K14s,Other,WW,Wild Whales Vancouver
6/27/17,2017,6,13:07,29C,77,Orca,0,JpKp,,"J14s, J46, J39, K14s, L87",Other,WW,Wild Whales Vancouver
4/21/17,2017,4,11:05,29C,77,Orca,3,Ts,,T123s,Other,WW,Wild Whales Vancouver
8/23/18,2018,8,15:32,29C,78,Orca,4,Ts,,T101's,Other,WW,Wild Whales Vancouver
9/10/21,2021,9,12:00,29C,79,Orca,59,JL,,,Other,TWM,Jeanne Hyde
9/12/20,2020,9,9:14,29C,79,Orca,,"J,K,L",,,Orca Network,Reliable,Monika Wieland Sheilds
9/22/20,2020,9,13:30,29C,79,Orca,,,,,Other,TWM,Jeanne Hyde
9/12/20,2020,9,8:00,29C,79,Orca,,,,,Other,TWM,Jeanne Hyde
9/4/20,2020,9,12:00,29C,79,Orca,22,J,,,Other,TWM,Jeanne Hyde
4/2/19,2019,4,11:00,29C,79,Orca,,J,,,Email,Reliable,Jeanne Hyde
10/15/19,2019,10,16:15,29C,79,Orca,,Ts,,T14,Email,Reliable,Jeanne Hyde
9/15/18,2018,9,,29C,79,Orca,60,JKLp,,"J pod, K pod, 18 L pod whales",Other,TWM,Jeanne Hyde
9/14/18,2018,9,,29C,79,Orca,60,JKLp,,,Other,TWM,Jeanne Hyde
9/11/18,2018,9,,29C,79,Orca,42,JLp,,all day. Js and 18Ls.,Other,TWM,Jeanne Hyde
9/6/18,2018,9,,29C,79,Orca,42,JLp,,spent most of the day making their way SE in SOG,Other,TWM,Jeanne Hyde
7/28/18,2018,7,,29C,79,Orca,5,Jp,,J17s,Other,TWM,Jeanne Hyde
9/20/17,2017,9,13:00,29C,79,Orca,,JL,,"L41, L94, L90 and L47.",Orca Network,Public,Kristina Trowbridge
6/28/17,2017,6,12:00,29C,79,Orca,,J,,,Orca Network,Reliable,Gary Sutton
4/29/17,2017,4,,29C,79,Orca,,Ts,,"T11s, T86As, !00s and T00Bs, 101s, 124As(all), 124Ds - total 28",Other,TWM,Jeanne Hyde
8/19/22,2022,8,10:41,29C,80,Orca,1,,T,,Orca Network,Public,Bren
9/2/22,2022,9,13:59,29C,80,Orca,,J,,,Other,Soundwatch,
9/2/22,2022,9,13:59,29C,80,Orca,,J,,,Other,Soundwatch,
9/2/22,2022,9,13:59,29C,80,Orca,,J,,,Other,Soundwatch,
7/12/22,2022,7,15:19,29C,80,Orca,4,,JKL,,Orca Network,Public,Andria Papineau
4/12/22,2022,4,13:30,29C,80,Orca,12,T,,"IDs: T34’s, T37’s, and T65B’s  Beh:  Valiant was seen in the middle of a large group of Bigg's killer whales (T34’s, T37’s, and T65B’s) rolling around and trumpeting with each surfacing, a behavior associated with aggression in humpback whales.",Orca Network,Reliable,"Erin Gless, PWWA"
11/30/21,2021,11,8:55,29C,80,Orca,5,,J,,Orca Network,Public,Johnathan Hunter
9/3/21,2021,9,15:01,29C,80,Orca,13,,T,3 mile spread,Other,Soundwatch,
9/3/21,2021,9,14:28,29C,80,Orca,20,,J,,Other,Soundwatch,
7/4/21,2021,7,18:19,29C,80,Orca,3,,T,Beh:Slow moving,BCCSN,Reliable,
9/22/20,2020,9,15:00,29C,80,Orca,,,,,Other,TWM,Jeanne Hyde
6/23/19,2019,6,10:45,29C,80,Orca,4,Ts,,T36/T36Bs,Other,Reliable,Jeanne Hyde
2/24/19,2019,2,15:30,29C,80,Orca,,,,,Email,Reliable,Jeanne Hyde
9/16/19,2019,9,13:11,29C,80,Orca,4,Ts,,T123s,Email,WW,Vancouver Island WW Co
9/16/19,2019,9,13:55,29C,80,Orca,4,Ts,,T123s,Email,WW,Vancouver Island WW Co
6/29/19,2019,6,16:44,29C,80,Orca,8,Ts,,"T46s, T46Bs",Email,WW,Vancouver Island WW Co
6/15/19,2019,6,13:40,29C,80,Orca,4,Ts,,T101s,Email,WW,Vancouver Island WW Co
4/28/19,2019,4,14:25,29C,80,Orca,8,Ts,,T36Bs and T99,Email,WW,Vancouver Island WW Co
4/23/18,2018,4,14:45,29C,80,Orca,8-May,Ts,,"T37A 
T36's",Other,WW,Vancouver Island Whale Watch
7/8/18,2018,7,11:30,29C,80,Orca,8,Ts,,"T36As, T124As",Other,WW,Western Prince
9/27/18,2018,9,,29C,80,Orca,22,J,,late morning,Other,TWM,Jeanne Hyde
9/11/18,2018,9,,29C,80,Orca,42,JLp,,Js and 18Ls. All day,Other,TWM,Jeanne Hyde
9/11/18,2018,9,15:55,29C,80,Orca,,Jp,,J11s,Other,WW,Western Prince
8/1/18,2018,8,,29C,80,Orca,42,JLp,,a.m. sighting. Js and 18Ls,Other,TWM,Jeanne Hyde
7/22/18,2018,7,,29C,80,Orca,5,Jp,,,Other,TWM,Jeanne Hyde
7/30/18,2018,7,,29C,80,Orca,24,J,,All of J pod and L87,Other,TWM,Jeanne Hyde
8/1/18,2018,8,10:31,29C,80,Orca,~10,SRs,JLp,,Other,WW,Wild Whales Vancouver
7/30/18,2018,7,11:44,29C,80,Orca,13,J,,,Other,WW,Wild Whales Vancouver
7/20/18,2018,7,15:45,29C,80,Orca,5,Jp,,J16s,Other,WW,Wild Whales Vancouver
4/23/18,2018,4,15:00,29C,80,Orca,2,Ts,,,Other,TWM,Jeanne Hyde
9/8/18,2018,9,,29C,80,Orca,,J,,J50 with J16 - confirmed with photos,Other,Reliable,J50 Core Team
9/4/18,2018,9,,29C,80,Orca,,L12s,,,Other,Reliable,J50 Core Team
9/21/17,2017,9,15:45,29C,80,Orca,,L,,Foraging,Other,WW,Western Prince
9/19/17,2017,9,15:30,29C,80,Orca,,Ts,,"T036, T036Bs, T037A1, T065As, T099s and T137s.     all membersT65As and T99s back together!",Other,TWM,Jeanne Hyde
9/17/17,2017,9,,29C,80,Orca,,Ts,,,Other,TWM,Jeanne Hyde
6/27/17,2017,6,,29C,80,Orca,,JKp,,"Js, L87, K14s - stayed in area all day",Other,TWM,Jeanne Hyde
10/9/17,2017,10,17:50,29C,80,Orca,,J,,,Other,TWM,Jeanne Hyde
9/21/17,2017,9,,29C,80,Orca,,JL,,assuming Js and Ls,Other,TWM,Jeanne Hyde
7/27/17,2017,7,9:30,29C,80,Orca,6-May,,Ts,assumed Ts,Other,TWM,Jeanne Hyde
7/24/17,2017,7,,29C,80,Orca,,SRs,,,Other,TWM,Jeanne Hyde
5/8/17,2017,5,19:00,29C,80,Orca,,J,,,Other,TWM,Jeanne Hyde
9/10/17,2017,9,11:30,29C,80,Orca,4,Ts,,T101s,Other,WW,Wild Whales Vancouver
7/13/17,2017,7,15:20,29C,80,Orca,9-Jun,Ts,,,Other,WW,Wild Whales Vancouver
6/30/17,2017,6,11:16,29C,80,Orca,15-25,J,,,Other,WW,Wild Whales Vancouver
6/28/17,2017,6,11:15,29C,80,Orca,20-Aug,JKp,,J Pod and K14s,Other,WW,Wild Whales Vancouver
6/27/17,2017,6,12:18,29C,80,Orca,15-20,JKp,,J Pod and K14s,Other,WW,Wild Whales Vancouver
9/2/22,2022,9,11:17,29C,81,Orca,,J,,,BCCSN,Reliable,
9/2/22,2022,9,14:22,29C,81,Orca,,J,,,BCCSN,Reliable,
9/2/22,2022,9,15:00,29C,81,Orca,,J,,,Other,Soundwatch,
9/2/22,2022,9,14:26,29C,81,Orca,,J,,,Other,Soundwatch,
7/12/22,2022,7,12:10,29C,81,Orca,,JKL,,,BCCSN,Reliable,
7/12/22,2022,7,14:57,29C,81,Orca,,JK,,,Other,Soundwatch,
7/10/22,2022,7,14:20,29C,81,Orca,,JKL,,,BCCSN,Reliable,
7/10/22,2022,7,13:46,29C,81,Orca,,JKL,,,BCCSN,Reliable,
7/10/22,2022,7,15:59,29C,81,Orca,,JKL,,,Other,Soundwatch,
7/10/22,2022,7,15:25,29C,81,Orca,,JKL,,,Other,Soundwatch,
7/10/22,2022,7,14:57,29C,81,Orca,,JKL,,,Other,Soundwatch,
7/10/22,2022,7,14:32,29C,81,Orca,,JKL,,,Other,Soundwatch,
7/10/22,2022,7,13:57,29C,81,Orca,,JK,,,Other,Soundwatch,
5/25/22,2022,5,15:39,29C,81,Orca,,J,,,BCCSN,Reliable,
9/3/21,2021,9,13:45,29C,81,Orca,11,,T,,Other,Soundwatch,
9/1/21,2021,9,12:33,29C,81,Orca,9,,JL,,Other,Soundwatch,
9/1/21,2021,9,12:00,29C,81,Orca,9,JL,,J pod and L54s,Other,Soundwatch,
9/1/21,2021,9,11:35,29C,81,Orca,7,J,,5 mile spread; j and unk,Other,Soundwatch,
9/1/21,2021,9,12:56,29C,81,Orca,15,,L,"Beh:Slow moving,Feeding",BCCSN,Reliable,
6/25/21,2021,6,13:46,29C,81,Orca,3,,J,Beh:Slow moving,BCCSN,Reliable,
9/8/18,2018,9,13:25,29C,81,Orca,10,J,,,Other,WW,Wild Whales Vancouver
8/1/18,2018,8,10:05,29C,81,Orca,~10,SRs,JLp,,Other,WW,Wild Whales Vancouver
7/11/18,2018,7,10:58,29C,81,Orca,~8,Ts,,T36As,Other,WW,Wild Whales Vancouver
7/11/18,2018,7,10:22,29C,81,Orca,~6,Ts,,Unknown,Other,WW,Wild Whales Vancouver
6/28/18,2018,6,16:43,29C,81,Orca,15-16,Ts,,NA,Other,WW,Wild Whales Vancouver
8/29/17,2017,8,10:28,29C,81,Orca,10-Aug,Ts,,"T137s, T37",Other,WW,Wild Whales Vancouver
7/13/17,2017,7,15:15,29C,81,Orca,6-May,Ts,,,Other,WW,Wild Whales Vancouver
6/28/17,2017,6,18:21,29C,81,Orca,0,JKp,,J Pod and K14s,Other,WW,Wild Whales Vancouver
6/28/17,2017,6,11:22,29C,81,Orca,0,JKp,,J Pod and K14s,Other,WW,Wild Whales Vancouver
6/27/17,2017,6,11:30,29C,81,Orca,25,JKp,,Js and K14s,Other,WW,Wild Whales Vancouver
6/19/17,2017,6,13:25,29C,81,Orca,4,Ts,,,Other,WW,Wild Whales Vancouver
9/2/22,2022,9,15:28,29C,82,Orca,,J,,,Other,Soundwatch,
9/2/22,2022,9,15:28,29C,82,Orca,,J,,,Other,Soundwatch,
7/10/22,2022,7,11:50,29C,82,Orca,,JKL,,,BCCSN,Reliable,
7/10/22,2022,7,11:50,29C,82,Orca,,JKL,,,BCCSN,Reliable,
9/3/21,2021,9,13:38,29C,82,Orca,20,,L,,BCCSN,Reliable,
9/5/21,2021,9,9:42,29C,82,Orca,20,J,,"IDs:J26Beh:Slow moving,Feeding",BCCSN,Reliable,
9/20/20,2020,9,14:33,29C,82,Orca,11,SRs,,Behavior: 3 breaches,Other,Soundwatch,
9/20/20,2020,9,15:04,29C,82,Orca,6,SRs,,Behavior: Spyhops very active,Other,Soundwatch,
9/20/20,2020,9,15:33,29C,82,Orca,6,SRs,,,Other,Soundwatch,
9/20/20,2020,9,15:59,29C,82,Orca,6,SRs,,,Other,Soundwatch,
9/20/19,2019,9,13:15,29C,82,Orca,4,Ts,,T99s,Email,WW,Vancouver Island WW Co
9/20/19,2019,9,14:15,29C,82,Orca,4,Ts,,T99s,Email,WW,Vancouver Island WW Co
9/4/19,2019,9,11:33,29C,82,Orca,5,Ts,,T36/36Bs,Email,WW,Vancouver Island WW Co
8/26/19,2019,8,12:20,29C,82,Orca,10,Ts,,"T101s, T37s, T34s",Email,WW,Vancouver Island WW Co
8/23/19,2019,8,14:20,29C,82,Orca,7,Ts,,T34s and T37s,Email,WW,Vancouver Island WW Co
8/23/19,2019,8,15:40,29C,82,Orca,,Ts,,T34s and T37s,Email,WW,Vancouver Island WW Co
8/23/19,2019,8,11:56,29C,82,Orca,4,Ts,,T100s,Email,WW,Vancouver Island WW Co
8/23/19,2019,8,11:40,29C,82,Orca,4,Ts,,T100s,Email,WW,Vancouver Island WW Co
8/20/19,2019,8,12:40,29C,82,Orca,4,Ts,,T36As,Email,WW,Vancouver Island WW Co
7/12/19,2019,7,16:26,29C,82,Orca,3,Ts,,T65Bs,Email,WW,Vancouver Island WW Co
7/12/19,2019,7,16:25,29C,82,Orca,3,Ts,,T65Bs,Email,WW,Vancouver Island WW Co
6/25/19,2019,6,12:25,29C,82,Orca,3,Ts,,T65Bs,Email,WW,Vancouver Island WW Co
6/25/19,2019,6,11:30,29C,82,Orca,3,Ts,,T65Bs,Email,WW,Vancouver Island WW Co
6/23/19,2019,6,16:30,29C,82,Orca,15,Ts,,"T99s, T36A, T36B, T46s, T124C",Email,WW,Vancouver Island WW Co
6/7/19,2019,6,13:00,29C,82,Orca,6,Ts,,"T65Bs, T137s",Email,WW,Vancouver Island WW Co
9/11/18,2018,9,9:47,29C,82,Orca,20-30,J,,,Other,WW,Wild Whales Vancouver
9/5/18,2018,9,13:07,29C,82,Orca,5,Ts,,T10's,Other,WW,Wild Whales Vancouver
8/10/18,2018,8,11:46,29C,82,Orca,~9,J,,"J26, L87 + Unknowns",Other,WW,Wild Whales Vancouver
8/3/18,2018,8,17:45,29C,82,Orca,8,Ts,,T137's and T46's,Other,WW,Wild Whales Vancouver
7/22/18,2018,7,13:14,29C,82,Orca,8-Jul,Ts,,"T122, T137s, and others",Other,WW,Wild Whales Vancouver
7/18/18,2018,7,18:55,29C,82,Orca,5,J,,,Other,WW,Wild Whales Vancouver
7/18/18,2018,7,13:00,29C,82,Orca,5,Ts,,T46's,Other,WW,Wild Whales Vancouver
7/8/18,2018,7,11:36,29C,82,Orca,6-Apr,Ts,,"T124s., T36s",Other,WW,Wild Whales Vancouver
6/28/18,2018,6,17:00,29C,82,Orca,~4,Ts,,Possible T135+ from S,Other,WW,Wild Whales Vancouver
9/19/17,2017,9,15:30,29C,82,Orca,,Ts,,"T137As, T65As, T137s, T36, T99s and T37A1.  Very spread out traveling. T65A2 has fresh rake marks on leading edge of dorsal fin.",Other,WW,Western Prince
7/15/17,2017,7,12:30,29C,82,Orca,15,Ts,,"T101s, T36Bs, T46As",Other,WW,Wild Whales Vancouver
10/1/18,2018,10,14:35,29C,83,Orca,6,Ts,,T100's,Other,WW,Wild Whales Vancouver
8/30/18,2018,8,11:40,29C,83,Orca,~12,Ts,,T99's + T101's + T124's,Other,WW,Wild Whales Vancouver
8/30/18,2018,8,10:15,29C,83,Orca,,Ts,,T99's + T101's + T124's,Other,WW,Wild Whales Vancouver
7/18/18,2018,7,7:06,29C,83,Orca,4,Jp,,"J19, J26 and unknown",Other,WW,Wild Whales Vancouver
6/6/18,2018,6,15:07,29C,83,Orca,5,Ts,,T100's,Other,WW,Wild Whales Vancouver
5/9/18,2018,5,13:40,29C,83,Orca,4,Ts,,T65 & T63,Other,WW,Wild Whales Vancouver
6/6/18,2018,6,15:30,29C,83,Orca,,Ts,,T100s,Other,TWM,Jeanne Hyde
10/3/17,2017,10,12:08,29C,83,Orca,8,Ts,,,Other,WW,Wild Whales Vancouver
9/3/17,2017,9,13:23,29C,83,Orca,4,Ts,,T100s,Other,WW,Wild Whales Vancouver
6/19/17,2017,6,12:25,29C,83,Orca,4,Ts,,T101s,Other,WW,Wild Whales Vancouver
6/19/17,2017,6,13:36,29C,83,Orca,4,Ts,,T101s,Other,WW,Wild Whales Vancouver
6/3/17,2017,6,12:25,29C,83,Orca,3,Ts,,T101s,Other,WW,Wild Whales Vancouver
5/14/17,2017,5,15:15,29C,83,Orca,10,Ts,,"T101s, T124As, T124A2s",Other,WW,Wild Whales Vancouver
9/1/17,2017,9,10:30,29C,84,Orca,4,Ts,,T18s and T19s,Other,WW,Wild Whales Vancouver
6/23/18,2018,6,13:48,29C,85,Orca,3,Ts,,124A2's,Other,WW,Wild Whales Vancouver
5/9/18,2018,5,12:30,29C,85,Orca,4,Ts,,T18 & T19,Other,WW,Wild Whales Vancouver
4/9/18,2018,4,13:08,29C,85,Orca,7,Ts,,T124A's,Other,WW,Wild Whales Vancouver
7/1/17,2017,7,15:48,29C,85,Orca,7,Ts,,T65A/T75B,Other,WW,Prince Of Whales
8/26/17,2017,8,15:38,29C,85,Orca,0,Ts,,T19B,Other,WW,Wild Whales Vancouver
7/9/17,2017,7,12:15,29C,85,Orca,4,Ts,,T49As,Other,WW,Wild Whales Vancouver
7/6/17,2017,7,12:23,29C,85,Orca,4,Ts,,T49As,Other,WW,Wild Whales Vancouver
6/9/20,2020,6,16:00,29C,86,Orca,4,T,,T101s,Other,TWM,Jeanne Hyde
6/21/19,2019,6,11:40,29C,86,Orca,15,T,,"T36As, T65As, T124As, T77A",Email,WW,Vancouver Island WW Co
6/3/18,2018,6,12:30,29C,86,Orca,,Ts,,"T49As, T65As",Other,TWM,Jeanne Hyde
8/25/17,2017,8,12:30,29C,86,Orca,4,Ts,,T137s,Other,WW,Wild Whales Vancouver
8/23/17,2017,8,11:28,29C,86,Orca,4,Ts,,T137s,Other,WW,Wild Whales Vancouver
8/23/17,2017,8,10:40,29C,86,Orca,4,Ts,,T137s,Other,WW,Wild Whales Vancouver
7/22/17,2017,7,12:17,29C,86,Orca,15,Ts,,"T37, T37As, T46s",Other,WW,Wild Whales Vancouver
7/22/17,2017,7,12:25,29C,86,Orca,15,Ts,,"T37, T37As",Other,WW,Wild Whales Vancouver
7/15/17,2017,7,10:19,29C,86,Orca,4,Ts,,T99s,Other,WW,Wild Whales Vancouver
7/6/17,2017,7,11:27,29C,86,Orca,5,Ts,,T49As,Other,WW,Wild Whales Vancouver
6/23/19,2019,6,19:00,17C,87,Orca,,T,,"T124As, T124A1, T86As, T36As, T36Bs, T99s, T65As, T124, plus more",Other,TWM,Jeanne Hyde
7/16/19,2019,7,20:00,17C,87,Orca,10,T,,"T077s, T065As (not A2)",Other,Reliable,Jeanne Hyde
7/2/19,2019,7,,17C,87,Orca,4,Ts,,T101s,Other,Reliable,Jeanne Hyde
6/25/19,2019,6,11:00,17C,87,Orca,6,Ts,,T065As,Other,Reliable,Jeanne Hyde
6/21/19,2019,6,18:00,17C,87,Orca,,,,06 and 32,Other,Reliable,Jeanne Hyde
3/19/19,2019,3,15:15,17C,87,Orca,,J,,"J  Pod, CWR Encounter 20",Orca Network,CWR,
5/2/19,2019,5,6:45,17C,87,Orca,,Ts,,,Other,Reliable,Jeanne Hyde
4/18/19,2019,4,12:00,17C,87,Orca,9,Ts,,T123s and T49As,Email,Reliable,Jeanne Hyde
3/19/19,2019,3,15:30,17C,87,Orca,,J,,,Email,Reliable,Jeanne Hyde
10/19/19,2019,10,15:40,17C,87,Orca,4,Ts,,T49As minus T49A2,Email,WW,Vancouver Island WW Co
10/19/19,2019,10,13:40,17C,87,Orca,4,Ts,,T49As minus A2,Email,WW,Vancouver Island WW Co
9/11/19,2019,9,17:53,17C,87,Orca,4,Ts,,T18s,Email,WW,Vancouver Island WW Co
8/20/19,2019,8,11:46,17C,87,Orca,7,Ts,,Possibly T99s,Email,WW,Vancouver Island WW Co
8/8/19,2019,8,16:25,17C,87,Orca,4,Ts,,T18s,Email,WW,Vancouver Island WW Co
8/6/19,2019,8,11:27,17C,87,Orca,4,Ts,,T18s,Email,WW,Vancouver Island WW Co
7/31/19,2019,7,16:09,17C,87,Orca,5,Ts,,T65As minus T65A2,Email,WW,Vancouver Island WW Co
7/22/19,2019,7,16:20,17C,87,Orca,,Ts,,"T77s, T86A1, possibly T124As",Email,WW,Vancouver Island WW Co
6/28/19,2019,6,11:00,17C,87,Orca,4,Ts,,"T124A2s, T124C",Email,WW,Vancouver Island WW Co
6/27/19,2019,6,11:11,17C,87,Orca,1,Ts,,T77A,Email,WW,Vancouver Island WW Co
6/26/19,2019,6,16:24,17C,87,Orca,4,Ts,,"T124As, T124C",Email,WW,Vancouver Island WW Co
6/26/19,2019,6,16:45,17C,87,Orca,6,Ts,,"T124A2s, T124As, T124A1, T124C",Email,WW,Vancouver Island WW Co
6/21/19,2019,6,11:30,17C,87,Orca,,Ts,,"T36As, T65As, T124As, T77A",Email,WW,Vancouver Island WW Co
6/10/19,2019,6,12:30,17C,87,Orca,4,Ts,,T123s,Email,WW,Vancouver Island WW Co
6/10/19,2019,6,13:30,17C,87,Orca,4,Ts,,T123s,Email,WW,Vancouver Island WW Co
7/1/18,2018,7,11:00,17C,87,Orca,,Ts,,,Other,TWM,Jeanne Hyde
8/17/18,2018,8,10:00,17C,87,Orca,8,Ts,,T46's + T137's,Other,WW,Wild Whales Vancouver
7/29/18,2018,7,16:17,17C,87,Orca,9-Aug,Ts,,T137's and T46's,Other,WW,Wild Whales Vancouver
7/29/18,2018,7,16:40,17C,87,Orca,9,Ts,,T137's T46's,Other,WW,Wild Whales Vancouver
7/4/18,2018,7,15:56,17C,87,Orca,10,Ts,,T36As and T99s,Other,WW,Wild Whales Vancouver
5/7/18,2018,5,,17C,87,Orca,,Ts,,T101s,Orca Network,Reliable,Gary Sutton
6/19/18,2018,6,10:00,17C,87,Orca,,Ts,,,Other,TWM,Jeanne Hyde
6/13/18,2018,6,,17C,87,Orca,,Ts,,,Other,TWM,Jeanne Hyde
4/24/18,2018,4,17:00,17C,87,Orca,,Ts,,,Other,TWM,Jeanne Hyde
9/2/17,2017,9,10:00,17C,87,Orca,,Ts,,T18s,Other,TWM,Jeanne Hyde
8/22/17,2017,8,10:20,17C,87,Orca,,Ts,,,Other,TWM,Jeanne Hyde
7/15/17,2017,7,10:00,17C,87,Orca,,Ts,,T77s?,Other,TWM,Jeanne Hyde
7/1/17,2017,7,,17C,87,Orca,,Ts,,T65As and T75Bs,Other,TWM,Jeanne Hyde
6/16/17,2017,6,,17C,87,Orca,,Ts,,,Other,TWM,Jeanne Hyde
8/1/17,2017,8,16:20,17C,87,Orca,3,Ts,,,Orca Network,Public,Warren Brown
9/6/17,2017,9,11:27,17C,87,Orca,4,Ts,,T37As,Other,WW,Wild Whales Vancouver
7/28/17,2017,7,11:00,17C,87,Orca,4,Ts,,T37As,Other,WW,Wild Whales Vancouver
7/6/17,2017,7,11:24,17C,87,Orca,5-Apr,Ts,,T49As,Other,WW,Wild Whales Vancouver
5/3/17,2017,5,13:56,17C,87,Orca,4,Ts,,T18s and T19s,Other,WW,Wild Whales Vancouver
4/23/17,2017,4,,17C,87,Orca,,Ts,,,Other,TWM,Jeanne Hyde
3/20/17,2017,3,,17C,87,Orca,,Ts,,T36s and T99s,Other,TWM,Jeanne Hyde
5/3/17,2017,5,14:10,17C,87,Orca,,Ts,,,Other,Bates,Bates - text
8/31/19,2019,8,,17C,88,Orca,3,T,,"T49C, T49A3, T65A2",Other,TWM,Jeanne Hyde
9/9/19,2019,9,17:49,17C,88,Orca,1,Ts,,T49A3,Email,WW,Vancouver Island WW Co
7/25/19,2019,7,12:39,17C,88,Orca,6,Ts,,"T124As, T86A1",Email,WW,Vancouver Island WW Co
5/11/19,2019,5,12:50,17C,88,Orca,6,Ts,,"T123s, T86As (T86A and T86A3)",Email,WW,Vancouver Island WW Co
6/24/18,2018,6,16:48,17C,88,Orca,4,Ts,,T124A's,Other,WW,Wild Whales Vancouver
5/26/18,2018,5,12:37,17C,88,Orca,4,Ts,,T101's & T102,Other,WW,Wild Whales Vancouver
5/8/18,2018,5,14:26,17C,88,Orca,4,Ts,,T18 & T19,Other,WW,Wild Whales Vancouver
5/8/18,2018,5,14:05,17C,88,Orca,4,Ts,,T18 & T19,Other,WW,Wild Whales Vancouver
10/28/22,2022,10,10:25,17C,89,Orca,3,,T,,Orca Network,Public,Sandra WAA
3/11/22,2022,3,12:59,17C,89,Orca,,J,,,BCCSN,Reliable,
2/17/22,2022,2,13:18,17C,89,Orca,,J,,,BCCSN,Reliable,
3/11/22,2022,3,12:59,17C,89,Orca,,J,,,BCCSN,Reliable,
2/17/22,2022,2,13:18,17C,89,Orca,,J,,,BCCSN,Reliable,
3/11/22,2022,3,12:59,17C,89,Orca,,J,,,BCCSN,Reliable,
2/17/22,2022,2,13:18,17C,89,Orca,,J,,,BCCSN,Reliable,
3/11/22,2022,3,12:59,17C,89,Orca,,J,,,BCCSN,Reliable,
3/11/22,2022,3,12:59,17C,89,Orca,,J,,,BCCSN,Reliable,
2/17/22,2022,2,13:18,17C,89,Orca,,J,,,BCCSN,Reliable,
2/17/22,2022,2,13:18,17C,89,Orca,,J,,,BCCSN,Reliable,
3/29/22,2022,3,8:00,17C,89,Orca,4,,T,,Orca Network,Public,Connie Sabo
6/15/19,2019,6,14:00,17C,89,Orca,1,Ts,,either T77A or T124C,Other,Reliable,Jeanne Hyde
5/17/19,2019,5,12:00,17C,89,Orca,1,T,,T77A,Other,Reliable,Jeanne Hyde
5/16/19,2019,5,9:30,17C,89,Orca,1,Ts,,T77A,Other,Reliable,Jeanne Hyde
6/14/18,2018,6,7:30,17C,89,Orca,,Ts,,,Other,TWM,Jeanne Hyde
4/2/18,2018,4,10:00,17C,89,Orca,,Ts,,T37As,Orca Network,Reliable,Sandra Pollard
6/2/17,2017,6,17:26,17C,89,Orca,8,Ts,,T124A,Other,WW,Prince Of Whales
8/29/20,2020,8,12:00,17C,90,Orca,2,T,,T010s,Other,TWM,Jeanne Hyde
6/30/20,2020,6,16:00,17C,90,Orca,2,T,,"T125A, T128",Other,TWM,Jeanne Hyde
7/7/19,2019,7,12:30,17C,90,Orca,,T,,,Other,Reliable,Jeanne Hyde
6/29/19,2019,6,11:00,17C,90,Orca,,,,,Other,Reliable,Jeanne Hyde
8/15/18,2018,8,16:20,17C,90,Orca,1,Ts,,?,Other,WW,Wild Whales Vancouver
7/28/18,2018,7,13:39,17C,90,Orca,4,Ts,,T99's,Other,WW,Wild Whales Vancouver
7/4/18,2018,7,14:30,17C,90,Orca,6,Ts,,T99s and others,Other,WW,Wild Whales Vancouver
7/2/18,2018,7,16:46,17C,90,Orca,6-May,Ts,,T65As,Other,WW,Wild Whales Vancouver
6/30/18,2018,6,13:23,17C,90,Orca,6,Ts,,T65As,Other,WW,Wild Whales Vancouver
6/24/18,2018,6,11:43,17C,90,Orca,6,Ts,,unknown,Other,WW,Wild Whales Vancouver
6/24/18,2018,6,12:23,17C,90,Orca,6,Ts,,-,Other,WW,Wild Whales Vancouver
8/23/17,2017,8,16:00,17C,90,Orca,,Ts,,T137s traveling,Other,WW,Western Prince
1/25/18,2018,1,13:00,17C,90,Orca,,Ts,,likely the T100s and T124A,Other,TWM,Jeanne Hyde
8/13/17,2017,8,18:30,17C,90,Orca,3,Ts,,,Other,TWM,Jeanne Hyde
6/30/17,2017,6,,17C,90,Orca,,Ts,,T37As T36Bs,Orca Network,Reliable,David Howitt
10/24/17,2017,10,14:13,17C,90,Orca,5,Ts,,T2Cs and new calf,Other,WW,Wild Whales Vancouver
9/24/17,2017,9,16:52,17C,90,Orca,0,JL,,,Other,WW,Wild Whales Vancouver
8/13/17,2017,8,19:07,17C,90,Orca,5,Ts,,,Other,WW,Wild Whales Vancouver
5/28/17,2017,5,,17C,90,Orca,,L55,,L55,Orca Network,Public,Paul Pudwell
6/8/18,2018,6,15:37,29C,91,Orca,15,Ts,,"T101's, T100's, T37, T37A's",Other,WW,Wild Whales Vancouver
6/8/18,2018,6,16:00,29C,91,Orca,,Ts,,"T34s, T37, T37Bs, T100s, T101s, T86As",Other,TWM,Jeanne Hyde
6/16/17,2017,6,9:58,29C,91,Orca,4,Ts,,T137,Other,WW,Prince Of Whales
8/31/17,2017,8,13:17,29C,91,Orca,8-Apr,Ts,,"T36As, T18s, T19A",Other,WW,Wild Whales Vancouver
8/31/17,2017,8,13:11,29C,91,Orca,8-Apr,Ts,,"T36As, T18s, T19A",Other,WW,Wild Whales Vancouver
6/16/17,2017,6,10:05,29C,91,Orca,4,Ts,,,Other,WW,Wild Whales Vancouver
6/10/17,2017,6,14:03,29C,92,Orca,0,Ts,,"T65As, T124As, T101s, T36A, T123s",Other,WW,Wild Whales Vancouver
9/2/18,2018,9,16:16,29C,93,Orca,~7,Ts,,T37's + Unknown,Other,WW,Wild Whales Vancouver
9/1/18,2018,9,11:48,29C,93,Orca,4,Ts,,T100's,Other,WW,Wild Whales Vancouver
8/21/18,2018,8,11:49,29C,93,Orca,4,Ts,,"T65A's (T65A, T65A6, T65A2 + T65A4?)",Other,WW,Wild Whales Vancouver
6/23/18,2018,6,14:00,29C,93,Orca,~7,Ts,,T137's,Other,WW,Wild Whales Vancouver
8/31/17,2017,8,13:22,29C,93,Orca,10-Apr,Ts,,"T36s, T18s and T19s",Other,WW,Wild Whales Vancouver
7/22/17,2017,7,10:47,29C,93,Orca,15,Ts,,"T46s, T37s, T37As",Other,WW,Wild Whales Vancouver
7/22/17,2017,7,10:29,29C,93,Orca,10-Aug,Ts,,T46Ds,Other,WW,Wild Whales Vancouver
7/9/17,2017,7,11:01,29C,93,Orca,4,Ts,,T49As,Other,WW,Wild Whales Vancouver
7/9/17,2017,7,11:21,29C,93,Orca,4,Ts,,T49As,Other,WW,Wild Whales Vancouver
7/9/17,2017,7,11:01,29C,93,Orca,5-Apr,Ts,,T49As,Other,WW,Wild Whales Vancouver
7/1/17,2017,7,12:59,29C,93,Orca,7,Ts,,T65As and more,Other,WW,Wild Whales Vancouver
6/10/17,2017,6,12:30,29C,93,Orca,13-14,Ts,,"T65As, T124As, maybe more",Other,WW,Wild Whales Vancouver
6/10/17,2017,6,10:30,29C,93,Orca,0,Ts,,T65As,Other,WW,Wild Whales Vancouver
5/14/17,2017,5,16:07,29C,93,Orca,10-Sep,Ts,,"T101, T124A and unknown",Other,WW,Wild Whales Vancouver
7/12/22,2022,7,11:35,18C,94,Orca,,JKL,,,BCCSN,Reliable,
4/7/22,2022,4,13:05,18C,94,Orca,,J,,,BCCSN,Reliable,
8/30/18,2018,8,16:48,18C,94,Orca,~13,Ts,,"T101's, T124A's. T37A's",Other,WW,Wild Whales Vancouver
6/16/17,2017,6,17:55,18C,94,Orca,4,Ts,,T137,Other,WW,Prince Of Whales
7/16/17,2017,7,13:30,18C,94,Orca,20,Ts,,T46D,Other,WW,Wild Whales Vancouver
7/1/17,2017,7,11:10,18C,94,Orca,7,Ts,,T65As and 75Bs,Other,WW,Wild Whales Vancouver
6/3/17,2017,6,11:20,18C,94,Orca,3,Ts,,T101s but no T101A,Other,WW,Wild Whales Vancouver
6/3/17,2017,6,11:00,18C,94,Orca,4,Ts,,T101s,Other,WW,Wild Whales Vancouver
6/3/17,2017,6,11:09,18C,94,Orca,4,Ts,,T101s,Other,WW,Wild Whales Vancouver
7/12/22,2022,7,15:28,7,95,Orca,,JK,,,Other,Soundwatch,
9/1/21,2021,9,13:02,7,95,Orca,6,L,,L54S,Other,Soundwatch,
9/1/21,2021,9,11:06,7,95,Orca,12,J,,J pod plus unknown,Other,Soundwatch,
9/1/21,2021,9,10:52,7,95,Orca,12,,L,"Beh:Slow moving,Fast moving",BCCSN,Reliable,
8/10/18,2018,8,12:00,7,95,Orca,~8,J,,,Other,WW,Wild Whales Vancouver
8/1/18,2018,8,18:07,7,95,Orca,5-Apr,Ts,,T18's,Other,WW,Wild Whales Vancouver
6/6/18,2018,6,15:00,7,95,Orca,4,Ts,,T100's,Other,WW,Wild Whales Vancouver
9/3/17,2017,9,12:30,7,95,Orca,4,Ts,,T100s,Other,WW,Wild Whales Vancouver
4/21/17,2017,4,12:27,7,95,Orca,3,Ts,,T123s,Other,WW,Wild Whales Vancouver
9/2/22,2022,9,12:22,7,96,Orca,,J,,,BCCSN,Reliable,
9/2/22,2022,9,13:08,7,96,Orca,,J,,,BCCSN,Reliable,
7/12/22,2022,7,15:56,7,96,Orca,,JKL,,,BCCSN,Reliable,
7/12/22,2022,7,15:58,7,96,Orca,,JK,,,Other,Soundwatch,
6/25/22,2022,6,11:30,7,96,Orca,,JL,,,BCCSN,Reliable,
6/25/22,2022,6,11:20,7,96,Orca,,JL,,,BCCSN,Reliable,
4/7/22,2022,4,14:30,7,96,Orca,,J,,,BCCSN,Reliable,
9/4/21,2021,9,14:56,7,96,Orca,5,,T,,Other,Soundwatch,
9/3/21,2021,9,16:02,7,96,Orca,17,,T,,Other,Soundwatch,
9/3/21,2021,9,15:29,7,96,Orca,13,,T,,Other,Soundwatch,
9/1/21,2021,9,14:03,7,96,Orca,16,,L,,Other,Soundwatch,
9/1/21,2021,9,13:33,7,96,Orca,10,JL,,L54s and J Pod,Other,Soundwatch,
9/22/20,2020,9,15:27,7,96,Orca,9,SRs,,Behavior: Breaches,Other,Soundwatch,
9/22/20,2020,9,14:58,7,96,Orca,4,SRs,,Behavior: 1 breach; 1 tail slap,Other,Soundwatch,
4/17/18,2018,4,13:47,7,96,Orca,5,Ts,,T49A's,Other,WW,Wild Whales Vancouver
9/10/17,2017,9,10:30,7,96,Orca,4,Ts,,T18s and T19s,Other,WW,Wild Whales Vancouver
5/29/17,2017,5,12:05,7,96,Orca,15-20,Ts,,,Other,WW,Wild Whales Vancouver
11/15/22,2022,11,13:50,7,97,Orca,3,,T,,Orca Network,Public,Sharri Tyas
5/24/22,2022,5,12:43,7,97,Orca,,J,,,BCCSN,Reliable,
5/24/22,2022,5,12:56,7,97,Orca,,J,,,Other,Soundwatch,
5/24/22,2022,5,12:28,7,97,Orca,,J,,,Other,Soundwatch,
5/24/22,2022,5,12:43,7,97,Orca,,J,,,BCCSN,Reliable,
5/24/22,2022,5,12:56,7,97,Orca,,J,,,Other,Soundwatch,
5/24/22,2022,5,12:28,7,97,Orca,,J,,,Other,Soundwatch,
5/24/22,2022,5,12:43,7,97,Orca,,J,,,BCCSN,Reliable,
5/24/22,2022,5,12:56,7,97,Orca,,J,,,Other,Soundwatch,
5/24/22,2022,5,12:28,7,97,Orca,,J,,,Other,Soundwatch,
3/2/22,2022,3,9:55,7,97,Orca,,J,,,Other,SMRU,
2/27/22,2022,2,16:45,7,97,Orca,,J,,,Other,SMRU,
1/28/22,2022,1,9:21,7,97,Orca,,J,,,Other,SMRU,
1/27/22,2022,1,13:53,7,97,Orca,,T,,IDs: T02B & T60s,Other,SMRU,
1/26/22,2022,1,0:46,7,97,Orca,,J,,,Other,SMRU,
1/20/22,2022,1,23:50,7,97,Orca,,JL,,,Other,SMRU,
6/27/22,2022,6,19:30,7,97,Orca,12,,J,,Orca Network,Public,Sandra Scott WAA
6/10/22,2022,6,19:00,7,97,Orca,2,,T,,Orca Network,Public,Sandra Scott WAA
5/27/22,2022,5,17:30,7,97,Orca,5,,T,,Orca Network,Public,Sandra Scott WAA
5/22/22,2022,5,15:35,7,97,Orca,2,,T,,Other,Public,Sandra Scott WAA
11/30/21,2021,11,8:30,7,97,Orca,,J,,,Other,TWM,Jeanne Hyde
9/1/21,2021,9,11:18,7,97,Orca,,JL,,IDs: L54s,Orca Network,CWR,
8/6/21,2021,8,8:50,7,97,Orca,1,,T,,Orca Network,Public,Ryan Johnson
7/28/21,2021,7,12:30,7,97,Orca,8,,T,,Orca Network,Public,Gloria Eppig
9/4/21,2021,9,15:26,7,97,Orca,13,,T,,Other,Soundwatch,
9/3/21,2021,9,16:23,7,97,Orca,17,,T,,Other,Soundwatch,
9/1/21,2021,9,14:28,7,97,Orca,17,,L,,Other,Soundwatch,
9/4/21,2021,9,15:03,7,97,Orca,10,,J,Beh:Slow moving,BCCSN,Reliable,
6/17/20,2020,6,17:50,7,97,Orca,8,,,ID: Transient pod.,Orca Network,Public,Stephen Fowler
9/22/20,2020,9,16:27,7,97,Orca,14,J;K;L,,Behavior: Breaches,Other,Soundwatch,
9/22/20,2020,9,15:58,7,97,Orca,9,J,,Behavior: Breaches,Other,Soundwatch,
3/17/20,2020,3,18:30,7,97,Orca,6,T,,T46s,Orca Network,Public,Sandra Scott
7/1/19,2019,7,,7,97,Orca,5,T,,T65As minus A2,Other,TWM,Jeanne Hyde
6/27/19,2019,6,11:00,7,97,Orca,1,T,,T77A,Other,TWM,Jeanne hyde
6/26/19,2019,6,15:00,7,97,Orca,7,T,,"T124As, T124C",Other,TWM,Jeanne Hyde
6/22/19,2019,6,15:00,7,97,Orca,10,T,,"T65As, T36As",Other,TWM,Jeanne Hyde
6/22/19,2019,6,15:00,7,97,Orca,5,T,,T124As,Other,TWM,Jeanne Hyde
9/30/20,2020,9,18:00,7,97,Orca,24,J,,,Other,TWM,Jeanne Hyde
9/30/20,2020,9,15:00,7,97,Orca,24,J,,,Other,TWM,Jeanne Hyde
8/22/20,2020,8,11:00,7,97,Orca,,T,,"T065As, T137A, T137B",Other,TWM,Jeanne Hyde
3/17/20,2020,3,19:00,7,97,Orca,22,J,,,Other,TWM,Jeanne Hyde
11/12/19,2019,11,11:26,7,97,Orca,19,Jp,,J pod with L87 minus J16s,Orca Network,Public,Noelle Philbin
6/29/20,2020,6,15:15,7,97,Orca,5,,,heading North to Ferry/Coal terminal,Other,Reliable,Ross Bradie
9/2/19,2019,9,15:00,7,97,Orca,7,,,,Orca Network,Public,Sandra Scott
9/2/19,2019,9,14:30,7,97,Orca,4,,,,Orca Network,Public,Sandra Scott
9/2/19,2019,9,15:15,7,97,Orca,10,,,,Orca Network,Public,Mel
6/28/19,2019,6,21:13,7,97,Orca,10,Ts,,"IDs: Likely  T36, T36B's, T99's",Orca Network,Public,Sandra Scott
8/16/19,2019,8,17:00,7,97,Orca,5,,,"Uknown ecotype, 5 WW vessels present in area",Orca Network,Public,Sandra Scott
7/1/19,2019,7,10:10,7,97,Orca,10,Ts,,"Playing, tail lobbing;",Orca Network,Public,Sandra Scott
4/8/19,2019,4,13:05,7,97,Orca,3,,,"Unknown ecotype, 3 supposed females.",Orca Network,Public,Ryan Johnson
6/26/19,2019,6,12:00,7,97,Orca,,,,,Other,Reliable,Jeanne Hyde
8/16/19,2019,8,16:55,7,97,Orca,4,Ts,,T18s,Email,WW,Vancouver Island WW Co
7/29/19,2019,7,17:06,7,97,Orca,5,Ts,,T65As minus T65A2,Email,WW,Vancouver Island WW Co
6/25/18,2018,6,16:55,7,97,Orca,10-Jul,Ts,,"T49A's
T65A's",Other,WW,Vancouver Island Whale Watch
7/16/18,2018,7,16:20,7,97,Orca,,JK,,"J Pod, K Pod",Other,WW,Western Prince
6/25/18,2018,6,,7,97,Orca,,Ts,,"Afternoon - T49As, T65As (except T49A1) - travelling in two groups",Other,WW,Western Prince
4/22/18,2018,4,13:25,7,97,Orca,,Ts,,"T36As - including T36A, T36A1, T36A3, T36A3",Other,WW,Western Prince
9/11/18,2018,9,11:50,7,97,Orca,,JL,,"J47, J27, L87,",Other,WW,Western Prince
9/15/18,2018,9,11:25,7,97,Orca,,JK,,,Other,WW,Western Prince
9/27/18,2018,9,16:00,7,97,Orca,,J,,"J16s, J17s, J22",Other,WW,Western Prince
8/21/18,2018,8,17:45,7,97,Orca,5,Ts,,Bigg's,Orca Network,Public,Sandra Scott
7/16/18,2018,7,,7,97,Orca,10,Jp,,heading toward Rosario by 20:15,Other,TWM,Jeanne Hyde
9/15/18,2018,9,11:12,7,97,Orca,~15,K,,K's (Lobo) + Others,Other,WW,Wild Whales Vancouver
9/11/18,2018,9,15:38,7,97,Orca,~18,J,,,Other,WW,Wild Whales Vancouver
9/11/18,2018,9,11:45,7,97,Orca,~18,J,,,Other,WW,Wild Whales Vancouver
9/11/18,2018,9,11:23,7,97,Orca,20-30,J,,,Other,WW,Wild Whales Vancouver
9/2/18,2018,9,12:38,7,97,Orca,~7,Ts,,Unknown,Other,WW,Wild Whales Vancouver
8/1/18,2018,8,11:48,7,97,Orca,~7,SRs,JLp,,Other,WW,Wild Whales Vancouver
7/20/18,2018,7,16:13,7,97,Orca,5,Jp,,J16s,Other,WW,Wild Whales Vancouver
7/20/18,2018,7,16:36,7,97,Orca,5,Jp,,J16s,Other,WW,Wild Whales Vancouver
4/23/18,2018,4,13:17,7,97,Orca,4,Ts,,T36A's,Other,WW,Wild Whales Vancouver
6/28/18,2018,6,16:40,7,97,Orca,,JL,,"J35, J47 +",Orca Network,CWR,CWR
6/28/18,2018,6,14:30,7,97,Orca,,Ts,,"T36As, T65As, T99s, T175",Other,TWM,Jeanne Hyde
6/27/18,2018,6,9:30,7,97,Orca,,Ts,,T65As,Other,TWM,Jeanne Hyde
4/28/18,2018,4,15:00,7,97,Orca,,Ts,,"T123s, T36As, T100s, T101s headed towards PR",Other,TWM,Jeanne Hyde
4/17/18,2018,4,13:31,7,97,Orca,5-Apr,Ts,,,Other,TWM,Jeanne Hyde
3/4/18,2018,3,13:00,7,97,Orca,,JK,,only a few whales,Other,TWM,Jeanne Hyde
9/6/18,2018,9,17:33,7,97,Orca,,JL,JLp,"J-50 confirmed. Following several hundred yards behind J26, J42, J36. Did not sight J16.",Other,Reliable,J50 Core Team
3/3/18,2018,3,16:00,7,97,Orca,4,Ts,,,Orca Network,Public,Anne Murray
5/29/17,2017,5,13:00,7,97,Orca,,Ts,,Big Schwack - T27A and others T124s,Other,WW,Western Prince
7/27/17,2017,7,12:20,7,97,Orca,,Ts,,T37s traveling in tight group.,Other,WW,Western Prince
10/9/17,2017,10,18:30,7,97,Orca,,J,,,Other,TWM,Jeanne Hyde
9/26/17,2017,9,15:15,7,97,Orca,15,JL,,Traveling in small groups of 2-4.,Orca Network,Public,Sandra Scott
9/26/17,2017,9,,7,97,Orca,,JL,,"L82 and L87 together.  J26, J27, J39, L92 and J19 traveling together.  L103 and J41 traveling together.",Orca Network,Reliable,Ariel Yseth
8/29/17,2017,8,12:00,7,97,Orca,,Ts,,T137s,Other,TWM,Jeanne Hyde
5/29/17,2017,5,,7,97,Orca,,J,,,Other,TWM,Jeanne Hyde
6/3/17,2017,6,,7,97,Orca,,Ts,,T101A,Orca Network,Reliable,Bonnie Gretz
9/10/17,2017,9,12:35,7,97,Orca,8,Ts,,"T18, T19s, T36bs",Other,WW,Wild Whales Vancouver
7/6/17,2017,7,11:03,7,97,Orca,4,Ts,,T49As,Other,WW,Wild Whales Vancouver
6/30/17,2017,6,10:25,7,97,Orca,15-Dec,JKp,,J Pod and K14s,Other,WW,Wild Whales Vancouver
6/30/17,2017,6,10:22,7,97,Orca,15,JKp,,J Pod and K14s,Other,WW,Wild Whales Vancouver
6/27/17,2017,6,10:30,7,97,Orca,24,J,,,Other,WW,Wild Whales Vancouver
5/29/17,2017,5,11:30,7,97,Orca,15-20,Ts,,"T87, T77A, T86As, T124A1, possibly T90s",Other,WW,Wild Whales Vancouver
5/29/17,2017,5,16:48,7,97,Orca,,J,,,Orca Network,Public,Clinton Duckworth
9/9/21,2021,9,11:00,7,98,Orca,10-Aug,,J,"Led by 2 adults and 1 baby, trailing male",Hotline,Reliable,Ross Bradie
5/25/19,2019,5,9:30,29C,99,Orca,3,T101s,,,Orca Network,Reliable,Stephen Sommerfeld
6/13/21,2021,6,11:36,29C,101,Orca,2,,T,,Orca Network,Public,Mari Elizabeth Blakeslee
8/24/20,2020,8,17:30,29C,101,Orca,5,T,,T100s,Other,TWM,Jeanne Hyde
9/30/19,2019,9,11:00,29C,101,Orca,3,JKL,,,Orca Network,Reliable,CWR
4/23/19,2019,4,13:00,29C,101,Orca,13,Ts,,"T101s, T86As, T124As, T124Ds. Not present were T86A1 and T124A1",Email,Reliable,Jeanne Hyde
7/29/19,2019,7,17:19,29C,101,Orca,5,Ts,,T65As minus T65A2,Email,WW,Vancouver Island WW Co
10/24/19,2019,10,15:30,29C,101,Orca,,SRKW,,,Email,Reliable,Jeanne Hyde
9/15/18,2018,9,15:30,29C,101,Orca,,JK,,,Other,WW,Western Prince
7/1/19,2019,7,17:10,7,104,Orca,8,Ts,,"T101s, T65As",Email,WW,Vancouver Island WW Co
5/5/18,2018,5,,7,104,Orca,,Ts,,T90s  . T2B,Orca Network,Reliable,Justine Buckmaster
1/24/20,2020,1,15:35,7,107,Orca,8,T,,"T90s, T101s",Orca Network,Public,Wanda Buhl
7/16/18,2018,7,17:34,7,108,Orca,6,Jp,,J16's,Other,WW,Wild Whales Vancouver
5/29/17,2017,5,,7,108,Orca,,J,,,Other,TWM,Jeanne Hyde
7/5/17,2017,7,13:30,7,109,Orca,,Ts,,T37s- Traveling and hunting.  Included one male.,Other,WW,Orcas Express
7/27/17,2017,7,11:47,7,110,Orca,7,Ts,,T37s,Other,WW,Wild Whales Vancouver
7/16/18,2018,7,15:15,7,111,Orca,~6,J,,J-POD Members,Other,WW,Wild Whales Vancouver
7/27/17,2017,7,10:28,7,111,Orca,10-May,Ts,,"T37, T37As? T34s",Other,WW,Wild Whales Vancouver
6/23/19,2019,6,11:30,7,112,Orca,5,T065s; T03,,,Other,Soundwatch,
9/2/18,2018,9,11:20,7,112,Orca,~7,Ts,,T124's + Unknown,Other,WW,Wild Whales Vancouver
6/25/22,2022,6,13:50,7,113,Orca,,JL,,,BCCSN,Reliable,
5/24/22,2022,5,13:17,7,113,Orca,,J,,,BCCSN,Reliable,
5/24/22,2022,5,13:30,7,113,Orca,,J,,,Other,Soundwatch,
9/5/21,2021,9,13:31,7,113,Orca,1,J,,J27,Other,Soundwatch,
9/1/21,2021,9,15:01,7,113,Orca,10,,L,,Other,Soundwatch,
9/1/21,2021,9,15:58,7,113,Orca,5,,J,Beh:Slow moving,BCCSN,Reliable,
9/1/21,2021,9,15:34,7,113,Orca,12,,J,"Beh:Feeding,Breaching",BCCSN,Reliable,
9/1/21,2021,9,15:32,7,113,Orca,26,,J,Beh:Slow moving,BCCSN,Reliable,
9/1/21,2021,9,15:18,7,113,Orca,20,,J,Beh:Slow moving,BCCSN,Reliable,
9/1/21,2021,9,16:08,7,113,Orca,10,,J,Beh:Slow moving,BCCSN,Reliable,
9/3/21,2021,9,17:09,7,113,Orca,20,,L,"Beh:Spy-hopping,Feeding,Breaching",BCCSN,Reliable,
9/1/21,2021,9,16:06,7,113,Orca,26,L,,"IDs:L88Beh:Slow moving,Fluking",BCCSN,Reliable,
9/1/21,2021,9,16:16,7,113,Orca,26,,L,Beh:Slow moving,BCCSN,Reliable,
9/22/20,2020,9,16:55,7,113,Orca,3,J;K;L,,Behavior: Breaches,Other,Soundwatch,
8/20/19,2019,8,11:58,7,113,Orca,15,J,,Behavior: 3 tail slaps,Other,Soundwatch,
6/29/19,2019,6,13:30,7,113,Orca,6,T046s; T46,,Behavior: 8 breaches; 6 tail slaps,Other,Soundwatch,
7/22/18,2018,7,16:55,7,113,Orca,11-Aug,Ts,,"T37B's
T46's
T122
T137's",Other,WW,Vancouver Island Whale Watch
9/15/18,2018,9,12:02,7,113,Orca,10,K,,K16 + K35 + Others,Other,WW,Wild Whales Vancouver
8/10/18,2018,8,17:15,7,113,Orca,,J,,J22 (oreo) + J's (cookie?),Other,WW,Wild Whales Vancouver
7/22/18,2018,7,16:16,7,113,Orca,13,Ts,,"T46s (T122), T137s, T99",Other,WW,Wild Whales Vancouver
7/27/17,2017,7,10:04,7,113,Orca,4,Ts,,T37A,Other,WW,Prince Of Whales
9/10/17,2017,9,12:08,7,113,Orca,8,Ts,,"T18, T19s, T36bs",Other,WW,Wild Whales Vancouver
9/7/17,2017,9,13:32,7,113,Orca,4,Ts,,T100s,Other,WW,Wild Whales Vancouver
8/14/17,2017,8,13:00,7,113,Orca,6,Ts,,"T51, T122, T46s",Other,WW,Orcas Express
7/12/22,2022,7,15:12,7,114,Orca,,JKL,,,BCCSN,Reliable,
8/4/18,2018,8,11:48,7,114,Orca,~8,Ts,,T18's/T19's?,Other,WW,Wild Whales Vancouver
7/8/18,2018,7,13:34,7,114,Orca,~8,Ts,,T124s T36s,Other,WW,Wild Whales Vancouver
9/7/17,2017,9,13:00,7,114,Orca,4,Ts,,T100s,Other,WW,Wild Whales Vancouver
9/7/17,2017,9,12:58,7,114,Orca,4,Ts,,T100s,Other,WW,Wild Whales Vancouver
6/3/17,2017,6,14:00,7,114,Orca,many,Ts,,"lone male milling in tide ; 2 male, 1 female",Other,WW,Deb
7/24/22,2022,7,15:07,18C,115,Orca,,J,,,BCCSN,Reliable,
4/20/18,2018,4,14:57,18C,115,Orca,4,Ts,,T100's,Other,WW,Wild Whales Vancouver
7/1/17,2017,7,12:00,18C,115,Orca,7,Ts,,T65As and 75Bs,Other,WW,Wild Whales Vancouver
9/3/22,2022,9,9:53,18C,116,Orca,,J,,,BCCSN,Reliable,
7/24/22,2022,7,15:24,18C,116,Orca,,J,,,BCCSN,Reliable,
7/24/22,2022,7,15:22,18C,116,Orca,,J,,,Other,Soundwatch,
9/2/18,2018,9,13:26,18C,116,Orca,~7,Ts,,T100's + T37's,Other,WW,Wild Whales Vancouver
8/21/18,2018,8,11:25,18C,116,Orca,4,Ts,,T65A's,Other,WW,Wild Whales Vancouver
8/14/18,2018,8,11:24,18C,116,Orca,~8,Ts,,T36's + T37's,Other,WW,Wild Whales Vancouver
8/14/18,2018,8,11:35,18C,116,Orca,~6,Ts,,N/A,Other,WW,Wild Whales Vancouver
9/13/17,2017,9,9:45,18C,116,Orca,4,Ts,,T18,Other,WW,Prince Of Whales
9/3/17,2017,9,12:30,18C,116,Orca,4,Ts,,T36As,Other,WW,Wild Whales Vancouver
8/26/17,2017,8,12:25,18C,116,Orca,6,Ts,,"T37, T37As, and others",Other,WW,Wild Whales Vancouver
6/10/17,2017,6,9:57,18C,116,Orca,10,Ts,,,Other,WW,Wild Whales Vancouver
6/10/19,2019,6,16:30,29C,117,Orca,4,Ts,,T123s,Other,Reliable,Jeanne Hyde
9/20/18,2018,9,13:08,29C,117,Orca,~15,J,,,Other,WW,Wild Whales Vancouver
9/20/18,2018,9,13:00,29C,117,Orca,~15,J,,,Other,WW,Wild Whales Vancouver
8/4/18,2018,8,13:36,29C,117,Orca,9,Ts,,T137's and T46's,Other,WW,Wild Whales Vancouver
7/22/17,2017,7,,29C,117,Orca,,Ts,,,Other,TWM,Jeanne Hyde
8/31/17,2017,8,11:37,29C,117,Orca,4,Ts,,T36As,Other,WW,Wild Whales Vancouver
8/23/17,2017,8,16:00,29C,117,Orca,4,Ts,,T137s,Other,WW,Wild Whales Vancouver
7/7/17,2017,7,13:22,29C,117,Orca,5,Ts,,"T51, T37As (no T37A1)",Other,WW,Wild Whales Vancouver
5/17/17,2017,5,12:35,29C,117,Orca,4,Ts,,T137s,Other,WW,Wild Whales Vancouver
5/17/17,2017,5,12:30,29C,117,Orca,4,Ts,,T137s,Other,WW,Wild Whales Vancouver
4/14/17,2017,4,13:09,29C,117,Orca,15-20,Ts,,NA,Other,WW,Wild Whales Vancouver
8/15/17,2017,8,12:51,29C,117,Orca,12,Ts,,"T65As, T10.",Other,WW,San Juan Clipper
11/21/19,2019,11,14:59,29C,118,Orca,,Jp,,,Orca Network,Reliable,Monika Wieland Sheilds
6/8/19,2019,6,13:45,29C,118,Orca,1,Ts,,T124C,Email,WW,Vancouver Island WW Co
7/16/19,2019,7,14:30,29C,118,Orca,4,T,,T101s,Other,Reliable,Jeanne Hyde
6/8/19,2019,6,13:30,29C,118,Orca,1,Ts,,T124C,Email,WW,Vancouver Island WW Co
6/8/18,2018,6,,29C,118,Orca,,Ts,,"T34s, T37, T37Bs, T100s. T101s, T86As",Orca Network,Public,Monika Wieland Shields
6/30/18,2018,6,,29C,118,Orca,,Ts,,T65As,Other,TWM,Jeanne Hyde
3/24/18,2018,3,,29C,118,Orca,,J,,,Other,TWM,Jeanne Hyde
3/24/18,2018,3,18:00,29C,118,Orca,,J,,J Pod & L87,Orca Network,Public,Debbie Stewart
7/12/17,2017,7,17:58,29C,118,Orca,8,Ts,,T37A/T77,Other,WW,Prince Of Whales
5/17/17,2017,5,14:12,29C,118,Orca,4,Ts,,T137,Other,WW,Prince Of Whales
10/24/17,2017,10,,29C,118,Orca,,J,,L54s flipped and stayed south,Other,TWM,Jeanne Hyde
6/21/19,2019,6,,29C,118,Orca,,JLp,,"End of day -. Js, L12s, 19Ls. L54s NOT confirmed
Ks present earlier, not now",Other,TWM,Jeanne Hyde
8/22/17,2017,8,,29C,118,Orca,,Ts,,,Other,TWM,Jeanne Hyde
6/4/17,2017,6,,29C,118,Orca,,Ts,,T101s,Other,TWM,Jeanne Hyde
5/17/17,2017,5,,29C,118,Orca,,Ts,,T137s,Other,TWM,Jeanne Hyde
8/2/17,2017,8,19:50,29C,118,Orca,,Ts,,,Orca Network,Public,Marco Venturi
8/23/17,2017,8,12:28,29C,118,Orca,4,Ts,,T137s,Other,WW,Wild Whales Vancouver
7/7/17,2017,7,12:15,29C,118,Orca,5,Ts,,"T37As, T51",Other,WW,Wild Whales Vancouver
6/16/17,2017,6,11:24,29C,118,Orca,4,Ts,,T137s,Other,WW,Wild Whales Vancouver
4/14/17,2017,4,12:30,29C,118,Orca,15-20,Ts,,"T100s, T101s, T49s, T124As? and A2s?",Other,WW,Wild Whales Vancouver
2/16/22,2022,2,15:59,17C,119,Orca,,J,,,BCCSN,Reliable,
1/9/22,2022,1,15:58,17C,119,Orca,,J,,,BCCSN,Reliable,
2/16/22,2022,2,15:59,17C,119,Orca,,J,,,BCCSN,Reliable,
1/9/22,2022,1,15:58,17C,119,Orca,,J,,,BCCSN,Reliable,
2/16/22,2022,2,21:24,17C,119,Orca,,J,,,Orca Network,Public,Maeva Sayag
8/26/21,2021,8,17:16,17C,119,Orca,1,,T,,Orca Network,Public,Carol Adam
8/7/21,2021,8,11:43,17C,119,Orca,2,,T,Beh:Slow moving,BCCSN,Reliable,
6/26/20,2020,6,,17C,119,Orca,7,,,,Orca Network,Public,Nikki Christou
6/26/20,2020,6,14:30,17C,119,Orca,5,,,Behavior: Breaching.,Orca Network,Public,Nikki Casey
6/22/20,2020,6,6:45,17C,119,Orca,1,,,"ID:T37B's, T37, T34's",Orca Network,Public,Philippa Lyons
6/25/19,2019,6,18:30,17C,119,Orca,4,T,,T101s,Other,TWM,Jeanne Hyde
6/22/20,2020,6,11:30,17C,119,Orca,,,,,Other,TWM,Jeanne Hyde
5/13/20,2020,5,14:30,17C,119,Orca,11,T,,"T065Bs, T086As, T124As",Other,TWM,Jeanne Hyde
3/20/20,2020,3,15:00,17C,119,Orca,24,T,,"T099s, T065, T063, T010s, T049As, T049Bs, T071s, T068Bs",Other,TWM,Jeanne Hyde
3/12/20,2020,3,16:00,17C,119,Orca,4,T,,T99s,Other,TWM,Jeanne Hyde
2/15/20,2020,2,13:30,17C,119,Orca,,T,,,Other,TWM,Jeanne Hyde
10/18/19,2019,10,14:00,17C,119,Orca,,Ts,,T37As,Orca Network,WW,"Gary Sutton, OceanEcoVentures"
6/28/19,2019,6,9:30,17C,119,Orca,,,,,Other,Reliable,Jeanne Hyde
6/28/19,2019,6,7:45,17C,119,Orca,,,,,Other,Reliable,Jeanne Hyde
6/27/19,2019,6,20:00,17C,119,Orca,6,Ts,,T65As,Other,Reliable,Jeanne Hyde
3/19/19,2019,3,12:00,17C,119,Orca,,Ts,,"T2C's, T123's, T49A's. CWR Encounter 19.  End sighting 13:35",Orca Network,CWR,
5/31/19,2019,5,12:15,17C,119,Orca,7,Ts,,"T65Ns, T75Bs, T75Cs",Other,Reliable,Jeanne Hyde
4/25/19,2019,4,,17C,119,Orca,,J,,all of J pod present,Email,Reliable,Jeanne Hyde
4/22/19,2019,4,12:30,17C,119,Orca,,Ts,,T36As,Email,Reliable,Jeanne Hyde
4/4/19,2019,4,15:00,17C,119,Orca,9,Ts,,T18s and T49As,Email,Reliable,Jeanne Hyde
3/23/19,2019,3,,17C,119,Orca,,J,,all of J pod present,Email,Reliable,Jeanne Hyde
2/28/19,2019,2,11:30,17C,119,Orca,3,,,,Email,Reliable,Jeanne Hyde
8/18/19,2019,8,16:38,17C,119,Orca,6,Ts,,T49s,Email,WW,Vancouver Island WW Co
8/18/19,2019,8,16:34,17C,119,Orca,5,Ts,,T49As,Email,WW,Vancouver Island WW Co
7/5/19,2019,7,12:00,17C,119,Orca,14,Ts,,"T46s, T137, T86A1, T34s, T37s",Email,WW,Vancouver Island WW Co
6/28/19,2019,6,19:00,17C,119,Orca,1,Ts,,T77A,Email,WW,Vancouver Island WW Co
6/26/19,2019,6,17:15,17C,119,Orca,4,Ts,,"T124As, T124A1",Email,WW,Vancouver Island WW Co
6/26/19,2019,6,11:28,17C,119,Orca,4,Ts,,"T124C, T124A2",Email,WW,Vancouver Island WW Co
4/4/19,2019,4,14:20,17C,119,Orca,7,Ts,,T19s and T49As,Email,WW,Vancouver Island WW Co
9/29/19,2019,9,12:30,17C,119,Orca,,Ts,,"T035As, T038As",Email,Reliable,Jeanne Hyde
8/24/18,2018,8,,17C,119,Orca,6+,Ts,,Bigg's,Orca Network,Public,Jen Rurak
8/15/18,2018,8,16:43,17C,119,Orca,1,Ts,,T46D,Other,WW,Wild Whales Vancouver
8/15/18,2018,8,18:08,17C,119,Orca,1,Ts,,T46D,Other,WW,Wild Whales Vancouver
8/15/18,2018,8,12:00,17C,119,Orca,3,Ts,,?,Other,WW,Wild Whales Vancouver
4/16/18,2018,4,12:12,17C,119,Orca,11,Ts,,"T49A's, T65A's",Other,WW,Wild Whales Vancouver
6/13/18,2018,6,14:00,17C,119,Orca,,Ts,,,Other,TWM,Jeanne Hyde
4/16/18,2018,4,14:15,17C,119,Orca,,Ts,,T49As T65As,Other,TWM,Jeanne Hyde
7/9/17,2017,7,16:00,17C,119,Orca,,Ts,,T37s and T51 traveling slowly and resting.,Other,WW,Western Prince
7/11/17,2017,7,17:32,17C,119,Orca,,Ts,,T101,Other,WW,Prince of Whales
10/24/17,2017,10,14:03,17C,119,Orca,23,J,,"Left at Retreat Cove (northbound), T2Cs passed heading south just over a mile away",Other,WW,Prince Of Whales
10/25/17,2017,10,,17C,119,Orca,,JL,JLp,,Orca Network,Public,Peter Hamilton
8/29/17,2017,8,13:00,17C,119,Orca,,Ts,,T46Bs,Other,TWM,Jeanne Hyde
6/30/17,2017,6,,17C,119,Orca,,Ts,,T65As,Other,TWM,Jeanne Hyde
6/30/17,2017,6,11:30,17C,119,Orca,3,Ts,,,Orca Network,Public,Petra Schindler-Carter
2/1/17,2017,2,14:00,17C,119,Orca,8-Jun,J,,"J51, J41, J26, J36",Orca Network,Reliable,Karen Smith
12/22/19,2019,12,14:30,17C,120,Orca,5,,,,Other,TWM,Jeanne Hyde
8/31/19,2019,8,16:15,17C,120,Orca,3,Ts,,"T49C, T49A3, T65A2",Email,WW,Vancouver Island WW Co
8/15/18,2018,8,12:30,17C,120,Orca,~2,Ts,,T46D,Other,WW,Wild Whales Vancouver
7/28/18,2018,7,12:03,17C,120,Orca,4-Mar,Ts,,T99's?,Other,WW,Wild Whales Vancouver
6/24/18,2018,6,14:10,17C,120,Orca,4,Ts,,T124A's,Other,WW,Wild Whales Vancouver
4/2/18,2018,4,13:00,17C,120,Orca,2,Ts,,T124C T49A1,Other,WW,Wild Whales Vancouver
6/17/18,2018,6,18:30,17C,120,Orca,,Ts,,T125A and T128,Other,TWM,Jeanne Hyde
2/10/17,2017,2,12:20,17C,120,Orca,15-20,,,unidentified,Orca Network,Public,Courtney Caulford
3/28/19,2019,3,,17C,121,Orca,4,Ts,,T18s,Email,Reliable,Jeanne Hyde
7/28/18,2018,7,11:20,17C,121,Orca,4,Ts,,T99's,Other,WW,Wild Whales Vancouver
7/28/18,2018,7,11:53,17C,121,Orca,4,Ts,,T99's,Other,WW,Wild Whales Vancouver
7/27/18,2018,7,16:56,17C,121,Orca,4,Ts,,T99'S,Other,WW,Wild Whales Vancouver
6/14/18,2018,6,14:23,17C,121,Orca,5-Apr,Ts,,N/A,Other,WW,Wild Whales Vancouver
4/2/18,2018,4,14:35,17C,121,Orca,6-May,Ts,,T124s,Other,WW,Wild Whales Vancouver
4/2/18,2018,4,13:30,17C,121,Orca,3-Feb,Ts,,T124C T49A1,Other,WW,Wild Whales Vancouver
6/14/18,2018,6,15:45,17C,121,Orca,,Ts,,,Other,TWM,Jeanne Hyde
6/6/18,2018,6,20:00,17C,121,Orca,,Ts,,T77s,Other,TWM,Jeanne Hyde
6/2/17,2017,6,15:00,17C,121,Orca,8,Ts,,"T124A, T124A1 present",Other,WW,Prince Of Whales
6/27/17,2017,6,,17C,121,Orca,,Ts,,"T137s, 77s, 75Bs",Other,TWM,Jeanne Hyde
6/2/17,2017,6,,17C,121,Orca,,Ts,,T124As.  PM Sighting.,Orca Network,Reliable,Gary Sutton
4/20/17,2017,4,12:15,17C,121,Orca,10-Jul,Ts,,T86As and T124Ds,Other,WW,Wild Whales Vancouver
4/20/17,2017,4,12:45,17C,121,Orca,7,Ts,,T86As and T124Ds,Other,WW,Wild Whales Vancouver
1/19/22,2022,1,15:46,18C,122,Orca,8,,T,,Orca Network,Public,Frencis Bread
1/9/22,2022,1,12:00,17C,122,Orca,,J,,,Orca Network,Public,Karoline Cullen
1/9/22,2022,1,13:31,17C,122,Orca,,J,,,Orca Network,CWR,Mark & Joe
10/5/21,2021,10,17:30,18C,122,Orca,4,,T,,Orca Network,Public,Peter Reiner
8/1/21,2021,8,13:27,17C,122,Orca,5,T,,,Other,Soundwatch,
8/11/20,2020,8,14:00,17C,122,Orca,,T,,,Orca Network,Public,Tera McEwan
4/6/20,2020,4,11:30,18C,122,Orca,3,T,,T069s,Other,TWM,Jeanne Hyde
6/25/19,2019,6,18:00,17C,122,Orca,3,Ts,,IDs: Likely T101's,Orca Network,Public,Peter Reiner
7/8/19,2019,7,12:00,17C,122,Orca,,T,,,Other,Reliable,Jeanne Hyde
7/7/19,2019,7,10:00,18C,122,Orca,,T,,,Other,Reliable,Jeanne Hyde
8/24/18,2018,8,11:30,18C,122,Orca,,Ts,,"T101s, T37As",Other,WW,Western Prince
5/24/18,2018,5,,18C,122,Orca,4,Ts,,"Afternoon - T101s, T102",Other,WW,Western Prince
8/24/18,2018,8,13:50,17C,122,Orca,2,Ts,,Bigg's,Orca Network,Public,Connie S Poppino
7/29/18,2018,7,14:10,17C,122,Orca,9-Aug,Ts,,T46'. T137's,Other,WW,Wild Whales Vancouver
5/24/18,2018,5,14:28,17C,122,Orca,4,Ts,,T101's,Other,WW,Wild Whales Vancouver
5/24/18,2018,5,13:46,17C,122,Orca,4,Ts,,T101's,Other,WW,Wild Whales Vancouver
6/30/18,2018,6,11:45,17C,122,Orca,,Ts,,not sure who,Other,TWM,Jeanne Hyde
6/24/18,2018,6,10:45,17C,122,Orca,9,Ts,,,Other,TWM,Jeanne Hyde
6/1/18,2018,6,,18C,122,Orca,,Ts,,"T11s, T100Bs",Other,TWM,Jeanne Hyde
5/24/18,2018,5,,17C,122,Orca,,Ts,,T101s,Other,TWM,Jeanne Hyde
5/24/18,2018,5,16:55,17C,122,Orca,,Ts,,T101s,Other,TWM,Jeanne Hyde
5/24/18,2018,5,,17C,122,Orca,,Ts,,,Hotline,Reliable,SW
5/24/18,2018,5,13:00,17C,122,Orca,,Ts,,T101s,Other,WW,San Juan Clipper
9/24/17,2017,9,13:20,17C,122,Orca,,Ts,,"T65As, T137s, T36Bs - ahead of residents, - also T37A1 and T5Bs",Other,TWM,Jeanne Hyde
9/6/17,2017,9,14:00,17C,122,Orca,,Ts,,T36A,Other,TWM,Jeanne Hyde
9/24/17,2017,9,14:00,17C,122,Orca,,JL,,,Other,TWM,Jeanne Hyde
8/29/17,2017,8,9:00,17C,122,Orca,,Ts,,T46Bs,Other,TWM,Jeanne Hyde
7/28/17,2017,7,6:30,18C,122,Orca,,Ts,,,Other,Public,Unknown Source via Jeanne Hyde
8/29/17,2017,8,12:30,17C,122,Orca,6,Ts,,T46Bs,Other,WW,Wild Whales Vancouver
8/29/17,2017,8,12:50,17C,122,Orca,6,Ts,,T46Bs,Other,WW,Wild Whales Vancouver
10/15/22,2022,10,17:45,18C,123,Orca,9,T,,T18s and T49As minus 49A1 & 49A2,Orca Network,Reliable,Rachael Hayden
10/15/22,2022,10,17:30,18C,123,Orca,5,T,,,Orca Network,Reliable,Karoline Cullen
10/13/22,2022,10,12:00,18C,123,Orca,2,T,,T49A2 & T49C,Orca Network,Public,Karoline Cullen
8/29/22,2022,8,8:00,18C,123,Orca,5,T,,T37As,Orca Network,Public,Karoline Cullen
11/20/22,2022,11,13:48,18C,123,Orca,,J,,,BCCSN,Reliable,
7/24/22,2022,7,13:49,18C,123,Orca,,J,,,BCCSN,Reliable,
7/24/22,2022,7,14:00,18C,123,Orca,,J,,,BCCSN,Reliable,
7/24/22,2022,7,13:38,18C,123,Orca,,J,,,BCCSN,Reliable,
7/24/22,2022,7,13:55,18C,123,Orca,,J,,,Other,Soundwatch,
7/24/22,2022,7,13:34,18C,123,Orca,,J,,,Other,Soundwatch,
7/12/22,2022,7,9:21,18C,123,Orca,,JKL,,,BCCSN,Reliable,
6/25/22,2022,6,9:26,18C,123,Orca,,JL,,,BCCSN,Reliable,
3/28/22,2022,3,13:07,18C,123,Orca,,J,,,BCCSN,Reliable,
1/9/22,2022,1,12:21,18C,123,Orca,,J,,,BCCSN,Reliable,
1/9/22,2022,1,13:45,18C,123,Orca,,J,,,BCCSN,Reliable,
11/20/22,2022,11,13:48,18C,123,Orca,,J,,,BCCSN,Reliable,
7/24/22,2022,7,13:49,18C,123,Orca,,J,,,BCCSN,Reliable,
7/24/22,2022,7,14:00,18C,123,Orca,,J,,,BCCSN,Reliable,
7/24/22,2022,7,13:38,18C,123,Orca,,J,,,BCCSN,Reliable,
7/24/22,2022,7,13:55,18C,123,Orca,,J,,,Other,Soundwatch,
7/24/22,2022,7,13:34,18C,123,Orca,,J,,,Other,Soundwatch,
7/12/22,2022,7,9:21,18C,123,Orca,,JKL,,,BCCSN,Reliable,
6/25/22,2022,6,9:26,18C,123,Orca,,JL,,,BCCSN,Reliable,
3/28/22,2022,3,13:07,18C,123,Orca,,J,,,BCCSN,Reliable,
1/9/22,2022,1,12:21,18C,123,Orca,,J,,,BCCSN,Reliable,
1/9/22,2022,1,13:45,18C,123,Orca,,J,,,BCCSN,Reliable,
11/20/22,2022,11,13:48,18C,123,Orca,,J,,,BCCSN,Reliable,
7/24/22,2022,7,13:49,18C,123,Orca,,J,,,BCCSN,Reliable,
7/24/22,2022,7,14:00,18C,123,Orca,,J,,,BCCSN,Reliable,
7/24/22,2022,7,13:38,18C,123,Orca,,J,,,BCCSN,Reliable,
7/24/22,2022,7,13:55,18C,123,Orca,,J,,,Other,Soundwatch,
7/24/22,2022,7,13:34,18C,123,Orca,,J,,,Other,Soundwatch,
7/12/22,2022,7,9:21,18C,123,Orca,,JKL,,,BCCSN,Reliable,
6/25/22,2022,6,9:26,18C,123,Orca,,JL,,,BCCSN,Reliable,
3/28/22,2022,3,13:07,18C,123,Orca,,J,,,BCCSN,Reliable,
1/9/22,2022,1,12:21,18C,123,Orca,,J,,,BCCSN,Reliable,
1/9/22,2022,1,13:45,18C,123,Orca,,J,,,BCCSN,Reliable,
11/20/22,2022,11,13:48,18C,123,Orca,,J,,,BCCSN,Reliable,
7/24/22,2022,7,13:49,18C,123,Orca,,J,,,BCCSN,Reliable,
7/24/22,2022,7,14:00,18C,123,Orca,,J,,,BCCSN,Reliable,
7/24/22,2022,7,13:38,18C,123,Orca,,J,,,BCCSN,Reliable,
7/24/22,2022,7,13:55,18C,123,Orca,,J,,,Other,Soundwatch,
7/24/22,2022,7,13:34,18C,123,Orca,,J,,,Other,Soundwatch,
7/12/22,2022,7,9:21,18C,123,Orca,,JKL,,,BCCSN,Reliable,
6/25/22,2022,6,9:26,18C,123,Orca,,JL,,,BCCSN,Reliable,
3/28/22,2022,3,13:07,18C,123,Orca,,J,,,BCCSN,Reliable,
1/9/22,2022,1,12:21,18C,123,Orca,,J,,,BCCSN,Reliable,
1/9/22,2022,1,13:45,18C,123,Orca,,J,,,BCCSN,Reliable,
11/20/22,2022,11,13:48,18C,123,Orca,,J,,,BCCSN,Reliable,
7/24/22,2022,7,13:49,18C,123,Orca,,J,,,BCCSN,Reliable,
7/24/22,2022,7,14:00,18C,123,Orca,,J,,,BCCSN,Reliable,
7/24/22,2022,7,13:38,18C,123,Orca,,J,,,BCCSN,Reliable,
7/24/22,2022,7,13:55,18C,123,Orca,,J,,,Other,Soundwatch,
7/24/22,2022,7,13:34,18C,123,Orca,,J,,,Other,Soundwatch,
7/12/22,2022,7,9:21,18C,123,Orca,,JKL,,,BCCSN,Reliable,
6/25/22,2022,6,9:26,18C,123,Orca,,JL,,,BCCSN,Reliable,
3/28/22,2022,3,13:07,18C,123,Orca,,J,,,BCCSN,Reliable,
1/9/22,2022,1,12:21,18C,123,Orca,,J,,,BCCSN,Reliable,
1/9/22,2022,1,13:45,18C,123,Orca,,J,,,BCCSN,Reliable,
11/20/22,2022,11,13:48,18C,123,Orca,,J,,,BCCSN,Reliable,
7/24/22,2022,7,13:49,18C,123,Orca,,J,,,BCCSN,Reliable,
7/24/22,2022,7,14:00,18C,123,Orca,,J,,,BCCSN,Reliable,
7/24/22,2022,7,13:38,18C,123,Orca,,J,,,BCCSN,Reliable,
7/24/22,2022,7,13:55,18C,123,Orca,,J,,,Other,Soundwatch,
7/24/22,2022,7,13:34,18C,123,Orca,,J,,,Other,Soundwatch,
7/12/22,2022,7,9:21,18C,123,Orca,,JKL,,,BCCSN,Reliable,
6/25/22,2022,6,9:26,18C,123,Orca,,JL,,,BCCSN,Reliable,
3/28/22,2022,3,13:07,18C,123,Orca,,J,,,BCCSN,Reliable,
1/9/22,2022,1,12:21,18C,123,Orca,,J,,,BCCSN,Reliable,
1/9/22,2022,1,13:45,18C,123,Orca,,J,,,BCCSN,Reliable,
11/20/22,2022,11,13:48,18C,123,Orca,,J,,,BCCSN,Reliable,
7/24/22,2022,7,13:49,18C,123,Orca,,J,,,BCCSN,Reliable,
7/24/22,2022,7,14:00,18C,123,Orca,,J,,,BCCSN,Reliable,
7/24/22,2022,7,13:38,18C,123,Orca,,J,,,BCCSN,Reliable,
7/24/22,2022,7,13:55,18C,123,Orca,,J,,,Other,Soundwatch,
7/24/22,2022,7,13:34,18C,123,Orca,,J,,,Other,Soundwatch,
7/12/22,2022,7,9:21,18C,123,Orca,,JKL,,,BCCSN,Reliable,
6/25/22,2022,6,9:26,18C,123,Orca,,JL,,,BCCSN,Reliable,
3/28/22,2022,3,13:07,18C,123,Orca,,J,,,BCCSN,Reliable,
1/9/22,2022,1,12:21,18C,123,Orca,,J,,,BCCSN,Reliable,
1/9/22,2022,1,13:45,18C,123,Orca,,J,,,BCCSN,Reliable,
11/20/22,2022,11,13:48,18C,123,Orca,,J,,,BCCSN,Reliable,
7/24/22,2022,7,13:49,18C,123,Orca,,J,,,BCCSN,Reliable,
7/24/22,2022,7,14:00,18C,123,Orca,,J,,,BCCSN,Reliable,
7/24/22,2022,7,13:38,18C,123,Orca,,J,,,BCCSN,Reliable,
7/24/22,2022,7,13:55,18C,123,Orca,,J,,,Other,Soundwatch,
7/24/22,2022,7,13:34,18C,123,Orca,,J,,,Other,Soundwatch,
7/12/22,2022,7,9:21,18C,123,Orca,,JKL,,,BCCSN,Reliable,
6/25/22,2022,6,9:26,18C,123,Orca,,JL,,,BCCSN,Reliable,
3/28/22,2022,3,13:07,18C,123,Orca,,J,,,BCCSN,Reliable,
1/9/22,2022,1,12:21,18C,123,Orca,,J,,,BCCSN,Reliable,
1/9/22,2022,1,13:45,18C,123,Orca,,J,,,BCCSN,Reliable,
11/20/22,2022,11,13:48,18C,123,Orca,,J,,,BCCSN,Reliable,
7/24/22,2022,7,13:49,18C,123,Orca,,J,,,BCCSN,Reliable,
7/24/22,2022,7,14:00,18C,123,Orca,,J,,,BCCSN,Reliable,
7/24/22,2022,7,13:38,18C,123,Orca,,J,,,BCCSN,Reliable,
7/24/22,2022,7,13:55,18C,123,Orca,,J,,,Other,Soundwatch,
7/24/22,2022,7,13:34,18C,123,Orca,,J,,,Other,Soundwatch,
7/12/22,2022,7,9:21,18C,123,Orca,,JKL,,,BCCSN,Reliable,
6/25/22,2022,6,9:26,18C,123,Orca,,JL,,,BCCSN,Reliable,
3/28/22,2022,3,13:07,18C,123,Orca,,J,,,BCCSN,Reliable,
1/9/22,2022,1,12:21,18C,123,Orca,,J,,,BCCSN,Reliable,
1/9/22,2022,1,13:45,18C,123,Orca,,J,,,BCCSN,Reliable,
11/20/22,2022,11,13:48,18C,123,Orca,,J,,,BCCSN,Reliable,
11/20/22,2022,11,13:48,18C,123,Orca,,J,,,BCCSN,Reliable,
11/20/22,2022,11,13:48,18C,123,Orca,,J,,,BCCSN,Reliable,
11/20/22,2022,11,13:48,18C,123,Orca,,J,,,BCCSN,Reliable,
11/20/22,2022,11,13:48,18C,123,Orca,,J,,,BCCSN,Reliable,
11/20/22,2022,11,13:48,18C,123,Orca,,J,,,BCCSN,Reliable,
7/24/22,2022,7,13:49,18C,123,Orca,,J,,,BCCSN,Reliable,
7/24/22,2022,7,13:49,18C,123,Orca,,J,,,BCCSN,Reliable,
7/24/22,2022,7,13:49,18C,123,Orca,,J,,,BCCSN,Reliable,
7/24/22,2022,7,13:49,18C,123,Orca,,J,,,BCCSN,Reliable,
7/24/22,2022,7,13:49,18C,123,Orca,,J,,,BCCSN,Reliable,
7/24/22,2022,7,13:49,18C,123,Orca,,J,,,BCCSN,Reliable,
7/24/22,2022,7,14:00,18C,123,Orca,,J,,,BCCSN,Reliable,
7/24/22,2022,7,14:00,18C,123,Orca,,J,,,BCCSN,Reliable,
7/24/22,2022,7,14:00,18C,123,Orca,,J,,,BCCSN,Reliable,
7/24/22,2022,7,14:00,18C,123,Orca,,J,,,BCCSN,Reliable,
7/24/22,2022,7,14:00,18C,123,Orca,,J,,,BCCSN,Reliable,
7/24/22,2022,7,14:00,18C,123,Orca,,J,,,BCCSN,Reliable,
7/24/22,2022,7,13:38,18C,123,Orca,,J,,,BCCSN,Reliable,
7/24/22,2022,7,13:38,18C,123,Orca,,J,,,BCCSN,Reliable,
7/24/22,2022,7,13:38,18C,123,Orca,,J,,,BCCSN,Reliable,
7/24/22,2022,7,13:38,18C,123,Orca,,J,,,BCCSN,Reliable,
7/24/22,2022,7,13:38,18C,123,Orca,,J,,,BCCSN,Reliable,
7/24/22,2022,7,13:38,18C,123,Orca,,J,,,BCCSN,Reliable,
7/24/22,2022,7,13:55,18C,123,Orca,,J,,,Other,Soundwatch,
7/24/22,2022,7,13:55,18C,123,Orca,,J,,,Other,Soundwatch,
7/24/22,2022,7,13:55,18C,123,Orca,,J,,,Other,Soundwatch,
7/24/22,2022,7,13:55,18C,123,Orca,,J,,,Other,Soundwatch,
7/24/22,2022,7,13:55,18C,123,Orca,,J,,,Other,Soundwatch,
7/24/22,2022,7,13:55,18C,123,Orca,,J,,,Other,Soundwatch,
7/24/22,2022,7,13:34,18C,123,Orca,,J,,,Other,Soundwatch,
7/24/22,2022,7,13:34,18C,123,Orca,,J,,,Other,Soundwatch,
7/24/22,2022,7,13:34,18C,123,Orca,,J,,,Other,Soundwatch,
7/24/22,2022,7,13:34,18C,123,Orca,,J,,,Other,Soundwatch,
7/24/22,2022,7,13:34,18C,123,Orca,,J,,,Other,Soundwatch,
7/24/22,2022,7,13:34,18C,123,Orca,,J,,,Other,Soundwatch,
7/12/22,2022,7,9:21,18C,123,Orca,,JKL,,,BCCSN,Reliable,
7/12/22,2022,7,9:21,18C,123,Orca,,JKL,,,BCCSN,Reliable,
7/12/22,2022,7,9:21,18C,123,Orca,,JKL,,,BCCSN,Reliable,
7/12/22,2022,7,9:21,18C,123,Orca,,JKL,,,BCCSN,Reliable,
7/12/22,2022,7,9:21,18C,123,Orca,,JKL,,,BCCSN,Reliable,
7/12/22,2022,7,9:21,18C,123,Orca,,JKL,,,BCCSN,Reliable,
6/25/22,2022,6,9:26,18C,123,Orca,,JL,,,BCCSN,Reliable,
6/25/22,2022,6,9:26,18C,123,Orca,,JL,,,BCCSN,Reliable,
6/25/22,2022,6,9:26,18C,123,Orca,,JL,,,BCCSN,Reliable,
6/25/22,2022,6,9:26,18C,123,Orca,,JL,,,BCCSN,Reliable,
6/25/22,2022,6,9:26,18C,123,Orca,,JL,,,BCCSN,Reliable,
6/25/22,2022,6,9:26,18C,123,Orca,,JL,,,BCCSN,Reliable,
3/28/22,2022,3,13:07,18C,123,Orca,,J,,,BCCSN,Reliable,
3/28/22,2022,3,13:07,18C,123,Orca,,J,,,BCCSN,Reliable,
3/28/22,2022,3,13:07,18C,123,Orca,,J,,,BCCSN,Reliable,
3/28/22,2022,3,13:07,18C,123,Orca,,J,,,BCCSN,Reliable,
3/28/22,2022,3,13:07,18C,123,Orca,,J,,,BCCSN,Reliable,
3/28/22,2022,3,13:07,18C,123,Orca,,J,,,BCCSN,Reliable,
1/9/22,2022,1,12:21,18C,123,Orca,,J,,,BCCSN,Reliable,
1/9/22,2022,1,12:21,18C,123,Orca,,J,,,BCCSN,Reliable,
1/9/22,2022,1,12:21,18C,123,Orca,,J,,,BCCSN,Reliable,
1/9/22,2022,1,12:21,18C,123,Orca,,J,,,BCCSN,Reliable,
1/9/22,2022,1,12:21,18C,123,Orca,,J,,,BCCSN,Reliable,
1/9/22,2022,1,12:21,18C,123,Orca,,J,,,BCCSN,Reliable,
1/9/22,2022,1,13:45,18C,123,Orca,,J,,,BCCSN,Reliable,
1/9/22,2022,1,13:45,18C,123,Orca,,J,,,BCCSN,Reliable,
1/9/22,2022,1,13:45,18C,123,Orca,,J,,,BCCSN,Reliable,
1/9/22,2022,1,13:45,18C,123,Orca,,J,,,BCCSN,Reliable,
1/9/22,2022,1,13:45,18C,123,Orca,,J,,,BCCSN,Reliable,
1/9/22,2022,1,13:45,18C,123,Orca,,J,,,BCCSN,Reliable,
11/26/22,2022,11,11:55,18C,123,Orca,,J,,,Orca Network,Reliable,Monika Wieland Shields per Salish Sea Orca Squad
11/12/22,2022,11,13:00,18C,123,Orca,,JKL,,,Orca Network,Public,Yves Tiberghien
10/10/22,2022,10,9:30,18C,123,Orca,,J,,,Orca Network,Reliable,Monika Wieland Shields via Salish Sea Orca Squad
9/5/22,2022,9,,18C,123,Orca,,J,,,Orca Network,Reliable,Rachelle Hayden
8/8/22,2022,8,9:30,18C,123,Orca,,J,,,Orca Network,Reliable,Monika Wieland Shields
7/23/22,2022,7,6:00,18C,123,Orca,,J,,,Orca Network,Public,Rachelle Hayden
7/1/22,2022,7,9:00,18C,123,Orca,6,T,,,Orca Network,Public,Karoline Cullen
6/29/22,2022,6,15:00,18C,123,Orca,10,T,,"IDs: T125s, T128, T137s",Orca Network,Public,Karoline Cullen
6/27/22,2022,6,8:42,18C,123,Orca,,J,,,Orca Network,Reliable,Monika Wieland Shields
6/25/22,2022,6,10:00,18C,123,Orca,,JL,,,Orca Network,Reliable,Monika Wieland Shields
5/24/22,2022,5,8:37,18C,123,Orca,,J,,,Orca Network,CWR,Mia Rachel
5/24/22,2022,5,8:30,18C,123,Orca,,J,,,Orca Network,Reliable,Karoline Cullen
5/2/22,2022,5,17:00,18C,123,Orca,4,T,,"IDs: T49A1, T49A2",Orca Network,Reliable,Karoline Cullen
4/28/22,2022,4,18:00,18C,123,Orca,5,T,,IDs: T49As,Orca Network,Reliable,Karoline Cullen
4/14/22,2022,4,14:00,18C,123,Orca,5,T,,Beh: feeding on stellar sea lion,Orca Network,Reliable,April Ryan
4/12/22,2022,4,8:30,18C,123,Orca,5,T,,IDs: T65Bs,Orca Network,Reliable,Rachelle Hayden
3/20/22,2022,3,7:33,18C,123,Orca,6,T,,ID's T49A;s,Orca Network,Reliable,Bart Ruton
3/28/22,2022,3,15:37,18C,123,Orca,,J,,,Orca Network,Reliable,Rachelle Hayden
2/26/22,2022,2,8:20,18C,123,Orca,5,,T,"Pod unconfirmed, likely transients based on location description. -AH",Orca Network,Public,Jonathan Hunter
2/22/22,2022,2,8:20,18C,123,Orca,5,,,Unidentified Orcas,Orca Network,Public,Jonathan Hunter
2/12/22,2022,2,9:00,18C,123,Orca,,J,,,Orca Network,Reliable,Karoline Cullen
11/29/21,2021,11,8:30,18C,123,Orca,,J,,,Other,TWM,Jeanne Hyde
11/13/21,2021,11,7:30,18C,123,Orca,,J,,,Other,TWM,Jeanne Hyde
9/16/21,2021,9,6:13,18C,123,Orca,,J,,,Other,TWM,Jeanne Hyde
9/1/21,2021,9,10:00,18C,123,Orca,24,JL,,IDs: L88 confirmed,Other,TWM,Jeanne Hyde
4/6/21,2021,4,15:00,18C,123,Orca,,J,,,Other,TWM,Jeanne Hyde
3/26/21,2021,3,16:30,18C,123,Orca,,J,,,Other,TWM,Jeanne Hyde
3/12/21,2021,3,18:00,18C,123,Orca,6,J,,,Other,TWM,Jeanne Hyde
9/11/21,2021,9,12:10,18C,123,Orca,,JKL,,,Orca Network,Public,Rachel Hayden
9/1/21,2021,9,9:20,18C,123,Orca,,J,,,Orca Network,Reliable,Karoline Cullen
11/29/21,2021,11,10:00,18C,123,Orca,3,J,,,Orca Network,Reliable,Rachelle Hayden
8/9/21,2021,8,10:00,18C,123,Orca,3,T,,"IDs: T49A2, T77C, T77D",Orca Network,Reliable,Karoline Cullen
7/31/21,2021,7,14:15,18C,123,Orca,6,,T,,Orca Network,Public,Yves Tiberghien
6/27/21,2021,6,19:00,18C,123,Orca,7,T,,IDs: T65Bs,Orca Network,Reliable,Karoline Cullen
5/19/21,2021,5,18:00,18C,123,Orca,3,T,,"IDs: T65Bs, T100Bs",Orca Network,Public,Yves Tiberghien
4/18/21,2021,4,19:00,18C,123,Orca,2,T,,IDs: T65Bs,Orca Network,Public,Yves Tiberghien
4/15/21,2021,4,9:00,18C,123,Orca,2,,T,"IDs: T49As, T49Bs",Orca Network,Public,Yves Tiberghien
4/7/21,2021,4,11:00,18C,123,Orca,,J,,,Orca Network,Reliable,Monika Wieland Shields
3/8/21,2021,3,15:30,18C,123,Orca,4,J,,,Orca Network,Public,Yves Tiberghien
8/1/21,2021,8,13:06,18C,123,Orca,5,T,,,Other,Soundwatch,
8/2/21,2021,8,12:14,18C,123,Orca,9,,T,Beh:Slow moving,BCCSN,Reliable,
9/15/21,2021,9,16:19,18C,123,Orca,15,,JKL,Beh:Fast moving,BCCSN,Reliable,
9/9/21,2021,9,18:51,18C,123,Orca,4,,JKL,"Beh:Fast moving,Breaching",BCCSN,Reliable,
9/1/21,2021,9,8:15,18C,123,Orca,23,,J,Beh:Fast moving,BCCSN,Reliable,
8/2/21,2021,8,16:56,18C,123,Orca,8,,T,"Beh:Slow moving,Spy-hopping,Fluking",BCCSN,Reliable,
4/15/21,2021,4,23:06,18C,123,Orca,6,,T,Beh:Slow moving,BCCSN,Reliable,
4/7/21,2021,4,9:57,18C,123,Orca,12,,J,"Beh:Slow moving,Feeding",BCCSN,Reliable,
7/6/20,2020,7,16:00,18C,123,Orca,,Ts,,Bigg's IDs: T65A's.,Orca Network,Reliable,Karoline Cullen
11/10/20,2020,11,16:15,18C,123,Orca,,J&K,,,Orca Network,Public,Yves Tiberghien
7/5/20,2020,7,18:00,18C,123,Orca,,Ts,,"Bigg's IDs: T34s, T37, T37Bs, T36, T36Bs, T46s",Orca Network,Public,Karoline Cullen
6/13/20,2020,6,9:00,18C,123,Orca,7,,,,Orca Network,Public,Trudy Norton
4/11/20,2020,4,8:00,18C,123,Orca,,J,,Southern Residents. IDs: J Pod,Orca Network,Public,Rachelle Hayden
5/21/20,2020,5,15:00,18C,123,Orca,5,,,ID: T124A's,Orca Network,Public,Rachelle Hayden
5/13/20,2020,5,,18C,123,Orca,,,,"ID: T124A, T065B, T086A",Orca Network,Public,Rachelle Hayden
5/11/20,2020,5,,18C,123,Orca,,,,"IDs: T124C, T97",Other,Public,Rachelle Hayden
5/5/20,2020,5,,18C,123,Orca,,,,,Orca Network,Public,Yves Tiberghien
7/16/19,2019,7,13:57,18C,123,Orca,6,T077; T065,,,Other,Soundwatch,
7/16/19,2019,7,14:57,18C,123,Orca,6,T077; T065,,,Other,Soundwatch,
6/16/19,2019,6,15:58,18C,123,Orca,1,T077A,,,Other,Soundwatch,
7/6/20,2020,7,16:00,18C,123,Orca,5,T,,T37As,Orca Network,Reliable,Karoline Cullen
7/5/20,2020,7,18:00,18C,123,Orca,,T,,"T34w, T37, T37B, T36, T36Bs, T46s",Orca Network,Reliable,Karoline Cullen
8/5/20,2020,8,19:45,18C,123,Orca,4,T,,one claf,Orca Network,Public,Jack Huberman
9/30/20,2020,9,10:46,18C,123,Orca,,J,,,Orca Network,Public,Rachelle Haryden
9/28/20,2020,9,16:30,18C,123,Orca,3,T,,"T037, T034, T037B",Orca Network,Reliable,Karoline Cullen
9/19/20,2020,9,23:55,18C,123,Orca,,"J,K,L",,,Orca Network,Public,Rachelle Hayden
9/8/20,2020,9,19:00,18C,123,Orca,,T,,"T18s, T65Bs, T19s likley",Orca Network,Public,Yves Tiberghien
9/3/20,2020,9,22:00,18C,123,Orca,,J,,,Orca Network,Reliable,Monika Wieland Sheilds
3/10/20,2020,3,15:30,18C,123,Orca,22,J,,,Orca Network,Public,Rachelle Hayden
12/30/19,2019,12,10:00,18C,123,Orca,,"Jp, Kp",,"J16s, J40, plus more. K12s, K21 plus more",Other,TWM,Jeanne Hyde
12/21/19,2019,12,23:00,18C,123,Orca,8,,,,Other,TWM,Jeanne Hyde
12/15/19,2019,12,11:30,18C,123,Orca,,T,,"T034s, T037, T037Bs, T077s, T075Bs, T075Cs",Other,TWM,Jeanne Hyde
11/16/19,2019,11,8:00,18C,123,Orca,,Jp,,J42 only ID,Other,TWM,Jeanne Hyde
11/8/19,2019,11,16:30,18C,123,Orca,,T,,,Other,TWM,Jeanne Hyde
11/7/19,2019,11,15:45,18C,123,Orca,,T,,,Other,TWM,Jeanne Hyde
11/7/19,2019,11,21:29,18C,123,Orca,,"Jp, Lp",,,Other,TWM,Jeanne Hyde
8/13/19,2019,8,15:00,18C,123,Orca,1,T,,T65A2,Other,TWM,Jeanne Hyde
9/30/20,2020,9,12:00,18C,123,Orca,24,J,,,Other,TWM,Jeanne Hyde
9/10/20,2020,9,14:00,18C,123,Orca,,T,,"T109Cs, T041s",Other,TWM,Jeanne Hyde
9/8/20,2020,9,19:00,18C,123,Orca,4,T,,T123s,Other,TWM,Jeanne Hyde
9/4/20,2020,9,13:30,18C,123,Orca,,,,,Other,TWM,Jeanne Hyde
9/3/20,2020,9,22:00,18C,123,Orca,22,J,,,Other,TWM,Jeanne Hyde
9/2/20,2020,9,12:00,18C,123,Orca,22,J,,,Other,TWM,Jeanne Hyde
8/19/20,2020,8,10:00,18C,123,Orca,,T,,T018s likley,Other,TWM,Jeanne Hyde
8/13/20,2020,8,8:00,18C,123,Orca,8,T,,"T018s, T036As",Other,TWM,Jeanne Hyde
7/13/20,2020,7,7:15,18C,123,Orca,22,J,,,Other,TWM,Jeanne Hyde
7/12/20,2020,7,2:00,18C,123,Orca,22,J,,,Other,TWM,Jeanne Hyde
6/16/20,2020,6,14:30,18C,123,Orca,,,,"T123s, T046B1s",Other,TWM,Jeanne Hyde
6/16/20,2020,6,14:15,18C,123,Orca,,,,"T046B1s, T123s likley",Other,TWM,Jeanne Hyde
5/13/20,2020,5,12:00,18C,123,Orca,8,T,,,Other,TWM,Jeanne Hyde
5/12/20,2020,5,13:00,18C,123,Orca,2,T,,"T097, T124C",Other,TWM,Jeanne Hyde
5/2/20,2020,5,17:30,18C,123,Orca,7,T,,"T018s, T90s",Other,TWM,Jeanne Hyde
4/23/20,2020,4,11:30,18C,123,Orca,2,T,,,Other,TWM,Jeanne Hyde
4/18/20,2020,4,9:00,18C,123,Orca,4,T,,T018s,Other,TWM,Jeanne Hyde
4/16/20,2020,4,20:30,18C,123,Orca,22,J,,,Other,TWM,Jeanne Hyde
4/11/20,2020,4,9:00,18C,123,Orca,3,Jp,,J26,Other,TWM,Jeanne Hyde
4/10/20,2020,4,13:00,18C,123,Orca,2,T,,"T049C, T077A",Other,TWM,Jeanne Hyde
4/10/20,2020,4,9:00,18C,123,Orca,2,T,,"T049C, T077A",Other,TWM,Jeanne Hyde
4/8/20,2020,4,19:00,18C,123,Orca,10,T,,"T063, T065, T137s, T036As",Other,TWM,Jeanne Hyde
12/24/20,2020,12,9:00,18C,123,Orca,31,"J, Kp",,"J, K13s, K14s",Other,TWM,Jeanne Hyde
12/11/20,2020,12,14:00,18C,123,Orca,33,"J, Kp",,"J, K13s, K14s",Other,TWM,Jeanne Hyde
11/30/20,2020,11,9:00,18C,123,Orca,24,J,,,Other,TWM,Jeanne Hyde
11/9/20,2020,11,7:30,18C,123,Orca,,,,J26,Other,TWM,Jeanne Hyde
3/31/20,2020,3,11:00,18C,123,Orca,1,T,,T065A5,Other,OWatch,Jeanne Hyde
3/31/20,2020,3,8:00,18C,123,Orca,22,J,,,Other,TWM,Jeanne Hyde
3/22/20,2020,3,12:00,18C,123,Orca,4,T,,T18s,Other,TWM,Jeanne Hyde
3/20/20,2020,3,13:30,18C,123,Orca,3,T,,"T049As, T071s",Other,TWM,Jeanne Hyde
3/20/20,2020,3,11:00,18C,123,Orca,3,T,,,Other,TWM,Jeanne Hyde
3/16/20,2020,3,9:30,18C,123,Orca,SE,T,,,Other,TWM,Jeanne Hyde
3/16/20,2020,3,9:00,18C,123,Orca,,T,,,Other,TWM,Jeanne Hyde
2/29/20,2020,2,17:30,18C,123,Orca,22,J,,,Other,TWM,Jeanne Hyde
1/27/20,2020,1,14:00,18C,123,Orca,9,T,,"T124As, T124C, T002Cs",Other,TWM,Jeanne Hyde
12/30/19,2019,12,10:15,18C,123,Orca,,Kp,,,Orca Network,Public,Rachelle Hayden
12/30/19,2019,12,9:45,18C,123,Orca,,Jp,,,Orca Network,Public,Rachel Hayden
12/28/19,2019,12,12:00,18C,123,Orca,,T,,Un id,Orca Network,Public,Yves Tiberghien
11/16/19,2019,11,7:30,18C,123,Orca,,SRKW,,,Orca Network,Public,Rachelle Hayden
9/4/19,2019,9,,18C,123,Orca,2,Ts,,T36s,Orca Network,WW,Island Adventures
9/19/19,2019,9,13:30,18C,123,Orca,2,Ts,,T100s,Orca Network,WW,"Karoline Cullen, Salish Sea Orca Squad"
6/27/19,2019,6,19:30,18C,123,Orca,3,Ts,,IDs: Likely T65A's,Orca Network,Reliable,Karoline Cullen
6/23/19,2019,6,14:14,18C,123,Orca,2,Ts,,IDs: Likely T124A's,Orca Network,Public,Rachelle Hayden
6/22/19,2019,6,13:30,18C,123,Orca,1,Ts,,IDs: Possibly T124C,Orca Network,Public,Brooke Speed
6/10/19,2019,6,18:30,18C,123,Orca,4,Ts,Ts,"T123s confirmed by Melisa Pinnow, Center for Whale Research",Orca Network,Reliable,Karoline Cullen
7/19/19,2019,7,13:00,18C,123,Orca,,Ts,,"Members of  T34s, T37, T37Bs",Orca Network,Reliable,Karoline Cullen
7/10/19,2019,7,16:00,18C,123,Orca,,Ts,T65As,,Orca Network,Reliable,Karoline Cullen
7/6/19,2019,7,6:31,18C,123,Orca,30,SRs,JKL87,,Orca Network,Public,Rachel Hayden
8/10/19,2019,8,20:20,18C,123,Orca,1,Ts,,"T65A2 slowly traveling through Active Pass, then 1 hour later moved eastward.",Orca Network,Public,Karoline Cullen
3/30/19,2019,3,,18C,123,Orca,23,"J,L",,"J Pod/L87, evening sighting",Orca Network,Reliable,Monika Wiekand Shields
3/30/19,2019,3,,18C,123,Orca,23,"J,L",,"J Pod/L87 south side of Active Pass. ID J19, J27, J41, J40, J36",Orca Network,Reliable,Gary Sutton
3/30/19,2019,3,,18C,123,Orca,23,"J,L",,J16s and J19s arrived at the mouth of the pass and waited for the rest of the pod before traveling through the pass together,Orca Network,Reliable,Tasli Shaw
7/6/19,2019,7,6:30,18C,123,Orca,,JKL,,,Other,Reliable,Jeanne Hyde
7/5/19,2019,7,10:00,18C,123,Orca,3+,Ts,,large group of Ts,Other,Reliable,Jeanne Hyde
7/3/19,2019,7,14:00,18C,123,Orca,3,Ts,,"T37, T37Bs, and T34s",Other,Reliable,Jeanne Hyde
6/30/19,2019,6,11:00,18C,123,Orca,,,,,Other,Reliable,Jeanne Hyde
6/23/19,2019,6,14:00,18C,123,Orca,,,,From ferry passenger,Other,Reliable,Jeanne Hyde
3/22/19,2019,3,13:15,18C,123,Orca,4,,,Report of fishing vessel heading west at full speed almost hit whales and did not slow down or divert path.  Conditions clear and seas calm.,Orca Network,Public,Lisa
3/14/19,2019,3,13:00,18C,123,Orca,,,,,Orca Network,Public,Cody Tornow
6/15/19,2019,6,12:30,18C,123,Orca,,,,,Other,Reliable,Jeanne Hyde
1/28/19,2019,1,,18C,123,Orca,,,,SRKWs seen in morning,Orca Network,Reliable,Monika Wieland Shields
5/25/19,2019,5,9:30,18C,123,Orca,6,Ts,,T65As,Other,Reliable,Jeanne Hyde
4/28/19,2019,4,6:30,18C,123,Orca,,J,,,Email,Reliable,Jeanne Hyde
4/25/19,2019,4,,18C,123,Orca,8,Ts,,"T90s, T87, T124A2s",Email,Reliable,Jeanne Hyde
4/16/19,2019,4,19:45,18C,123,Orca,5,Ts,,T49As,Email,Reliable,Jeanne Hyde
4/10/19,2019,4,16:45,18C,123,Orca,4,Ts,,T18s,Email,Reliable,Jeanne Hyde
3/26/19,2019,3,7:30,18C,123,Orca,6,,,,Email,Reliable,Jeanne Hyde
3/21/19,2019,3,,18C,123,Orca,,,,,Email,Reliable,Jeanne Hyde
3/18/19,2019,3,18:00,18C,123,Orca,2,Ts,,,Email,Reliable,Jeanne Hyde
3/17/19,2019,3,10:00,18C,123,Orca,4,,,,Email,Reliable,Jeanne Hyde
3/8/19,2019,3,14:00,18C,123,Orca,3,,,,Email,Reliable,Jeanne Hyde
2/19/19,2019,2,14:00,18C,123,Orca,4,Ts,,T87 and others,Email,Reliable,Jeanne Hyde
2/13/19,2019,2,13:00,18C,123,Orca,,,,,Email,Reliable,Jeanne Hyde
10/23/19,2019,10,13:45,18C,123,Orca,4,Ts,,T49As minus A2,Email,WW,Vancouver Island WW Co
9/18/19,2019,9,13:10,18C,123,Orca,,Ts,,T100s and T123s,Email,WW,Vancouver Island WW Co
9/18/19,2019,9,13:05,18C,123,Orca,8,Ts,,T100s and T123s,Email,WW,Vancouver Island WW Co
9/11/19,2019,9,16:44,18C,123,Orca,4,Ts,,T18s,Email,WW,Vancouver Island WW Co
8/13/19,2019,8,16:20,18C,123,Orca,1,Ts,,T65A2,Email,WW,Vancouver Island WW Co
8/13/19,2019,8,16:35,18C,123,Orca,1,Ts,,T65A2,Email,WW,Vancouver Island WW Co
8/10/19,2019,8,16:45,18C,123,Orca,1,Ts,,T65A2,Email,WW,Vancouver Island WW Co
7/30/19,2019,7,13:05,18C,123,Orca,5,Ts,,T65As minus T65A2,Email,WW,Vancouver Island WW Co
7/28/19,2019,7,17:31,18C,123,Orca,2,Ts,,T77C and T77D,Email,WW,Vancouver Island WW Co
7/28/19,2019,7,16:48,18C,123,Orca,2,Ts,,T77C and T77D,Email,WW,Vancouver Island WW Co
7/23/19,2019,7,12:30,18C,123,Orca,,Ts,,"T77s, T65As",Email,WW,Vancouver Island WW Co
7/23/19,2019,7,13:49,18C,123,Orca,1,Ts,,T77A,Email,WW,Vancouver Island WW Co
7/23/19,2019,7,12:50,18C,123,Orca,,Ts,,"T77s, T65As (minus T65A2)",Email,WW,Vancouver Island WW Co
7/19/19,2019,7,17:15,18C,123,Orca,7,Ts,,T37s and T34s,Email,WW,Vancouver Island WW Co
4/25/19,2019,4,14:55,18C,123,Orca,,Ts,,T87 and T90s,Email,WW,Vancouver Island WW Co
4/14/19,2019,4,13:15,18C,123,Orca,1,Ts,,T77A,Email,WW,Vancouver Island WW Co
9/29/19,2019,9,17:00,18C,123,Orca,,Ts,,"T035As, T038As",Email,Reliable,Jeanne Hyde
10/18/19,2019,10,12:00,18C,123,Orca,,SRKW,Ls,L72,Email,Reliable,Jeanne Hyde
8/4/18,2018,8,12:30,18C,123,Orca,,Ts,,"T46s, T137s",Other,WW,Western Prince
7/3/18,2018,7,15:35,18C,123,Orca,,Ts,,"T36As, T99s, T175 - many direction changes in Active Pass",Other,WW,Western Prince
6/30/18,2018,6,11:40,18C,123,Orca,,Ts,,T49As - excludes T49A1,Other,WW,Western Prince
6/23/18,2018,6,11:45,18C,123,Orca,7+,Ts,,,Other,WW,Western Prince
5/7/18,2018,5,13:45,18C,123,Orca,7,Ts,,"T100s, T123s",Other,WW,Western Prince
9/20/18,2018,9,,18C,123,Orca,22,J,,"J pod, K pod, 18 L pod whales in Salish Sea",Other,TWM,Jeanne Hyde
9/17/18,2018,9,,18C,123,Orca,20,SRs,,,Other,TWM,Jeanne Hyde
9/14/18,2018,9,8:00,18C,123,Orca,60,JKLp,,"J pod, K pod, 18 L pod whales",Other,TWM,Jeanne Hyde
9/10/18,2018,9,,18C,123,Orca,42,JLp,,Js and 18Ls,Other,TWM,Jeanne Hyde
9/3/18,2018,9,,18C,123,Orca,45,JL,,"J pod, L87, L12s, 15 other Ls.",Other,TWM,Jeanne Hyde
10/3/18,2018,10,,18C,123,Orca,,J,,Orca Network,Orca Network,Public,Rachelle Hayden
9/3/18,2018,9,19:00,18C,123,Orca,,SRs,,"SRKWs - very spread out, moving quickly",Orca Network,Reliable,Karoline Cullen
9/1/18,2018,9,11:30,18C,123,Orca,9+,J,,"J Pod - two groups, one group of 4 followed by larger group including J27",Orca Network,Reliable,Karoline Cullen
8/30/18,2018,8,17:00,18C,123,Orca,4,Ts,,Bigg's,Orca Network,Reliable,Karoline Cullen
8/24/18,2018,8,16:00,18C,123,Orca,,Ts,,Bigg's,Orca Network,Reliable,Jeanette Dorner
9/1/18,2018,9,,18C,123,Orca,24,J,,,Other,TWM,Jeanne Hyde
8/10/18,2018,8,,18C,123,Orca,,J,,,Other,TWM,Jeanne Hyde
7/5/18,2018,7,,18C,123,Orca,,Ts,,,Other,TWM,Jeanne Hyde
7/3/18,2018,7,,18C,123,Orca,,Ts,,,Other,TWM,Jeanne Hyde
7/22/18,2018,7,,18C,123,Orca,5,Jp,,J16s,Other,TWM,Jeanne Hyde
8/10/18,2018,8,18:00,18C,123,Orca,3,J,,Included 1 male,Orca Network,Public,Michael J. Schmidt
9/20/18,2018,9,11:32,18C,123,Orca,~15,J,,,Other,WW,Wild Whales Vancouver
8/15/18,2018,8,10:42,18C,123,Orca,4,Ts,,T37A's,Other,WW,Wild Whales Vancouver
8/15/18,2018,8,10:25,18C,123,Orca,4,Ts,,T46,Other,WW,Wild Whales Vancouver
7/29/18,2018,7,12:58,18C,123,Orca,9,Ts,,"T46's , T137's",Other,WW,Wild Whales Vancouver
7/21/18,2018,7,17:00,18C,123,Orca,6,Ts,,Unknown,Other,WW,Wild Whales Vancouver
7/21/18,2018,7,16:18,18C,123,Orca,6,Ts,,Unknown,Other,WW,Wild Whales Vancouver
7/21/18,2018,7,16:50,18C,123,Orca,6,Ts,,Unknown,Other,WW,Wild Whales Vancouver
7/6/18,2018,7,18:06,18C,123,Orca,~5,Ts,,T124As,Other,WW,Wild Whales Vancouver
7/4/18,2018,7,11:53,18C,123,Orca,9,Ts,,T36As and T99s,Other,WW,Wild Whales Vancouver
6/30/18,2018,6,10:15,18C,123,Orca,6-May,Ts,,"Reported as T24As, but most likely T49As.",Other,WW,Wild Whales Vancouver
6/13/18,2018,6,13:50,18C,123,Orca,~10,Ts,,T77's and unknown,Other,WW,Wild Whales Vancouver
6/12/18,2018,6,14:26,18C,123,Orca,10+,J,,,Other,WW,Wild Whales Vancouver
5/7/18,2018,5,12:55,18C,123,Orca,3,Ts,,T101,Other,WW,Wild Whales Vancouver
5/7/18,2018,5,12:30,18C,123,Orca,4,Ts,,T101 & T102,Other,WW,Wild Whales Vancouver
7/10/18,2018,7,,18C,123,Orca,,Ts,,T124As - T124A3,Orca Network,Reliable,Gary Sutton
8/31/18,2018,8,10:30,18C,123,Orca,,,Ts,,Hotline,Reliable,Rick Beauregard
7/2/18,2018,7,,18C,123,Orca,6-May,Ts,,"T36As, T99s",Orca Network,Public,Yves Tiberghein
7/1/18,2018,7,13:15,18C,123,Orca,5,Ts,,,Orca Network,Public,Yves Tiberghien
6/30/18,2018,6,11:36,18C,123,Orca,,Ts,,T49As,Orca Network,Public,Carole Murray
6/30/18,2018,6,11:22,18C,123,Orca,,Ts,,T49As,Orca Network,Public,Carole Murray
6/28/18,2018,6,9:03,18C,123,Orca,,SR,,,Orca Network,Public,Rachelle Hayden
6/23/18,2018,6,11:00,18C,123,Orca,,Ts,,"T124As, T124A2s",Orca Network,Reliable,Alisa Lemire Brooks
6/12/18,2018,6,,18C,123,Orca,15+,SRs,,,Orca Network,Public,Sydney Gass
6/11/18,2018,6,,18C,123,Orca,,JLp,,"Afternoon, L19s",Orca Network,Reliable,Karoline Cullen
6/30/18,2018,6,9:30,18C,123,Orca,,Ts,,T65As,Other,TWM,Jeanne Hyde
6/30/18,2018,6,,18C,123,Orca,,Ts,,T49As,Other,TWM,Jeanne Hyde
6/30/18,2018,6,,18C,123,Orca,,Ts,,T49As,Other,TWM,Jeanne Hyde
6/30/18,2018,6,8:00,18C,123,Orca,,Ts,,T49As,Other,TWM,Jeanne Hyde
6/23/18,2018,6,,18C,123,Orca,,Ts,,,Other,TWM,Jeanne Hyde
6/16/18,2018,6,11:00,18C,123,Orca,3,Ts,,,Other,TWM,Jeanne Hyde
6/3/18,2018,6,16:30,18C,123,Orca,,Ts,,"T49As, T65As",Other,TWM,Jeanne Hyde
6/1/18,2018,6,15:30,18C,123,Orca,,Ts,,"T101s, T86As (not A1), T124A2",Other,TWM,Jeanne Hyde
6/28/18,2018,6,,18C,123,Orca,,JLp,,,Other,TWM,Jeanne Hyde
6/19/18,2018,6,21:30,18C,123,Orca,,L,,,Other,TWM,Jeanne Hyde
5/24/18,2018,5,,18C,123,Orca,,Ts,,T101s,Other,TWM,Jeanne Hyde
5/22/18,2018,5,15:00,18C,123,Orca,,Ts,,T123s,Other,TWM,Jeanne Hyde
5/10/18,2018,5,11:00,18C,123,Orca,,Ts,,no ids,Other,TWM,Jeanne Hyde
5/9/18,2018,5,11:00,18C,123,Orca,,Ts,,T63 and three females - through Active and NW then turned south at SE at 1600,Other,TWM,Jeanne Hyde
5/7/18,2018,5,,18C,123,Orca,,Ts,,mid day. T101s,Other,TWM,Jeanne Hyde
4/16/18,2018,4,,18C,123,Orca,,Ts,,T49As T65As,Other,TWM,Jeanne Hyde
4/16/18,2018,4,,18C,123,Orca,,Ts,,T49As T65As,Other,TWM,Jeanne Hyde
4/4/18,2018,4,,18C,123,Orca,2,Ts,,"Two males - likely T49A1 and T124C, not confirmed",Other,TWM,Jeanne Hyde
3/24/18,2018,3,18:30,18C,123,Orca,,J,,,Other,TWM,Jeanne Hyde
3/7/18,2018,3,,18C,123,Orca,,JpKp,,"photos by CWR. Spread out, small groups",Other,TWM,Jeanne Hyde
3/4/18,2018,3,11:00,18C,123,Orca,,JK,,"J, K, L87",Other,TWM,Jeanne Hyde
9/14/18,2018,9,8:00,18C,123,Orca,,SRs,JKLp,Active search for J-50,Other,Reliable,J50 Core Team
9/10/18,2018,9,10:20,18C,123,Orca,30+,SRs?,JLp,No confirmed sightings of J-50. Whale watch operator reports sighting but with no photos,Other,Reliable,J50 Core Team
8/10/18,2018,8,,18C,123,Orca,,J,,J50 spotted by researchers,Other,TWM,J50 Core Team
5/24/18,2018,5,,18C,123,Orca,,Ts,,T101s,Hotline,Reliable,SW
3/24/18,2018,3,18:00,18C,123,Orca,,J,,J Pod & L87,Orca Network,Public,Jeff Friedman
3/15/18,2018,3,7:50,18C,123,Orca,12,,,Unidentified,Orca Network,Public,Reuben Buerge
3/7/18,2018,3,16:16,18C,123,Orca,5,JK,,"J Pod, L87, Possible K's",Orca Network,Public,Yves Tiberghien
3/5/18,2018,3,15:45,18C,123,Orca,7-Jun,,Ts,Unidentified (Likely T46s based on other reports - JKO),Orca Network,Public,Brook Speed
3/4/18,2018,3,,18C,123,Orca,,SRs,JK,SRKW,Orca Network,Reliable,Jill Hein
4/29/17,2017,4,14:30,18C,123,Orca,,Ts,,Possible T102,Orca Network,Public,Yves Tiberghien
4/2/17,2017,4,,18C,123,Orca,,Ts,,T99s,Other,WW,Western Prince
5/30/17,2017,5,15:30,18C,123,Orca,,Ts,,T124As - maybe 124Ds but not sure,Other,WW,Western Prince
1/23/18,2018,1,,18C,123,Orca,,J,,from ON report,Orca Network,TWM,Jeanne Hyde
1/23/18,2018,1,14:30,18C,123,Orca,,J,,,Orca Network,Public,Yves Tiberghien
9/24/17,2017,9,,18C,123,Orca,,Ts,,"T65As, T137s, T36Bs - ahead of residents, swithced to trincomali",Other,TWM,Jeanne Hyde
9/13/17,2017,9,10:30,18C,123,Orca,,Ts,,T18s,Other,TWM,Jeanne Hyde
1/1/18,2018,1,16:00,18C,123,Orca,,Ts,,,Orca Network,Reliable,Karoline Cullen
1/1/18,2018,1,11:00,18C,123,Orca,,Ts,,"T36As, T36Bs, T137s and possibly T99s.",Orca Network,Reliable,Karoline Cullen
12/23/17,2017,12,11:00,18C,123,Orca,,,,"seems too soon for J Pod to have made it up
there.  ???  So no confirmation as to who.",Other,TWM,Jeanne Hyde
12/15/17,2017,12,8:30,18C,123,Orca,1,Ts,,one - seen from ferry - not known if others present,Other,Public,Jeanne Hyde
11/6/17,2017,11,14:00,18C,123,Orca,,Ts,,"T49As with a new calf, minus T49A1",Other,TWM,Jeanne Hyde
11/6/17,2017,11,,18C,123,Orca,,Ts,,T2Cs,Other,TWM,Jeanne Hyde
9/20/17,2017,9,10:08,18C,123,Orca,40,JpL,,No J16s,Other,WW,Prince Of Whales
8/3/17,2017,8,17:28,18C,123,Orca,11,Ts,,T18/T34/T37B,Other,WW,Prince Of Whales
12/23/17,2017,12,10:45,18C,123,Orca,3,,,,Orca Network,Public,Amaryllis Chang
10/3/17,2017,10,,18C,123,Orca,,Ts,,"T100s, and ahead of them T101s",Other,TWM,Jeanne Hyde
10/3/17,2017,10,8:00,18C,123,Orca,,Ts,,T100s,Orca Network,Reliable,James Mead Maya
9/24/17,2017,9,12:00,18C,123,Orca,,JL,,,Other,TWM,Jeanne Hyde
9/11/17,2017,9,11:00,18C,123,Orca,,Lp,,L4s,Other,TWM,Jeanne Hyde
8/31/17,2017,8,11:00,18C,123,Orca,,Ts,,T36As and T18s,Other,TWM,Jeanne Hyde
8/1/17,2017,8,20:40,18C,123,Orca,,Ts,,"T37, T37As, and Bs, T34s",Other,TWM,Jeanne Hyde
7/9/17,2017,7,,18C,123,Orca,,Ts,,T49As,Other,TWM,Jeanne Hyde
6/16/17,2017,6,,18C,123,Orca,,Ts,,T137s,Other,TWM,Jeanne Hyde
6/12/17,2017,6,19:30,18C,123,Orca,,Ts,,T2Cs - -Andrews Bay-Up-Kellett then down and across to D'Arcy and up through CA Islands/Swartz Bay,Other,TWM,Jeanne Hyde
6/4/17,2017,6,13:30,18C,123,Orca,,Ts,,T65As,Other,TWM,Jeanne Hyde
5/20/17,2017,5,8:00,18C,123,Orca,,Ts,,,Other,TWM,Jeanne Hyde
8/15/17,2017,8,17:45,18C,123,Orca,3,Ts,,,Orca Network,Public,Erin Campbell
8/3/17,2017,8,14:13,18C,123,Orca,3,,Ts,,Orca Network,Public,Madison
6/12/17,2017,6,,18C,123,Orca,,L,,PM Sighting.,Orca Network,Reliable,Mark Malleson
6/10/17,2017,6,9:00,18C,123,Orca,,Ts,,,Orca Network,Public,Yves Tiberghien
10/24/17,2017,10,12:14,18C,123,Orca,10-Jul,SRs,,,Other,WW,Wild Whales Vancouver
7/21/17,2017,7,14:20,18C,123,Orca,5-Apr,Ts,,T37As,Other,WW,Wild Whales Vancouver
7/21/17,2017,7,13:15,18C,123,Orca,4,Ts,,T37As,Other,WW,Wild Whales Vancouver
6/22/17,2017,6,11:55,18C,123,Orca,5,Ts,,T65As,Other,WW,Wild Whales Vancouver
4/9/17,2017,4,13:00,18C,123,Orca,4,Ts,,"T018, T019s",Other,WW,Wild Whales Vancouver
4/23/17,2017,4,,18C,123,Orca,,Ts,,,Other,TWM,Jeanne Hyde
4/2/17,2017,4,,18C,123,Orca,,Ts,,"T99s, T36As",Other,TWM,Jeanne Hyde
7/21/17,2017,7,13:06,18C,123,Orca,,Ts,,T37As,Other,WW,San Juan Clipper
2/24/17,2017,2,9:00,18C,123,Orca,,Ts,,,Other,TWM,Jeanne Hyde
2/22/17,2017,2,14:00,18C,123,Orca,,Ts,,T18s,Other,TWM,Jeanne Hyde
2/18/17,2017,2,9:45,18C,123,Orca,,,,no confirmation as to who,Other,TWM,Jeanne Hyde
4/9/17,2017,4,13:45,18C,123,Orca,4,Ts,,"T18, T19, T19B, T19C",Orca Network,Reliable,Marcie Barney Goldberg
4/2/17,2017,4,,18C,123,Orca,many,Ts,,T99s and T36As,Orca Network,Reliable,Sara Hysong-Shimazu
4/2/17,2017,4,,18C,123,Orca,many,Ts,,T36As and T99s,Orca Network,Reliable,Traci Walter
3/15/17,2017,3,15:37,18C,123,Orca,13,,,"At least 2 big males, 10 or so females and a baby",Orca Network,Public,Jeff McPherson
1/28/17,2017,1,8:30,18C,123,Orca,10,,,,Orca Network,Public,Brook Speed
8/19/22,2022,8,10:02,29C,124,Orca,1,,T,,Orca Network,Public,Bren
12/27/22,2022,12,12:46,29C,124,Orca,,J,,,BCCSN,Reliable,
11/18/22,2022,11,11:09,29C,124,Orca,,J,,,BCCSN,Reliable,
11/4/22,2022,11,14:18,29C,124,Orca,,JKL,,,BCCSN,Reliable,
9/3/22,2022,9,12:29,29C,124,Orca,,J,,,BCCSN,Reliable,
7/24/22,2022,7,14:32,29C,124,Orca,,J,,,BCCSN,Reliable,
7/24/22,2022,7,14:54,29C,124,Orca,,J,,,Other,Soundwatch,
7/24/22,2022,7,14:32,29C,124,Orca,,J,,,Other,Soundwatch,
7/13/22,2022,7,11:52,29C,124,Orca,,JKL,,,BCCSN,Reliable,
7/12/22,2022,7,10:44,29C,124,Orca,,JKL,,,BCCSN,Reliable,
4/13/22,2022,4,11:16,29C,124,Orca,,J,,,BCCSN,Reliable,
3/28/22,2022,3,13:53,29C,124,Orca,,J,,,BCCSN,Reliable,
12/27/22,2022,12,12:46,29C,124,Orca,,J,,,BCCSN,Reliable,
11/18/22,2022,11,11:09,29C,124,Orca,,J,,,BCCSN,Reliable,
11/4/22,2022,11,14:18,29C,124,Orca,,JKL,,,BCCSN,Reliable,
9/3/22,2022,9,12:29,29C,124,Orca,,J,,,BCCSN,Reliable,
7/24/22,2022,7,14:32,29C,124,Orca,,J,,,BCCSN,Reliable,
7/24/22,2022,7,14:54,29C,124,Orca,,J,,,Other,Soundwatch,
7/24/22,2022,7,14:32,29C,124,Orca,,J,,,Other,Soundwatch,
7/13/22,2022,7,11:52,29C,124,Orca,,JKL,,,BCCSN,Reliable,
7/12/22,2022,7,10:44,29C,124,Orca,,JKL,,,BCCSN,Reliable,
4/13/22,2022,4,11:16,29C,124,Orca,,J,,,BCCSN,Reliable,
3/28/22,2022,3,13:53,29C,124,Orca,,J,,,BCCSN,Reliable,
12/27/22,2022,12,12:46,29C,124,Orca,,J,,,BCCSN,Reliable,
11/18/22,2022,11,11:09,29C,124,Orca,,J,,,BCCSN,Reliable,
11/4/22,2022,11,14:18,29C,124,Orca,,JKL,,,BCCSN,Reliable,
9/3/22,2022,9,12:29,29C,124,Orca,,J,,,BCCSN,Reliable,
7/24/22,2022,7,14:32,29C,124,Orca,,J,,,BCCSN,Reliable,
7/24/22,2022,7,14:54,29C,124,Orca,,J,,,Other,Soundwatch,
7/24/22,2022,7,14:32,29C,124,Orca,,J,,,Other,Soundwatch,
7/13/22,2022,7,11:52,29C,124,Orca,,JKL,,,BCCSN,Reliable,
7/12/22,2022,7,10:44,29C,124,Orca,,JKL,,,BCCSN,Reliable,
4/13/22,2022,4,11:16,29C,124,Orca,,J,,,BCCSN,Reliable,
3/28/22,2022,3,13:53,29C,124,Orca,,J,,,BCCSN,Reliable,
12/27/22,2022,12,12:46,29C,124,Orca,,J,,,BCCSN,Reliable,
11/18/22,2022,11,11:09,29C,124,Orca,,J,,,BCCSN,Reliable,
11/4/22,2022,11,14:18,29C,124,Orca,,JKL,,,BCCSN,Reliable,
9/3/22,2022,9,12:29,29C,124,Orca,,J,,,BCCSN,Reliable,
7/24/22,2022,7,14:32,29C,124,Orca,,J,,,BCCSN,Reliable,
7/24/22,2022,7,14:54,29C,124,Orca,,J,,,Other,Soundwatch,
7/24/22,2022,7,14:32,29C,124,Orca,,J,,,Other,Soundwatch,
7/13/22,2022,7,11:52,29C,124,Orca,,JKL,,,BCCSN,Reliable,
7/12/22,2022,7,10:44,29C,124,Orca,,JKL,,,BCCSN,Reliable,
4/13/22,2022,4,11:16,29C,124,Orca,,J,,,BCCSN,Reliable,
3/28/22,2022,3,13:53,29C,124,Orca,,J,,,BCCSN,Reliable,
12/27/22,2022,12,12:46,29C,124,Orca,,J,,,BCCSN,Reliable,
11/18/22,2022,11,11:09,29C,124,Orca,,J,,,BCCSN,Reliable,
11/4/22,2022,11,14:18,29C,124,Orca,,JKL,,,BCCSN,Reliable,
9/3/22,2022,9,12:29,29C,124,Orca,,J,,,BCCSN,Reliable,
7/24/22,2022,7,14:32,29C,124,Orca,,J,,,BCCSN,Reliable,
7/24/22,2022,7,14:54,29C,124,Orca,,J,,,Other,Soundwatch,
7/24/22,2022,7,14:32,29C,124,Orca,,J,,,Other,Soundwatch,
7/13/22,2022,7,11:52,29C,124,Orca,,JKL,,,BCCSN,Reliable,
7/12/22,2022,7,10:44,29C,124,Orca,,JKL,,,BCCSN,Reliable,
4/13/22,2022,4,11:16,29C,124,Orca,,J,,,BCCSN,Reliable,
3/28/22,2022,3,13:53,29C,124,Orca,,J,,,BCCSN,Reliable,
12/27/22,2022,12,12:46,29C,124,Orca,,J,,,BCCSN,Reliable,
11/18/22,2022,11,11:09,29C,124,Orca,,J,,,BCCSN,Reliable,
11/4/22,2022,11,14:18,29C,124,Orca,,JKL,,,BCCSN,Reliable,
9/3/22,2022,9,12:29,29C,124,Orca,,J,,,BCCSN,Reliable,
7/24/22,2022,7,14:32,29C,124,Orca,,J,,,BCCSN,Reliable,
7/24/22,2022,7,14:54,29C,124,Orca,,J,,,Other,Soundwatch,
7/24/22,2022,7,14:32,29C,124,Orca,,J,,,Other,Soundwatch,
7/13/22,2022,7,11:52,29C,124,Orca,,JKL,,,BCCSN,Reliable,
7/12/22,2022,7,10:44,29C,124,Orca,,JKL,,,BCCSN,Reliable,
4/13/22,2022,4,11:16,29C,124,Orca,,J,,,BCCSN,Reliable,
3/28/22,2022,3,13:53,29C,124,Orca,,J,,,BCCSN,Reliable,
12/27/22,2022,12,12:46,29C,124,Orca,,J,,,BCCSN,Reliable,
12/27/22,2022,12,12:46,29C,124,Orca,,J,,,BCCSN,Reliable,
12/27/22,2022,12,12:46,29C,124,Orca,,J,,,BCCSN,Reliable,
11/18/22,2022,11,11:09,29C,124,Orca,,J,,,BCCSN,Reliable,
11/18/22,2022,11,11:09,29C,124,Orca,,J,,,BCCSN,Reliable,
11/18/22,2022,11,11:09,29C,124,Orca,,J,,,BCCSN,Reliable,
11/4/22,2022,11,14:18,29C,124,Orca,,JKL,,,BCCSN,Reliable,
11/4/22,2022,11,14:18,29C,124,Orca,,JKL,,,BCCSN,Reliable,
11/4/22,2022,11,14:18,29C,124,Orca,,JKL,,,BCCSN,Reliable,
9/3/22,2022,9,12:29,29C,124,Orca,,J,,,BCCSN,Reliable,
9/3/22,2022,9,12:29,29C,124,Orca,,J,,,BCCSN,Reliable,
9/3/22,2022,9,12:29,29C,124,Orca,,J,,,BCCSN,Reliable,
7/24/22,2022,7,14:32,29C,124,Orca,,J,,,BCCSN,Reliable,
7/24/22,2022,7,14:32,29C,124,Orca,,J,,,BCCSN,Reliable,
7/24/22,2022,7,14:32,29C,124,Orca,,J,,,BCCSN,Reliable,
7/24/22,2022,7,14:54,29C,124,Orca,,J,,,Other,Soundwatch,
7/24/22,2022,7,14:54,29C,124,Orca,,J,,,Other,Soundwatch,
7/24/22,2022,7,14:54,29C,124,Orca,,J,,,Other,Soundwatch,
7/24/22,2022,7,14:32,29C,124,Orca,,J,,,Other,Soundwatch,
7/24/22,2022,7,14:32,29C,124,Orca,,J,,,Other,Soundwatch,
7/24/22,2022,7,14:32,29C,124,Orca,,J,,,Other,Soundwatch,
7/13/22,2022,7,11:52,29C,124,Orca,,JKL,,,BCCSN,Reliable,
7/13/22,2022,7,11:52,29C,124,Orca,,JKL,,,BCCSN,Reliable,
7/13/22,2022,7,11:52,29C,124,Orca,,JKL,,,BCCSN,Reliable,
7/12/22,2022,7,10:44,29C,124,Orca,,JKL,,,BCCSN,Reliable,
7/12/22,2022,7,10:44,29C,124,Orca,,JKL,,,BCCSN,Reliable,
7/12/22,2022,7,10:44,29C,124,Orca,,JKL,,,BCCSN,Reliable,
4/13/22,2022,4,11:16,29C,124,Orca,,J,,,BCCSN,Reliable,
4/13/22,2022,4,11:16,29C,124,Orca,,J,,,BCCSN,Reliable,
4/13/22,2022,4,11:16,29C,124,Orca,,J,,,BCCSN,Reliable,
3/28/22,2022,3,13:53,29C,124,Orca,,J,,,BCCSN,Reliable,
3/28/22,2022,3,13:53,29C,124,Orca,,J,,,BCCSN,Reliable,
3/28/22,2022,3,13:53,29C,124,Orca,,J,,,BCCSN,Reliable,
12/27/22,2022,12,12:45,29C,124,Orca,,J,,,Orca Network,Public,Eric Eisenhardt vis Salish Sea Orca Squad
5/8/22,2022,5,10:33,29C,124,Orca,4,,T,,Orca Network,Public,Jonathan Hunter WAA
4/30/22,2022,4,18:00,29C,124,Orca,50,T,,"IDs: T23s, T23Ds, T34s, T37, T37Bs, T49As, T65Bs, T75Bs, T87, T100s, T101s, T124C, T137s",Orca Network,Reliable,Karoline Cullen
4/30/22,2022,4,17:00,29C,124,Orca,40,T,,"IDs: T023, T23Ds, T34s, T36, T36Bs, T37, T37Bs, T49As, T65Bs, T75Bs, T87, T100Bs, T101s, T124C, T137s",Orca Network,Reliable,Pacific Whale Watch Assoc
3/31/22,2022,3,22:21,29C,124,Orca,4,T,,IDs: T137s,Orca Network,Reliable,Rachelle Hayden
3/29/22,2022,3,19:34,29C,124,Orca,4,T,,IDs: T137s,Orca Network,Reliable,Rachelle Hayden
3/27/22,2022,3,10:07,29C,124,Orca,7,T,,"IDs: T49As minus T49A2, T49Bs",Orca Network,Reliable,Rachelle Hayden
3/25/22,2022,3,15:00,29C,124,Orca,4,T,,IDs: T137s,Orca Network,Public,Stephanie Held
2/26/22,2022,2,14:14,29C,124,Orca,4,T,,IDs: T137s,Orca Network,Public,Rachelle Hayden
1/9/22,2022,1,12:00,29C,124,Orca,5,T,,IDs: T060C and T002B,Orca Network,Reliable,Karoline Cullen
4/7/21,2021,4,11:00,29C,124,Orca,24,J,,,Other,TWM,Jeanne Hyde
3/8/21,2021,3,16:00,29C,124,Orca,24,J,,,Other,TWM,Jeanne Hyde
9/9/21,2021,9,7:06,29C,124,Orca,,J,,,Orca Network,Public,Rachelle Hayden
11/30/21,2021,11,12:44,29C,124,Orca,2,J,,J27 Present,Orca Network,Reliable,Rachelle Hayden
8/29/21,2021,8,17:21,29C,124,Orca,2,T,,,Orca Network,Public,Johnathon
4/26/21,2021,4,14:24,29C,124,Orca,5,T,,"IDs: T49As minus T49A2, T49A3. T123s",Orca Network,CWR,Mark
2/23/21,2021,2,8:40,29C,124,Orca,8,,L,"Beh:Fast moving,Breaching",BCCSN,Reliable,
8/9/21,2021,8,9:39,29C,124,Orca,3,,T,Beh:Slow moving,BCCSN,Public,
11/9/20,2020,11,7:00,29C,124,Orca,,J,,possibly K included,Orca Network,Public,Rachelle Hayden
4/16/20,2020,4,19:45,29C,124,Orca,,J,,Southern Residents IDs: J Pod,Orca Network,Public,Rachelle Hayden
7/16/19,2019,7,12:26,29C,124,Orca,4,T101s,,,Other,Soundwatch,
11/21/19,2019,11,15:00,29C,124,Orca,,J,,,Other,TWM,Jeanne Hyde
6/14/20,2020,6,14:00,29C,124,Orca,7,T,,"T123s, T46B1s",Other,TWM,Jeanne Hyde
5/21/20,2020,5,16:00,29C,124,Orca,,T,,T124As,Other,TWM,Jeanne Hyde
4/9/20,2020,4,16:00,29C,124,Orca,22,J,,,Other,TWM,Jeanne Hyde
11/10/20,2020,11,15:40,29C,124,Orca,,"Jp, Kp",,,Other,TWM,Jeanne Hyde
2/20/20,2020,2,11:00,29C,124,Orca,22,J,,,Other,TWM,Jeanne Hyde
7/10/19,2019,7,16:00,29C,124,Orca,6,T,,"T065A. T065A2, T065A3, T065A4, T065A5, T065A6",Orca Network,Reliable,Karoline Cullen
4/25/19,2019,4,,29C,124,Orca,8,Ts,,"T87, T90's, T124A2's. Ocean EcoVentures WW",Orca Network,WW,Gary Sutton
4/16/19,2019,4,19:30,29C,124,Orca,4,Ts,,"T49A's. Hunting behavior seen near sea lions on Galiano, a lot of surface activity.  Traveled around Mary Ann Point around 20:00.",Orca Network,Public,Karoline Cullen
4/16/19,2019,4,10:53,29C,124,Orca,4,Ts,,T36A's on a sea lion kill,Orca Network,Reliable,Monika Weiland Shields
4/4/19,2019,4,,29C,124,Orca,11,Ts,,"T18's, T49A's. Surface activity and socializing. No exact time or location.  T123's seen by tour with no specifics.",Orca Network,WW,Ocean EcoVentures WW
3/28/19,2019,3,13:30,29C,124,Orca,5,,,"Unknown, 1 male, 3 female, 1 calf/juv. 50 meters from shore.                        48.976058/-123.570571",Orca Network,Public,Matteo K
7/16/19,2019,7,15:00,29C,124,Orca,4,T,,T046s,Other,Reliable,Jeanne Hyde
7/11/19,2019,7,18:00,29C,124,Orca,1,,,,Other,Reliable,Jeanne Hyde
7/3/19,2019,7,10:00,29C,124,Orca,,,,,Other,Reliable,Jeanne Hyde
6/25/19,2019,6,19:30,29C,124,Orca,9,Ts,,T65As and T65Bs,Other,Reliable,Jeanne Hyde
6/23/19,2019,6,15:00,29C,124,Orca,6,Ts,,,Other,Reliable,Jeanne Hyde
6/22/19,2019,6,13:00,29C,124,Orca,1,Ts,,T124C,Other,Reliable,Jeanne Hyde
4/11/19,2019,4,11:45,29C,124,Orca,5,Ts,,T49As,Email,Reliable,Jeanne Hyde
8/18/19,2019,8,13:35,29C,124,Orca,6,Ts,,T49s,Email,WW,Vancouver Island WW Co
8/17/19,2019,8,18:11,29C,124,Orca,,Ts,,"T46Bs, T46s",Email,WW,Vancouver Island WW Co
8/6/19,2019,8,11:43,29C,124,Orca,4,Ts,,T18s,Email,WW,Vancouver Island WW Co
7/31/19,2019,7,12:49,29C,124,Orca,5,Ts,,T65As minus T65A2,Email,WW,Vancouver Island WW Co
7/25/19,2019,7,12:14,29C,124,Orca,6,Ts,,T124As,Email,WW,Vancouver Island WW Co
7/16/19,2019,7,12:09,29C,124,Orca,5,Ts,,T46s,Email,WW,Vancouver Island WW Co
7/3/19,2019,7,16:40,29C,124,Orca,13,Ts,,"T36As, T65As, T37s, T124s",Email,WW,Vancouver Island WW Co
6/25/19,2019,6,11:30,29C,124,Orca,4,Ts,,"T124C, T124A2s",Email,WW,Vancouver Island WW Co
6/21/19,2019,6,11:40,29C,124,Orca,15,Ts,,"T36As, T65As, T124As, T77A",Email,Reliable,"T36As, T65As, T124As, T77A"
6/7/19,2019,6,14:10,29C,124,Orca,6,Ts,,"T65Bs, T137s",Email,WW,Vancouver Island WW Co
5/3/19,2019,5,13:00,29C,124,Orca,21,Ts,,"T101s, T99s, T86s, T36As, T36, T36Bs, T137s, T18s, T87, T124C",Email,WW,Vancouver Island WW Co
10/19/19,2019,10,16:30,29C,124,Orca,,Ts,,T49As,Email,Reliable,Jeanne Hyde
12/2/18,2018,12,,29C,124,Orca,,JKL,,late in day,Other,TWM,Jeanne Hyde
8/21/18,2018,8,12:00,29C,124,Orca,,Ts,,T65As,Other,WW,Western Prince
6/3/18,2018,6,13:40,29C,124,Orca,,Ts,,"T6As, T49As",Other,WW,Western Prince
9/3/18,2018,9,19:30,29C,124,Orca,45,JL,,"J pod, L87, L12s, 15 other Ls.",Other,TWM,Jeanne Hyde
7/29/18,2018,7,20:00,29C,124,Orca,24,J,,heading north into Strait of Georgia from Active,Other,TWM,Jeanne Hyde
8/10/18,2018,8,10:30,29C,124,Orca,,J,,"Widely spread out, in small groups, J50 (Scarlet) travelling alone (about 10 minutes behind)",Orca Network,Public,Gary Cullen
8/10/18,2018,8,9:50,29C,124,Orca,18+,J,,,Orca Network,Public,Marielle Smith  
7/21/18,2018,7,15:51,29C,124,Orca,6-May,Ts,,Unknown,Other,WW,Wild Whales Vancouver
7/15/18,2018,7,17:00,29C,124,Orca,4,Ts,,T124A's,Other,WW,Wild Whales Vancouver
7/15/18,2018,7,17:26,29C,124,Orca,~5,Ts,,Unknown,Other,WW,Wild Whales Vancouver
7/6/18,2018,7,16:45,29C,124,Orca,1,Ts,,T124As,Other,WW,Wild Whales Vancouver
6/23/18,2018,6,11:53,29C,124,Orca,6,Ts,,T37's and T37A's,Other,WW,Wild Whales Vancouver
6/13/18,2018,6,14:00,29C,124,Orca,,Ts,,"Bigg's - almost existed Pass, turned to Miner's Bay, along shore of Mayne Island, turned and went E",Orca Network,Reliable,Karoline Cullen
6/8/18,2018,6,19:15,29C,124,Orca,,Ts,,"T34s, T37, T37Bs, T100s, T101s, T86As",Other,TWM,Jeanne Hyde
5/27/18,2018,5,14:00,29C,124,Orca,,Ts,,T86As T124A2s,Other,TWM,Jeanne Hyde
5/24/18,2018,5,10:30,29C,124,Orca,,Ts,,T101s,Other,TWM,Jeanne Hyde
4/17/18,2018,4,17:00,29C,124,Orca,,Ts,,T49As (assuming A),Other,TWM,Jeanne Hyde
9/1/18,2018,9,,29C,124,Orca,,J,,J-50 NOT SEEN,Other,Reliable,J50 Core Team
12/23/17,2017,12,10:45,29C,124,Orca,3,,,,Orca Network,Public,Amaryllis Chang
9/24/17,2017,9,13:00,29C,124,Orca,,JK,,Social behavior and travel,Other,WW,Western Prince
9/28/17,2017,9,8:30,29C,124,Orca,,Ts,,T100s minus B2s,Other,TWM,Jeanne Hyde
9/14/17,2017,9,13:00,29C,124,Orca,2,Ts,,,Other,TWM,Jeanne Hyde
5/30/17,2017,5,17:50,29C,124,Orca,15,J,,"Quickly down the Galiano shoreline, initially thought they were transients",Other,WW,Prince Of Whales
4/29/17,2017,4,12:30,29C,124,Orca,25,Ts,,T11/T86A/T100/T101/T124A/T124D - new calves T124A6 and T124Ab,Other,WW,Prince Of Whales
7/7/17,2017,7,,29C,124,Orca,,Ts,,,Other,TWM,Jeanne Hyde
6/19/17,2017,6,,29C,124,Orca,,Ts,,"T36As and T65Bs, T101s",Other,TWM,Jeanne Hyde
5/17/17,2017,5,,29C,124,Orca,,Ts,,T137s,Other,TWM,Jeanne Hyde
8/23/17,2017,8,,29C,124,Orca,,Ts,,T137s hunting along shoreline.  Evening sighting.,Orca Network,Reliable,Gary Sutton
9/11/17,2017,9,11:30,29C,124,Orca,9,Lp,,L4s,Other,WW,Wild Whales Vancouver
9/11/17,2017,9,11:00,29C,124,Orca,8,Lp,,L4s,Other,WW,Wild Whales Vancouver
8/31/17,2017,8,10:40,29C,124,Orca,5-Apr,Ts,,T36As and maybe T37A1,Other,WW,Wild Whales Vancouver
8/26/17,2017,8,11:32,29C,124,Orca,5,Ts,,T37,Other,WW,Wild Whales Vancouver
8/26/17,2017,8,11:31,29C,124,Orca,8-Jun,Ts,,"T36s, T37s",Other,WW,Wild Whales Vancouver
8/3/17,2017,8,16:45,29C,124,Orca,8,Ts,,T37As,Other,WW,Wild Whales Vancouver
7/7/17,2017,7,12:34,29C,124,Orca,5,Ts,,"T37As, T51",Other,WW,Wild Whales Vancouver
7/7/17,2017,7,12:41,29C,124,Orca,5,Ts,,"T37As, T51",Other,WW,Wild Whales Vancouver
7/6/17,2017,7,16:39,29C,124,Orca,4,Ts,,T49As,Other,WW,Wild Whales Vancouver
6/9/17,2017,6,16:33,29C,124,Orca,11-Sep,Ts,,,Other,WW,Wild Whales Vancouver
6/3/17,2017,6,13:41,29C,124,Orca,4,Ts,,T65As,Other,WW,Wild Whales Vancouver
4/2/17,2017,4,,29C,124,Orca,,Ts,,T18s,Other,TWM,Jeanne Hyde
3/21/17,2017,3,12:00,29C,124,Orca,,Ts,,T123s,Other,TWM,Jeanne Hyde
8/23/17,2017,8,14:00,29C,124,Orca,,Ts,,T137's,Other,WW,Orcas Express
3/21/17,2017,3,,29C,124,Orca,,Ts,,T123A,Orca Network,Reliable,Mark Malleson
9/3/22,2022,9,10:45,18C,125,Orca,,J,,,BCCSN,Reliable,
3/7/22,2022,3,9:00,18C,125,Orca,,J,,,BCCSN,Reliable,
7/1/18,2018,7,13:39,18C,125,Orca,,Ts,,"T36As, T49As",Other,WW,San Juan Clipper
9/3/17,2017,9,9:00,18C,125,Orca,10-Aug,Ts,,"T18s, T65As, and T100s",Other,TWM,Jeanne Hyde
7/1/17,2017,7,10:25,18C,125,Orca,7,Ts,,T65A/T75B,Other,WW,Prince Of Whales
8/26/17,2017,8,11:00,18C,125,Orca,5,Ts,,,Other,WW,Wild Whales Vancouver
8/4/18,2018,8,12:06,18C,126,Orca,8,Ts,,T137's and T46's,Other,WW,Wild Whales Vancouver
5/24/22,2022,5,13:53,7,127,Orca,,J,,,Other,Soundwatch,
9/1/21,2021,9,18:04,7,127,Orca,15,,J,"Beh:Slow moving,Spy-hopping,Fast moving,Breaching",BCCSN,Reliable,
6/29/19,2019,6,15:29,7,127,Orca,6,T046s; T04,,Behavior: 9 breaches; 2 tail slaps; 2 pec slaps,Other,Soundwatch,
9/15/18,2018,9,12:54,7,127,Orca,~10,K,,K37 + J's,Other,WW,Wild Whales Vancouver
6/12/18,2018,6,17:00,7,127,Orca,,Ts,,"T34s, T37, T37Bs",Other,TWM,Jeanne Hyde
4/20/18,2018,4,16:00,7,127,Orca,,Ts,,T100s,Other,TWM,Jeanne Hyde
5/29/17,2017,5,12:30,7,127,Orca,20,Ts,,"T87, T90s, T124As",Other,WW,Wild Whales Vancouver
8/14/17,2017,8,13:00,7,127,Orca,,Ts,,"T51, T122, T46's",Other,WW,Orcas Express
4/29/17,2017,4,14:30,7,127,Orca,20-25,Ts,,,Other,WW,Orcas Express
7/23/22,2022,7,11:34,7,128,Orca,,J,,,BCCSN,Reliable,
7/23/22,2022,7,11:13,7,128,Orca,,J,,,BCCSN,Reliable,
7/23/22,2022,7,11:58,7,128,Orca,,J,,,Other,Soundwatch,
7/23/22,2022,7,11:34,7,128,Orca,,J,,,Other,Soundwatch,
9/5/21,2021,9,13:59,7,128,Orca,24,,J,,Other,Soundwatch,
8/5/21,2021,8,13:27,7,128,Orca,7,T,,,Other,Soundwatch,
9/5/21,2021,9,13:35,7,128,Orca,20,,J,Beh:Slow moving,BCCSN,Reliable,
8/20/19,2019,8,13:28,7,128,Orca,18,J,,,Other,Soundwatch,
7/25/19,2019,7,13:27,7,128,Orca,2,T077C; T07,,,Other,Soundwatch,
6/29/19,2019,6,14:30,7,128,Orca,6,T046s; T46,,Behavior: 3 tail slaps,Other,Soundwatch,
6/29/19,2019,6,13:02,7,128,Orca,6,T046s; T04,,Behavior: 3 breaches; 2 tail slaps; 1  spyhop,Other,Soundwatch,
6/29/19,2019,6,13:58,7,128,Orca,6,T046s; T46,,Behavior: 2 breaches; 2 tail slaps; 2 pec slaps,Other,Soundwatch,
8/5/21,2021,8,12:59,7,129,Orca,7,T,,,Other,Soundwatch,
9/20/20,2020,9,13:29,7,129,Orca,3,T065Bs,,,Other,Soundwatch,
7/1/19,2019,7,15:00,7,129,Orca,5,T065As,,,Other,Soundwatch,
6/23/19,2019,6,11:57,7,129,Orca,10,T065As; T0,,Behavior: 1 tail slap,Other,Soundwatch,
7/27/17,2017,7,12:57,7,130,Orca,7,Ts,,"T37, T37Bs, T34s",Other,WW,Wild Whales Vancouver
7/16/18,2018,7,16:51,7,131,Orca,11+,Jp,,"J16's, J17's, J19's",Other,WW,Wild Whales Vancouver
8/2/19,2019,8,,7,132,Orca,6,Ts,,"T65A's, afternoon sighting.",Orca Network,Public,Janine Harles
7/8/19,2019,7,20:30,7,132,Orca,6,T,,T065As,Other,Reliable,Jeanne Hyde
11/5/18,2018,11,12:00,7,132,Orca,,Ts,,"adult male, mom with baby, at least one other juvenile. T123s",Other,TWM,Jeanne Hyde
7/5/17,2017,7,16:00,7,132,Orca,,Ts,,T37As and T51 traveling and resting.,Other,WW,Western Prince
7/25/17,2017,7,,7,132,Orca,,J,,Js and L87,Other,TWM,Jeanne Hyde
4/20/17,2017,4,,7,133,Orca,,Ts,,"T99s, T36As",Other,TWM,Jeanne Hyde
7/27/17,2017,7,13:00,7,133,Orca,10,Ts,,"T37, T37As,T37B, possibly T109",Other,WW,San Juan Clipper
7/1/19,2019,7,14:32,7,134,Orca,6,T065As,,,Other,Soundwatch,
6/25/18,2018,6,13:50,7,134,Orca,10-Sep,Ts,,T65A's + T49A's  (T049A1 may have been there),Other,WW,Wild Whales Vancouver
8/14/17,2017,8,13:00,7,134,Orca,5,Ts,,T46s,Other,WW,Wild Whales Vancouver
7/27/17,2017,7,13:00,7,134,Orca,10,Ts,,"T37, T37As,T37B, possibly T109",Other,WW,San Juan Clipper
7/10/22,2022,7,8:39,7,135,Orca,,JKL,,,BCCSN,Reliable,
8/5/21,2021,8,12:28,7,135,Orca,7,T,,"137A, 36A2+3",Other,Soundwatch,
9/20/20,2020,9,13:21,7,135,Orca,4,T065Bs,,,Other,Soundwatch,
6/29/19,2019,6,12:34,7,135,Orca,6,Ts,,,Other,Soundwatch,
9/18/18,2018,9,17:10,7,135,Orca,~25,K,,,Other,WW,Wild Whales Vancouver
8/1/18,2018,8,,7,135,Orca,~10,J,,,Other,WW,Wild Whales Vancouver
7/16/18,2018,7,13:30,7,135,Orca,~6,J,,,Other,WW,Wild Whales Vancouver
8/14/17,2017,8,12:43,7,135,Orca,5,Ts,,"T46s, T122",Other,WW,Wild Whales Vancouver
7/16/17,2017,7,12:00,7,135,Orca,6-Apr,Ts,,,Other,WW,Wild Whales Vancouver
7/23/22,2022,7,12:32,18C,136,Orca,,J,,,Other,Soundwatch,
5/24/22,2022,5,14:23,18C,136,Orca,,J,,,Other,Soundwatch,
9/5/21,2021,9,14:58,18C,136,Orca,24,,J,,Other,Soundwatch,
9/5/21,2021,9,14:27,18C,136,Orca,24,,J,,Other,Soundwatch,
7/5/21,2021,7,13:56,18C,136,Orca,10,T,,Likely forage but no evidence,Other,Soundwatch,
7/5/21,2021,7,13:26,18C,136,Orca,10,T,,,Other,Soundwatch,
7/5/21,2021,7,13:02,18C,136,Orca,10,T,,Maybe babies,Other,Soundwatch,
8/20/19,2019,8,13:57,18C,136,Orca,18,J,,Behavior: 1 tail slap; Watched whales bow ride in between counts!!,Other,Soundwatch,
8/20/19,2019,8,14:57,18C,136,Orca,15,J,,,Other,Soundwatch,
7/29/19,2019,7,14:30,18C,136,Orca,5,T065s,,,Other,Soundwatch,
7/25/19,2019,7,12:57,18C,136,Orca,2,T077C; T07,,,Other,Soundwatch,
7/20/19,2019,7,16:04,18C,136,Orca,10,Ts,,Behavior: tail slap,Other,Soundwatch,
6/29/19,2019,6,14:58,18C,136,Orca,7,T046s; T04,,Behavior: 2 spyhops,Other,Soundwatch,
6/28/19,2019,6,13:29,18C,136,Orca,13,T065As; T0,,,Other,Soundwatch,
6/23/19,2019,6,12:29,18C,136,Orca,6,T065s,,,Other,Soundwatch,
4/28/18,2018,4,14:51,18C,136,Orca,7-Jun,Ts,,"T123's  
T36A'S",Other,WW,Vancouver Island Whale Watch
9/7/18,2018,9,14:35,18C,136,Orca,4-Mar,Ts,,T37's + T99's,Other,WW,Wild Whales Vancouver
5/13/18,2018,5,15:15,18C,136,Orca,8,Ts,,unknown,Other,WW,Wild Whales Vancouver
6/13/17,2017,6,,18C,136,Orca,,Ts,,T65As.  Hunting,Orca Network,Reliable,David Howitt
6/13/17,2017,6,12:35,18C,136,Orca,12-Nov,Ts,,"T77, T124",Other,WW,Wild Whales Vancouver
6/13/17,2017,6,12:04,18C,136,Orca,15-Oct,Ts,,,Other,WW,Wild Whales Vancouver
6/13/17,2017,6,11:27,18C,136,Orca,0,Ts,,,Other,WW,Wild Whales Vancouver
8/9/22,2022,8,12:57,18C,137,Orca,,J,,,Other,Soundwatch,
8/9/22,2022,8,12:26,18C,137,Orca,,J,,,Other,Soundwatch,
7/29/22,2022,7,11:06,18C,137,Orca,,L,,,BCCSN,Reliable,
6/28/19,2019,6,12:58,18C,137,Orca,13,T065As; T0,,Behavior: 2 tail slaps; 1 breach,Other,Soundwatch,
6/28/19,2019,6,12:27,18C,137,Orca,13,T065As; T0,,,Other,Soundwatch,
6/23/19,2019,6,11:01,18C,137,Orca,10,T036s; T06,,Behavior: 1 breach; 3 tail slaps; Bellingham,Other,Soundwatch,
5/26/19,2019,5,15:05,18C,137,Orca,2,T101s,,Behavior: Breach,Other,Soundwatch,
5/26/19,2019,5,13:56,18C,137,Orca,2,T101s,,,Other,Soundwatch,
4/28/18,2018,4,,18C,137,Orca,13-15,Ts,,"T100's, T101's, T123's",Other,WW,Wild Whales Vancouver
8/26/17,2017,8,12:07,18C,137,Orca,8-Jun,Ts,,T37As,Other,WW,Wild Whales Vancouver
8/14/17,2017,8,16:21,18C,137,Orca,5,Ts,,T46s,Other,WW,Wild Whales Vancouver
8/26/17,2017,8,13:45,18C,137,Orca,5,Ts,,ID: T37As (mom +4 kids) + 1 other,Other,WW,Orcas Express
5/29/17,2017,5,14:00,18C,137,Orca,30,Ts,,T124s; 3 or 4 groups,Other,WW,Deb
4/29/17,2017,4,14:30,18C,137,Orca,20-25,Ts,,,Other,WW,Orcas Express
4/7/22,2022,4,17:40,18C,138,Orca,,J,,,BCCSN,Reliable,
4/7/22,2022,4,17:40,18C,138,Orca,,J,,,BCCSN,Reliable,
4/7/22,2022,4,17:40,18C,138,Orca,,J,,,BCCSN,Reliable,
4/7/22,2022,4,17:40,18C,138,Orca,,J,,,BCCSN,Reliable,
11/8/19,2019,11,16:45,18C,138,Orca,,T,,Feeding,Other,TWM,Jeanne Hyde
8/2/19,2019,8,12:30,18C,138,Orca,6,T,,T65As,Other,TWM,Jeanne Hyde
6/16/20,2020,6,15:35,18C,138,Orca,,,,"T046B1s, T123s",Other,TWM,Jeanne Hyde
10/24/19,2019,10,15:20,18C,138,Orca,,JL,,"J Pod, L47s, L72, L90, L87; Enc #88",Orca Network,CWR,Dave Elifrit
5/26/19,2019,5,15:35,18C,138,Orca,3,Ts,,T101s,Email,WW,Vancouver Island WW Co
8/6/19,2019,8,,18C,138,Orca,4,Ts,,T18's. Photo T019C hunting in afternoon.,Orca Network,Reliable,Mark Malleson
6/30/19,2019,6,11:30,18C,138,Orca,4,Ts,,T65Bs and T65A2,Other,Reliable,Jeanne Hyde
6/25/19,2019,6,12:30,18C,138,Orca,1,Ts,,T124A2 and ?,Other,Reliable,Jeanne Hyde
3/16/19,2019,3,14:00,18C,138,Orca,,,,"T19's/T49A's (ID: T49A1, T49A's, T19B, T19C, T19 by Melisa Pinnow). End sighting 15:30.",Orca Network,Reliable,David Haeckel
6/8/19,2019,6,11:00,18C,138,Orca,1,Ts,,T124C,Other,Reliable,Jeanne Hyde
5/10/19,2019,5,18:00,18C,138,Orca,4,Ts,,T123s,Other,Reliable,Jeanne Hyde
7/30/19,2019,7,13:20,18C,138,Orca,5,Ts,,T65As minus T65A2,Email,WW,Vancouver WW Company
7/10/19,2019,7,17:12,18C,138,Orca,6,Ts,,T65As,Email,WW,Vancouver Island WW Co
7/10/19,2019,7,18:00,18C,138,Orca,6,Ts,,T65As,Email,WW,Vancouver Island WW Co
